,company,job,title,question,answer
60,(주)펫닥,IT/웹/통신,"헤드헌터 통해서 연락오고 1,2차면접 진행됨 그리고 계속 노티 줌 딱히 기억에남지는 않음""","간단한 자기소개 및 동기,포부 등 무난함
마케팅이 뭐라고 생각하는지",면접자들이 하나같이 부정적인 느낌이었음..그냥 무난함
61,마케비전코리아(유),IT/웹/통신,"인사파트 실무파트 한명씩 면접 진행. 실무관련 질문과 이력 관련 질문 위주""",너무 오래돼서 기억은 잘 나지 않으나 실무책임자가 자사 기술에 큰 자부심을 가지고 있는것 같음,실무적으로 인터뷰이를 내려다 보는 분위기 인사파트 쪽 담당자는 편안한 분위기로 대화를 이끌어가려는 느낌
62,(주)더브이플래닛,IT/웹/통신,"이력서 제출 -> 서류 합격 -> 면접 -> 전화로 결과 확인 -> 입사""","1. useMemo, useCallback의 차이
2. 최근 관심 있는 기술
3. 협업 경험",자세히는 기억 안 나지만 신입으로 지원해서 리액트 관련 질문들 위주로 받았던 기억이 있습니다.
63,(주)아이포트폴리오,IT/웹/통신,"서류전형 - 코딩테스트 - 1차면접 - 2차면접""","1. 해당 포트폴리오에서 추가 개발을 한다면 어떤 기능을 하고 싶은 부분은 ?
2. 포트폴리오에 대한 기능을 어떻게 구현 하였는지
3. 해당 기술은 어떻게 구현 하였는지","전형 마다 채용 담당자님이 아주 친절하게 전형 안내를 해주십니다.
면접 진행중에도 너무 긴장해 보였는지 긴장 풀으라고 면접관님들께서 좋은 인상으로 긴장을 풀어주시고 너무 좋았습니다.
다른 회사의 정형화된 질문이 아닌 생각하는 질문이 많아 너무 좋은 경험이었습니다."
64,(주)모아이스,IT/웹/통신,"블로그 보고 CTO한테 먼저 연락와서 과제전형 진행하였음""",그 당시 모아이스 어플 다운 받아보고 너무 실망해서 과제를 대충해서 냈더니 ㅋㅋㅋ아주 인생 훈계를 장황하게 늘어놔서 당황함.,무례하고 선넘는 CTO 덕에 2년 전에 면접 봤는데 아직도 종종 망했나 안망했나 찾아봄.
65,(주)와탭랩스,IT/웹/통신,"면접의 단계가 많습니다. 그만큼 일에 대한 책임감을 가지는 사람을 뽑으려고 하는듯""","개인프로젝트 실행 방법
프로젝트 아키텍처
끝.",아직도 많이 부족한게 많다고 느꼇습니다.
66,(주)카카오모빌리티,IT/웹/통신,"최종까지 약 4-5개월 소요되었고, 면접 난이도 꽤 높았습니다""","프로젝트 경험안에서 다양하게 질문합니다.
개선 과정에 대해 디테일하게 질문합니다.",본인이 직접 주도해서 해보지 않으면 답변하기 꽤나 어려울 것 같습니다
67,(주)웨일소프트,IT/웹/통신,"사람인 취업공고를 보고 연락.
서류합격과 면접 일정을 전화로 이야기함.
약속 일정에 회사에 찾아가서 1대1면접을 진행함.""",어려운 질문은 없었고 제출한 포트폴리오를 같이 보며 사용한 기술과 어떻게 개발했는지 대화를 나누며 편안한 분위기에서 면접이 진행됨,면접 난이도는 낮으니 부담없이 면접에 임하면 되지만 책임감과 의지는 보여주어야함
68,에이씨앤티시스템,IT/웹/통신,"이력서 지원 후 2주내 연락, 전화로 면접통보를 한다""","전회사의 퇴사사유, 이러이런일들 할 수 있냐, 어떻게 했냐","해당업무에 대한 지식이 전무하고, 해당업무의 필요성이나 중요성을 느끼지 못하고 있음"
69,사이테크놀로지스(주),IT/웹/통신,"워크넷으로 입사지원 후에 회사 대표님한테 직접 전화왔음. 다만 다른 일 하느라 못받았다가 다시 전화했더니 손님들이랑 얘기하고 있다고 그 다음날 전화달라고 말씀하심. 그리고 그 다음날 면접 참석""","1. 영어로 3분동안 얘기해보세요.
2. 자신의 인생에 대해서 영어로 얘기해보세요","답변 3분동안 하는건 너무 길기도 하고 할 말도 없어서 면접관 한 분이 인생 살아온 얘기 해보라고 해서 주저리주저리 함. 그리고 입사하지도 않았는데 범죄기록 확인 동의서같은거 쓰라고 하고 건강에 이상없다라는 서류같은것도 쓰고, 제일 웃겼던건 회사의 이름과 나라는 주제로 원고지에 글을 써라했습니다. 참 신기한 경험이었네요."
70,(주)제나,IT/웹/통신,"당시 인원이 없어서 채용하고 근무하는데까지 빠른속도로 진행되었음
면접당일 사무실 환경도 괜찮아보였어요""","1. 해본 프로젝트중 OO는 어땠는지
2. 우리 OO프로젝트 예정인데 잘 할수있는지..
3. ??..워크샵을 자주갈건데 괜찮나요",뭐 어렵지 않게 잘 통과했습니다
71,(주)올리브헬스케어,IT/웹/통신,"서류합격하고 면접진행,,하얏다, 무난히 진행한 경헌,,,,""","중요하개 샹각하는 가치, 힘들 ㅒ애 이겨내는 방법",무난히 합격하겟다
72,컨펌,IT/웹/통신,"전화로 합격 연락이 온 후 면접을 봤습니다
약 30,40분정도 진행했습니다""",그간의 경력에 대해 물어보았고 자소서에 있는 내용들과 직원들간의 단합에 대해 중요성을 강조 했던 것 같습니다,전체적으로 편안한 느낌이었습니다
73,한국에너지종합기술(주),IT/웹/통신,"취업사이트에서 자소서 제출하고 서류합격 후 화상면접 진행하고 1달정도 뒤에 입사""","풍력발전기에 대한 질문, 키 및 몸무게, 병역사항, 고소공포증 및 폐쇄공포증 유무","풍력발전기에 대한 지식을 어느정도 습득하고 면접에 임하고, 회사이름이 길어서 실수하는 경우가 있는데 회사이름을 잘 외우면 좋을듯 마지막으로 요즘은 어떤지 모르겠는데 압박질문 많이 들어왔음 멘탈 잘 챙기고 얼굴에 미소 유지하면서 답변하세요"
74,차봇모빌리티(주),IT/웹/통신,"1차 직무면접 2차 임원면접(컬처핏)
인사팀이 안내와 클로징""","입사 후 하고 싶은 일은 무엇인지
포트폴리오 관련 질문들","직무면접은 전문성을 바탕으로한 예리한 질문들 많아 좋았음
임원면접은..그저그럼"
75,(주)컨텍,IT/웹/통신,"기술면접 후 임원진 면접이 있었습니다.""","어떤 연구를 진행하였는지, 지금 분야와 다른 업무를 받아도 괜찮은 지","상세히 잘 들어주시고, 응원해주셨습니다."
76,(주)두산디지털이노베이션BU,IT/웹/통신,"인적성 -> 1차면접-> 최종면접
1차면접시 인성 기술 같이 면접봄""",팀내에 적응하지못하는 팀원이있다면 어떻게 할것인지 구체적으로 말해라,"어떻게 잘 둘러댐
케바케겠지만 기술면접보다는 인성면접을 더 크게보는듯함"
77,링커블(주),IT/웹/통신,"이력서를 제출 후 연락이 와서 회사 회의실에서 면접""","1. 어떻게 회사를 알고 왔는지
2. 이전 프로젝트에서 가장 자랑스러운 부분
3. 문제가 있을때 어떻게 해결하는지","평범한 질문들이 많았습니다. 준비한대로 대답하게 되었고, 대화를 주고 받는다는 느낌은 없었습니다. 이력에 대해 질문하거나, 정확한 경험을 답할 수 없는 질문이 많았습니다."
78,(주)노버스메이,IT/웹/통신,"서류 합격 후 유선 연락을 통해 면접 일정을 조율하였습니다.""","어떤것을 배웠는지, 포폴에 대한 상세 질문, 이 회사에 들어와서 필요한 지식이 많을텐데 얼마만에 공부를 끝낼 수 있는지 등등","면접시간보다 일찍 도착했으나 약속된 면접 시간이 지나서야 면접을 시작하셨습니다.
질문이 명확하시지 않아 대답이 힙들었습니다. 면접시간 내내 서로에게 답답했던 시간이었다고 생각합니다. 많은 면접을 가보았지만 이 곳은 압박면접이라 말하기에도 뭣한 면접이었습니다. 나름 압박면접의 느낌을 내려 면접자의 허점을 파고드는 질문을 하고 면접자를 당황시키려 하시는..."
79,(주)다인리더스,IT/웹/통신,"학교에서 어떤거 배웠는지 어떤 기술 사용 가능한지 등등 물어봄""",오래전이라 기억은 잘 나지않지만 언어 관련 질문이 많았다,면접을 빡세게 하는곳은 아니라 합격하기엔 편함 들어가서가 힘듬
80,(주)프롬마인드,IT/웹/통신,"인터넷접수도 아니고 sns접수, 합격불합격에 대한 얘기를 합격자한테만 한다고 함(면접자에 대한 예의 없음)""","열정에 대한 생각이 많은 듯, 여러 일을 시키고 싶은지 할 수 있는 능력치 물어봄",면접분위기는 나쁘지 않음. 자유로운 느낌
81,투브플러스(주),IT/웹/통신,"면접은 1차 기술면접, 2차 대표님 면접으로 이루어졌습니다.
1차 기술 면접은 잡플래닛이나 다른 후기들에 언급된 기술 면접들이 그대로 질문으로 나왔고 2차 대표님 면접은 인성 면접으로 이루어졌습니다....""","1. Vue.js 쓸줄 아는지?
2. 프론트 업무 외에도 sql을 다뤄본다는지 하는 업무 할 수있는지?
3. 사람관계 어떤지?",회사에서 React 보다 당장 Vue.js를 능숙하게 사용하는 개발자를 원하는구나. 라는 느낌을 받았습니다.
82,(주)팬택씨앤아이,IT/웹/통신,"1차 실무진+임원 면접(면접관 5명), 2차 임원 면접(면접관 2명)으로 진행했습니다.
2차 면접 후 회사 또는 헤드헌터 어느쪽의 문제인지 모르겠지만 합격 여부를 알려주지 않았습니다(즉, 불합격).
보통...""","과거 세무조사 경험시 이슈사항, 만약 입사후에 공고와 다른 직무(유관 직무 내)를 맡게 되면 어떻게 할 것인지 등","채용 회사가 아닌 계열사 팀장까지 면접관으로 참여하고 질문도 디테일한 내용을 여러개 물어봅니다.
면접을 진행하셨던 분이 제 답변 중에 한 번 웃음을 힘들게 참으시던데, 무슨 말을 하는 와중이었는지 기억은 나지 않지만 시종 진지한 이야기 중이었고 많은 면접 경험 중 처음 겪어보는 상황이어서 도대체 뭔가 싶었습니다."
83,(주)마키나락스,IT/웹/통신,"코딩 테스트 - 기술 면접 (1차, 2차) - 임원 면접 - 오퍼""","딥러닝/머신러닝 관련된 기초
코딩 기초
세부적인 이력서 관련 질문","배려심 있고, 막히는 질문이 있을때 잘 리드를 해주심"
84,(주)에이티웍스,IT/웹/통신,"온라인 지원뒤에 연락와서 기술 + 인성 면접으로 진행함
다짜고짜 40분안에 게시판 만들어보라고 합니다.
게시판 만든거에 대해서 질문을 하고
그러고 나서 인사담당자가 와서 인성 면접을 진행합니다.
발표는...""","지원동기, 개발자하는 이유, 파견 어떤지","옛날 리뷰보면 손코딩이나 시험식으로 한다고 되어있어서
그런줄 알고 갔는데
면접자리에서 게시판 구현해보라고 해서 좀 당황했었던 기억이...
기술 + 인성을 한번에 봐서 편했었습니다."
85,(주)퍼즐에이아이,IT/웹/통신,"전화 연락 후 방문함.
사무실은 신논현역 근처, 병원 건물 근처에 있는데 찾아가기 수월한 편은 아님.""","(어눌한 한국어를 마치며) 영어로 인터뷰 보겠다.
홈페이지에서 나오는 정보 외에는 우리회사 아는거 없냐
(다닌 회사 경험을 이야기하는 부분을 헷갈리며) 그래서 이게 어디 경험이라고?
그런것도 모르는데 내가 널 왜 뽑아야 되냐","면접에 늦음
말 잘라먹음
거만함.
설령 고액연봉으로 붙었다 하더라도 이런 면접관과 일하기 싫어서 중간부터 미련 싹사라짐."
86,(주)아이디,IT/웹/통신,"1차로 보기로 하였으나 연락두절 후 다시 연락이 와서 2차로 다시 약속을 잡고 다시 면접을 보러 이동하였으나 면접당일날 다시 펑크를 냄 3차로 약속을 어기지 않겠다는 말을 듣고 면접을 보러감""",1.이일에 대하여 알고있는것이 있는지,진짜 이회사는 사원들에게 리스크만 안겨주는 회사이다
87,(주)델리오,IT/웹/통신,"잡포털로 지원했고 대표가 전화와서 면접 요청""",1. 왜 지원했냐 2. 어떤 가능성을 보고 있냐 3. 왜 잘할 수 있냐고 생각하나,대표가 아우라가 매우 컸음
88,(주)꾼,IT/웹/통신,"면접은 이회보았습니다. 이회 면접 후 계약서 서명까지 진행했지만 거절했습니다.""","계약서 내용이 일반적이지 않음
퇴사자 험담은 있지만 대표로서 동료로서 본인의 잘못이나 책임은 없음",입사를 추천하지 않습니다
89,(주)딥바이오,IT/웹/통신,"거의 40분이상 면접진행 했었고 면접을 자세하게 보는 느낌이였다. 면접비 지급되었고 면접후 입사하고 싶은 느낌은 아니였다. 인사담당자와 팀장외 팀원도 면접관으로 참석함.""","이전회사에서 하던 업무, 업무하면서 회사에 손해를 끼쳤던적이 있었는지 등",무난했지만 면접시간이 너무 길었던점은 별로 였다. 긴 시간대비 질문들이 제대로 준비되지않은느낌.
90,(주)플레이팅코퍼레이션,IT/웹/통신,"문자 연락 후 유선소통으로 면접일 픽스, 팀장과 일대일 면접""","자신은 어떤사람인가요?
일이 힘들수도 있는데 괜찮나요?
성격의 장단점?",긍정적으로 바라보심
91,(주)핫셀러,IT/웹/통신,"사람인으로 지원했고 면접 > 연봉협상 > 채용 순으로 진행했습니다""","1. 우리 회사가 어떤 업무를 하는지 구체적으로 아는지?
2. 내가 맞는 직무를 한 마디로 표현해본다면?
3. 집이 먼데 괜찮은지?",친근하게 잘 해주셨고 일에 진심이신 분들이라고 느꼈습니다
92,(주)카카오엔터프라이즈,IT/웹/통신,"서류 지원 - 코딩 테스트 - 1차 면접""","자기소개
기본적인 ML/DL 이론 지식
포트폴리오 기반 세부 질문",면접관 세분 모두 너무 친절하시고 긴장 풀어주셔서 분위기는 좋았습니다. 친구한테 이야기하듯 하라고 편하게 해주셨습니다.
93,(주)콜리,IT/웹/통신,"채용사이트 - 채용사이트 통해 연락 - 알람 - 면접
인사팀 연락도 없고 연락처가 없어서 도착해서 대략 난감""","1. 자기소개, 퇴사사유
별 특별한 질문은 없었음","아...여기는 합격해도 안가야지..
면접관 주장이 강해서 듣는둥 마는둥 했음"
94,(주)아이티언,IT/웹/통신,"간단한 네트워크 지식을 물어봄.. osi 7계층, 로드밸런싱이 무엇인가""",네트워크 지식 간단하게 물어보고 호구조사 이것저것 물어봐서 기억에 남는건 없음,편안한 분위기에서 진행됐고 나쁘지 않은듯
95,(주)알체라,IT/웹/통신,"1차 면접, 2차 면접 진행 후 처우 협의""","직무에 관한 질문, 인성 질문이 주로 많았습니다",면접관들이 면접 분위기를 편하게 만들어 주어 답변을 잘 할 수 있었습니다.
96,(주)엔씨엘,IT/웹/통신,"지원 -> 면접제의 -> 면접 -> 채용""","졸업 학교, 전공, 인성 위주의 질문이었습니다.","신입이라 대체적으로 면접 난이도가 쉬웠습니다,"
97,한국축산데이터(주),IT/웹/통신,"채용포털사이트를 통해 지원 후 서류합격으로 면접 일정 조율로 연락이 왔습니다.""","1. 지원동기
2. 직무 경험
3. 퇴사 사유","면접장에서 지원자를 안보고 이력서만 보면서 질문을 이어나갔습니다.
면접 분위기는 대체로 가벼웠습니다.

하지만 합불 여부는 한 달이 지났는데도 알려주지 않았습니다."
98,(주)휴먼스케이프,IT/웹/통신,"굉장히 부정적인 쪽으로 인상적이었던 회사.
시간낭비만 할 수 있으니 정식 프로세스로 진행하지 않는다면 그냥 다른 회사 알아보시는 게 좋습니다.""","본인을 시니어라고 생각하는지? 주니어라고 생각하는지?
이직 사유가 어떻게 되는지?",오히려 면접 보고 별로다 싶었던 회사였네요. 내부에서 시니어를 찾고는 싶은데 못 찾아서 헤매고 계신 상황이 느껴졌습니다
99,(주)디노스튜디오,IT/웹/통신,"임원 면접 - 대표 면접순으로 진행하나 상황에 따라 대표 면접만 진행""","어떤 방식으로 마케팅을 할 것 같으세요?
비전이 무엇이세요?",대표가 센스있습니다. 무겁지 않은 분위기
100,(주)하우저,IT/웹/통신,"서류 제출 이후 기술 면접 날짜 잡아서 진행하여 진행""","레거시 및 클라우드 관련 질문, spring 버전 , DB, nosql 등 관련하여 질문 받음",경험 한부분에 대하여 설명
101,(주)뉴빌리티,IT/웹/통신,"먼저 제의가 와서 HR팀과 먼저 연락 주고 받고 일정 잡았고 직접 방문해서 일대일로 면접 진행 1시간 넘게 진행했음.""",학교 학점 질문은 처음이었어서 기억에 남고 나머지는 보편적인 질문,전반적으로 경청해주셨고 다양한 얘기를 편하게 나눌 수 있어서 좋았음
102,애니펜(주),IT/웹/통신,"인터뷰는 총 2회, 서류통과 후 실무면접 통과 후 임원 면접 과정으로 진행됨""","다른 지원자보다 나은점, 장점, 취미",실무면접 분위기는 차분하고 긴장하지 않게 도와주셔서 좋았다
103,(주)휴톰,IT/웹/통신,"10분전에 미리 도착함
다른곳 대기하다가 시간 딱 맞춰서 면접실 입장
1분뒤 면접관 입장
아이스브레이킹 시도하려고 하니 면접관 소개 함
PM쪽 리드가 없어 면접관이 CTO와 MA 헤드(전무??)가...""","지원자님이 만약 우리 제품을 처음부터 리뉴얼해야한다면 어떻게 하겠나요?
우리는 개발론이 워터폴에 자주 개발범위가 뒤집어지는데 괜찮나요?
우리랑 지원자님의 이상향이 안맞는데 괜찮나요?
정보의 공유가 잘 이루어지지 않으면 어떻게 할건가요?","면접 보고 느낀점은 기존에 있는 PM리드는 빡쳐서 나간것같고
다른 Pm들은 컨트롤이 안되는 느낌
CTO분도 산학에 있다가 이직하신지 4개월?정도 된 상태라 이것저것 열심히 바꾸려고 하는데 힘겨워하는 느낌
순간 쌔함이 느껴진 부분이 있었는데
정보의 공유가 잘 이루어지지 않으면 어떻게 해야하나요? 라고 했을때 내가 그럼에도 불구하고 열심히 정보를 공유받을..."
104,에스씨지랩(주),IT/웹/통신,"어려운 질문은 없었고 1:1로 편안하게 이야기할 분위기를 조성해주셔서 좋았습니다.""","-기획이란 무엇이라 생각하는가
- 기본적으로 준비해오는 건 2가지 이야기하라고 했습니다 (장단점 2가지, 취미 2가지 등)",1번은 생각하는 것을 정해진 리소스 내에서 최대한의 아웃풋을 내기 위해 문서화하는 과정? 준비하지 않은 질문이라 두루뭉실하게 답변함
105,(주)엔큐컨설팅,IT/웹/통신,"인성 면접과 기술 면접을 동시에 보는 구조
기술부 1명과 관리부 1명이 들어옴""","요즘 사회적 이슈 등 본인에 생각을 물어봄
L4 나 웹 방화벽에 운영 여부 .?","그냥 불편하지 않은 분위기에서 면접을 봤습니다
기본적인 질문만해서 어렵지 않았스미다."
106,(주)지메이트시스템즈,IT/웹/통신,"최초연락오고 2주 후 연락이 왔고 면접 잡고 또 2주정도 기다림""",어떤 프로젝트를 했는지 물어봤고 오래 다녔으면 좋겠다고 함,어렵지 않았음
107,(주)케이닥스,IT/웹/통신,"1,2차 면접으로 진행했고 간격은 일주일 간격이며, 결과는 금방 나왔습니다""","코인에 대해 아는지, 야근에 대해 어떤지, 어떤 업무를 해왔는지",난이도가 어렵다 생각은 들지 않았습니다. 분위기 좋았음
108,(주)피아이랩스,IT/웹/통신,"다양한 질문들을 한다 질문의 난이도는 높지 않으나 평이했다.""",본인의 강점과 해왔던 일들 앞으로의목표 등을 물어보았다,친절하고 내부 직원간 분위기가 좋다고 느꼈으며 다양한 경험을 할 수 있다고 생각한다.
109,(주)클라우드메이트,IT/웹/통신,"그냥저냥 무난했던 기억 별로 크게 어려운 느낌은 없었던 것 같음....""",자기소개 이전 직전 경력에 대한 질문과 답변 간단한 직무 테스트 하고 싶은 일에 대한 이야기 1차 기술 2차 대표 면접,아는대로 대답
110,(주)티피엠엔,IT/웹/통신,"이력서 보고 1차 면접 일정 정하고 본사에서 면접자 1명에 면접관 3명 들어와서 대면 면접 진행""",전체적으로 이력서에 기반하여 질문을 하는 편이었으나 꼬리 물기 질문이 한 번 있었던 것으로 기억함,꼬리 물기 질문 내용이 업무에 관한 부분이었는데 유쾌하지는 않아서 돌려 말하기 힘들었음
111,(주)다온링크,IT/웹/통신,"실무진과의 면접 후 대표님과 면접이 있었습니다.""","다 뻔한 질문들이였습니다. ""이전 회사에서는 왜 퇴사 했느냐"", ""이쪽에는 왜 지원했느냐"", ""연봉은 어느정도 생각하느냐"" 어딜 가든, 어디서든 들을 수 있는 그런 질문들 이였던 거 같습니다","부담되는 것도 없고, 현재 프로젝트의 상태에 대해서도 솔직하게 답변해 주셨고 다 좋았습니다. 기술적인 질문은 조금 밖에 없었구요. 다만 거짓말이 좀 섞여 있었던 점이 많이 아쉽습니다."
112,카테노이드(주),IT/웹/통신,"면접 횟수 2번에 마지막은 대표님까지 해서 3번 보는것같은데 시간이 너무 길었다.""","자기소개
회사 설명
간단한 경력서에대한 설명
질문 요약",무난한 면접 분위기
113,(주)한국금융솔루션,IT/웹/통신,"편안한 분위기에서 진행되었으며,
기존 개발 했던 내용을 이야기하였다""","해당 프로젝트에대해서 물어봤으며,
앞으로 이런 프로젝트를 진행한다고 이야기했다","서로간의 이해도에 대해서 확인하였으며,
실무 가능한지 이야기랬다"
114,정보와기술(주),IT/웹/통신,"원하는 연봉, 프로젝트 기여 내용, 스킬 보유 현황 등 세세하게 물어보진 않았다.""",얼마 받고 싶어요? 라는 질문이 가장 기억에 남는다. 최대 관심사이기 때문이다.,원하는 금액을 말했고 협의가 들어갔지만 만족스러웠다. 보통 이런 질문에는 높게 부르는게 맞는 것 같다.
115,인스타페이(주),IT/웹/통신,"창고같은 사무실에서 30분정도 업무와 상관없는 회사의 역사와 대표의 인생사를 듣고 합격했다""",위아래로 요동치는 곡선을 그리면서 바닥을 쳐야 위로 올라온다는 이야기를함,면접 후 바로 합격했지만 아 내가 여기밖에 다닐곳이 없구나 하면서 울며 겨자먹기로 출근한다고 했음
116,(주)데이블,IT/웹/통신,"인사팀에서 메일이 와서 면접 일정을 조율하고, 1차/2차 비대면으로 진행""","3년 혹은 5년 후에 어떤 직원이 되고 싶은지 물어보셨고
팀 간 커뮤니케이션이 원활하지 않을 때나 사람 간의 협업 질문이 많았다",대체적으로 모두 젠틀하고 나이스한 느낌
117,소다크루(주),IT/웹/통신,"1차개발자 면접 , 2차 경영진 면접으로 진행됩니다
면접 사이에는 1주일 가량 경과되었습니다""","1. 어떻게 지원하게 되었나
2. 앞으로 어떻게 성정하고 싶나
3. 글로벌 비즈니스에 대한 생각은","원격으로 진행됩니다.
편안한 분위기로 면접을 볼 수 있어요"
118,(주)와이어바알리,IT/웹/통신,"면접은 온라인 실무면접 후 합격하면 대표-부대표 인성면접을 보는 형태
실무면접은 해왔던거 위주로 물어보고 인성면접도 크게 어렵지 않음""","인성면접에서는 일하는 태도에 관해서 많이 물어봄
어떻게 만들었는지, 무엇때문에 했는지 의도를 물어보는 질문이 많음","회사에서 시켜서 했어도, 그 안에서 본인이 주도적으로 했던 업무들에 대해서 자세하게 얘기함"
119,아미정보통신,IT/웹/통신,"이제 오래 되었지만 빠르게 면접 보고 빠르게 합격""","어떤 일을 주로 했는가?
주로 AS 관련 질문을 받았다.",AS 면접 본것이라 그닥 신경 쓸건 없었다
120,(주)코보시스,IT/웹/통신,"지원후 일주일이내로 연락이 와서 면접약속을 잡고,
1차 면접은 3:1 형식으로 직무와 스킬에 관한 인터뷰를 진행했습니다.
ex. 이직 및 퇴사한 계기, 자소서와 포트폴리에오 있는 스킬 질문""","스킬질문(프로그램 사용에 대한), 유튜브 영상관련, 지원자 성격","3:1 형식으로 면접을 보게되니 분위기나 위압감이 없지않아 있었고, 충분한 답변을 소화해 내지 못한것같습니다. 대비를 잘 하셔야 겠습니다."
121,(주)생각하는늑대,IT/웹/통신,"인터뷰 시간을 몇가지로 정리해서 거기서 시간대 골라서 면접 봄 이렇게 본 곳 처음이여서 첫인상은 괜찮았음.""",엠비티아이 물어봄. 그리고 전 회사는 무슨일 하는 회사인가 거기서 맡은 업무가 무엇인가 그런 평범한 질문 받음.,나쁘지도 않고 좋지도 않았다
