,company,job,title,question,answer
122,(주)이큐브랩,IT/웹/통신,"여지껏 살면서 겪었던 면접 중 가장 산뜻하고 재밌었습니다. PM 끼리 얘기하는게 즐겁다고 느껴졌습니다.""","포트폴리오의 디테일과 어떻게 진행할까요? 등 지원자의 역량을 뽑낼 수 있는 환경을 만들어주셨고, 이걸 비즈니스 임팩트로 연결지을려면 어떻게 할 것인지에 대한 질문. 평소 데이터에 대한 생각이 많았으므로 편하게 대답했습니다.","직무에 대한 프라이드를 느끼게했던 면접이며, 면접 후기와 오히려 더무 달라서 당황하기도 했습니다"
123,(주)아이트립,IT/웹/통신,"1:1면접으로 이루어졌으며 간소한 질문들이 진행되었습니다""",사는곳이랑 외국어 사용 유무에 대해서 엄격하게 물어봤습니다,편안하게 진행한 면접이었으며 분위기가 좋았던 기억이 납니다
124,(주)스키아,IT/웹/통신,"테스트 이후 테스트를 기반으로 면접을 진행합니다.""","mri나 ct 사진이 아닌 실제 사진을 볼 수 있는데 괜찮겠냐, 해부학 공부를 해야하는데 괜찮느냐, 궁금한 점",평범한 면접 이었습니다. 다만 의료쪽에 종사하셨던 분을 원하는 것 같았습니다.
125,테이블온(주),IT/웹/통신,"전반적으로 평이 하고 편안한 분위기 였다""",경험에 대해서 물어보는 질문이 대다수 였다,괜찮았다
126,로지스팟(주),IT/웹/통신,"서류 사람인지원--1차면접--처우협의 하는 순서대로 진행됩니다""","면접질문
1.로지스팟을 아냐
2.그동안한 해왔던 커리어 대한 질문
3.미래에 대한질문들
등등","흠... 스타트업에서 성장해왔지만
딱 중소와 스타트업 사이에 있는회사?
뭔가 큰뜻을 가지고있지만 결국 바라만보고 있을거 같은 느낌이 많이 들었습니다"
127,텀블벅(주),IT/웹/통신,"서류전형 -> 과제전형 -> 기술면접 -> 임원면접""","1. javascript 관련 질문
2. 로또에 당첨되면 어떻게 할 것인지?
3. 이직사유",사내에서 구성원들이 모두 하나의 목표를 이해하고 싱크가 잘 맞아야 한다는것을 중요하게 생각함
128,(주)쇼우테크,IT/웹/통신,"딱히 면접이랄건 없고 기간제 일할 사람 많이 뽑는 편이다""",공공문서 접해본 적 있는지 무거운거 드는거 괜찮은 지 물어봄,그냥 기간제 아르바이트 뽑는 질문이고 서로 조건만 맞음 되는 것 같다
129,(주)스룩,IT/웹/통신,"이력서 제대로 안 읽고 면접관이 들어옵니다. 이력서도 제대로 확인 안하고 면접비도 안 주면서 왜 오라가라 하는지 이해할수없네요. 스룩은 업무가 별로 없나요? 면접관이면 팀장 이상일텐데 이력서 하나 제대로 안보고...""",이력서에 적힌 기본 사항을 이제서야 봤다는 듯 한 말투가 인상깊었습니다.,면접자에대한 예의가 없는 면접이었습니다. 다신 경험하고싶지 않네요.
130,(주)비지피웍스,IT/웹/통신,"주어진 과제를 제출한 뒤 면접을 두 차례 보고 연봉협상 절차를 거쳐 채용.""","회사의 서비스를 어떻게 개선시킬 수 있는지, 어떤 방식으로 기여할 수 있을지에 대한 질문",서비스에 대해 공부한 뒤 적절한 답변을 했습니다.
131,(주)알통,IT/웹/통신,"개인적인 질문을 다수 했으며 면접 분위기는 무척 좋은편""",지원한 직무 외 다른 직무를 시켜도 문제없는지에 대한 질문,"편하게 질문, 대답할 수 있는 환경을 만들어준다. 나쁘지않은편"
132,(주)닥터다이어리,IT/웹/통신,"최초 연락은 전화와 문자 연락, 25분간 면접 보고 끝난 후 20분 뒤 원티드로 불합 통보. 역대급으로 기분 나쁜 면접 경험이였습니다. 이럴거면 왜 불렀나요? HR담당자랑 PM만 들어오고 정작 PD는 들어오지도...""","1. 이력서 보고 대충 실무 경험 질문
2. 우리회사는 이렇게 진행하는데 할 수 있나요?
3. 작업 스타일",시작부터 끝나는 순간까지 기분 나빴어요. 평가질 하려고 사람 부른걸까요? 정시에 시작하지않고 사람 기다리게 했다가 포폴도 제대로 보지도 않았는지 대충 얘기하고 끝났어요. 면접 끝난 후 질문 타임에 궁금한거 물어봤더니 그걸 질문이냐고 하는 반응이였습니다. 저는 디자인 시스템과 문서화하는지 등 기본적인 업무 스타일을 여쭤봤어요. 그게 실례라면 죄송할...
133,(주)스마일서브,IT/웹/통신,"면접을 보고 합격을 하면 바로 연락이 온다""","iptables에 대한 것
리눅스 시스템에 관한것
교대근무에 관한것",면접 자체가 쉽고 분위기가 무겁지 않아 마음이 편했다
134,비씨랩스(주),IT/웹/통신,"실무에 대한 질문을 많이 했고 이력서를 보면서 그동안의 경험에 대한 질문을 많이 했습니다.""","지원동기, 업무강도, 스트레스 관리 방법",면접 분위기는 많이 딱딱하지 않고 편했습니다.
135,(주)딥브레인에이아이,IT/웹/통신,"사람인에서 5년차 경력직을 뽑는데 2년차로 경력 기술서와 포트폴리오, 자기 소개서를 첨부하여 지원했더니 2주 후에 면접 제안이 들어왔다.""","1. 주로 내가 작성한 Main Skill 소개 란을 보고 질문을 했고, Win API를 다룰 때 가장 기억에 남는 기술 하나에 대해 설명하는 질문이었다.

2. 게임에 인공지능을 활용한 경험을 질문했고 현재 회사에 어떤 식으로 적용할 수 있을지를 질문했다.

3. 최적화 관련 경험과 언리얼 엔진에서 UI List View에 관련된 질문이 나왔다.","4대 1면접으로 기술 및 인성, 실무가 섞인 면접의 느낌이었다. 약간은 딱딱한 분위기라 조금 긴장했지만 크게 공격적인 질문은 없었고, 지원자를 배려하거나 이해하려 노력하는 부분이 있어 편안한 느낌도 들었다."
136,(주)도구공간,IT/웹/통신,"1차 면접으로 끝남. 크게 전문적인 지식을 물어보기보다는 시키면 다 할 수 있는지(열정)을 파악하는 듯""","내 분야 말고 다른 것 할 수 있는지, OS가 다양한 환경에서도 일을 할 수 있는지",면접관도 깊게 아는 분야라기보다는 넓게 아는 분야라는 생각이 더 많이 들었음
137,(주)소프트파워,IT/웹/통신,"이력서 넣으니 1차 전화면접이라고 문자로 통보옴. 결과부터 말하면 내 시간이 정말 아까움. 물어보는 것도 전공을 뭘 그렇게 따지는지.. 말투도 무슨 AI가 말하는줄 꼰대성향이 다분합니다. 마지막에 연봉 얼마...""","해당 전공은 동기가 뭐였는지. 성격이 어떤지 , 고등학교 때 몇등했는지 등등 물어봄 정말 쓸때없는 질문이 많음",사실대로 답했고 가고싶지 않은 회사로 걸러져서 오히려 좋았음
138,(주)메이머스트,IT/웹/통신,"이력서에 아무것도 없어도 들어갈 수 있는 문턱이 매우 낮은 회사""",직무 경험이있나? 등.. 나머진 기억이 안남,대체적으로 압박면적은 없어서 편해서 좋앗음
139,세오(주),IT/웹/통신,"합격 전화와서 면접을 봤습니다.
면접은 면접관 두명과 함께 봤습니다.""","1. 기존에 했던 업무는 무엇인가?
2. 퇴직사유
3. 자기소개",편한 분위기에 면접봤습니다.
140,(주)나노스정보,IT/웹/통신,"당일 연락 후 당일 면접 진행.
(무조건 합격이라면서, 다른 곳 모두 합격 및 지원 포기하고 취업 활동도 하지 말라고 함)

회의실이나 별도 공간 없이, 사무실 내 구석에서 면접 봄.
(사무실을 살펴보니...""","경력 및 스킬 여부
음주 여부
흡엽 여부","면접관 태도 매우 예의 없음.

이력서도 미리 읽어보지 않고, 면접 진행하면서 읽어봄.

대단히 예의 없고 불쾌한 회사."
141,(주)비엔시스템,IT/웹/통신,"나라사업지원을 통해서 지원했던터라 그렇게 어렵지 않게 면접을 치뤘습니다.""","디자인관련질문, 프로그램 어떤거 쓸줄아는지, 어디서 사는지등 아이스브레이킹질문을 주셨습니다.",오래되서 기억이 잘안나요 ㅎㅎ
142,이케이웍스(주),IT/웹/통신,"비대면 화상회의로 1차면접진행. 한시간반정도 진행함. 실무적능력을 기준으로 기본기가 탄탄한지를 확인하는시간이었음. 2차,임원면접은 기술면접이 아니므로 적지않겠음.""",DB조회시 수단과 방법을 가리지않고 최대성능을 뽑고싶을때 지원자는 어떤방법을 사용할것인가.,면접의답변보다 이 회사의 개발적마인드나 철학을 느낄수있었다.
143,(주)스패로우,IT/웹/통신,"서류 - 온라인 면접 - 오프라인 면접 (PT 발표)""","컴퓨터 과목 중 어떤 과목이 가장 재밌었는지?
파수에서 컨설턴트의 역할은?",인원이 많아 당황스러웠지만 성실히 대답했습니다.
144,블록스퀘어서울,IT/웹/통신,"데이터 관리하는법? 같은 거 물어봤음 그 외에 파이썬 다뤄봤는지""",기억에 남는 면접 질문은 딱히 없었음 뭘 더 적어야할 지 모르겠네,면접이 그리 어렵다고 생각되진 않고 그냥 뭐 할 줄 아는지만 대답하면됐음
145,오픈엣지테크놀로지(주),IT/웹/통신,"헤드헌터에서 연락오고 이력서 접수 후 바로 면접일정 잡혔고 강남역 사무실에서 면접 진행. 면접관 세명 들어옴.""",컴파일러가 무엇이라고 생각하는가? 이전 직장에서 왜 나오려고 하는가?,일반적인 컴파일러와 딥러닝 컴파일러의 차이점 설명했고.. 무난하게 진행한 것 같으나.. 동종업계 이직이다보니 너무 내가 조심스러워서 제대로 말을 못했;;; 사실 꼭 가고싶었던 회사도 아니어서 아쉬움은 별로..
146,(주)오웨이소프트,IT/웹/통신,"문자로 1차 합격문자를 받고 2차로 면접 실시 후 2일만에 합격 문자가 옴""","Spring
Javascript
JAVA

위 3가지 어느정도 할 줄 아냐?",제가 아는 만큼 대답을 했고 기본적인 지식 문제 질문을 했습니다.
147,(주)현대아이티앤이,IT/웹/통신,"주로 인성에대한 질문이였습니다
생각외로 했던 경험에대한 꼬리질문은 없었습니다""","자격증이 없는이유가 뭐냐?
학점이 좋은데학교 생활 재미없지 않았냐?",구글링하면 나오는 면접질문이랑 동일하게 그대로 나옵니다
148,(주)딜라이트룸,IT/웹/통신,"처음 지원부터 최종 면접까지 한달 반 정도 기간이 소요되었음 꽤나 긴 과정이었지만, 즐거운 시간이었음. 특히 과제를 수행하고 설명했던 과정이 상당히 어려웠지만 그걸 설명하는 시간이 재미있었음.""","이직하려는 이유
특정 직무에 대한 경험
딜라이트룸에 대해 알게 된 계기
해당 직무로 지원하게 된 계기","1, 2차 면접의 경험이 좋았어서 3차면접도 기대했으나 합격하지는 못했음. 전반적으로 대부분 면접자 분들께서 친절하게 대해주셨고 긴장하지 않게 분위기를 잘 풀어주셨음. 다만 최종면접에서 뵙게된 대표님의 권한이 다른 면접자분들의 의견보다도 훨씬 강한 것 같다는 인상을 받았음"
149,(주)해피문데이,IT/웹/통신,"서류 통과 후 1차 면접, 면접관 두 명에 면접자 한 명, 약 40분 진행되었습니다""","자기소개, 지원동기, 가장 힘들었던 경험, 자사 앱 사용 경험 여부, 앱들 중 가장 괜찮다고 생각하는 앱, 우리 회사에서 일하게 된다면 얻어가고 싶은 것",반응도 해주시고 편하면서 차분한 분위기였습니다
150,피티더블유코리아(주),IT/웹/통신,"서류-전화면접-온라인 화상 면접-영어 임원 면접-최종합격 순서, 시간은 전부 조율 가능했음""","자기소개, 본인의 단점, 이전 근무 경험 등 평이하였고 방금 한 말을 영어로 해보라는 질문도 있었음",자기소개서에 적은 그대로 답변했고 크게 어려운 질문음 없었음
151,아슈리온코리아(유),IT/웹/통신,"압박면접은 아니었습니다. 긴장되진 않았지만 긴장 되었어요. 합격 못해서 할 말이 없네요. 채용까지 못 갔어요.""","가장 기억에 남는 일과 힘들었던 일, 스트레스 받으면 어떻게 푸는 지 등을 물어봤습니다.",긴장된 분위기는 아니었지만 긴장했습니다.
152,(주)망고,IT/웹/통신,"채용공고에 지원하고 담당자를 통하여 전화가 옴 면접일자까지 잡고 편안한 분위기에서 면접 봄""","오래되서 잘 기억이 안나지만 언어에 대하여 물어봤었음, 딱히 기억에 남는 질문이 없음...",그럭저럭 무난한 면접이였지만 무엇을 하는 회사인지 잘 알수가 없었음
153,(주)헬로비즈,IT/웹/통신,"1차를 화상 면접으로 보고, 2차를 대면 면접 봤습니다.""","백엔드에 개발하는 자세를 중요하게 생각하는것 같습니다. 목표 지향적인 사고!
기술면접과 프로젝트 질문이 있었습니다.",난이도는 쉬운 편 면접관도 편안하게 해주셔서 좋았어요.
154,(주)케이안컴퍼니,IT/웹/통신,"서류 넣고 면접 보자마자 오후에 전화와서 붙었다고 연락 받았습니다.""","1. 첫 직장인데 어떤지
2. 연봉
3. 왜 입사하고싶은지",2:1로 봤었는데 분위기 좋았습니다.
155,엔에이치엔소프트(주),IT/웹/통신,"비대면으로 면접 진행. 다대일 면접 여러방면으로 질문""","경력관련 내용
자사 서비스 관련 내용 등",그렇게 어렵진 않음
156,(주)엔터프라이즈블록체인,IT/웹/통신,"편한 분위기에서 이전 경력에 대한 질문들이 대부분으로 진행되었다. 중간 스몰톡으로 아이스브레이킹 되었음""","이전에 이용해 본 툴에 관련된 질문
갈등을 해소하는 방식
경험해 본 업무
본인의 장점과 단점 등",최대한 편한 분위기에서 인성 위주로 평가하려는 느낌
157,(주)오토핸즈,IT/웹/통신,"긴장했는데 편안한 분위기에 업무관련 대화 하다가 와서 좋았음 긴장하지 않게 도와줌""",오토핸즈가 어떤 회사인지 아는지 질문에 대답을 못했는데 모르는게 당연하다는 분위기로 넘어감,면접보고 내가 지원한 공고가계속 올라오는 것 보니 사람이 급하지 않은듯 함
158,(주)띵킹프렌즈,IT/웹/통신,"이력서 제출 후 문자로 면접 일자를 받음. 면접은 대면만 가능.""",크게 기억에 남았던 질문이 없다. 이력서 기반 몇 가지와 이전에 무엇을 해왔는지를 물어본 것 같다.,"면접 시 코딩테스트 문제를 풀지만 크게 영향이 있는지는 모르겠다.
기술적인 질문은 거의 없었다. 인성 위주 질문으로 구성."
159,(주)티엔코아,IT/웹/통신,"1) 일단 이력서를 잘 확인도 안하고 지원자에 면접제안 연락을
함(면접에서 하시는 질문이 의아할 정도로 어처구니 없음)""","1) 영주권에 대하여 캐묻듯이 검색해가면서 질문을 함 마치 제가 거짓말이라고 하는것 마냥 너무 재수 없었음
2) 어떤부서에 지원한것인지 물어보는데 제가 느끼기로는 본인들은 지원자의 이력서도 사전 확인 없이 지원자에 면접 제안을 함. 면접에서 여러 질문이 이력서를 보면 알수있는 내용이고 본인 회사와 맞지않다고 생각이 들면 면접요청을 한것이 실례임","1) 영주권 질문에서 어떻게 취득해야하는지 성실히 말씀드렸음 그래도 믿지 않는 분위기;;;;
2) 운전해서 갔는데 면접끝나고 그부분에 대해선 물어보지도 않아서 주차비 3000원지불 함. 무지 아까웠음 이런회사에 굳이 왜"
160,(주)라인페이롤서비스,IT/웹/통신,"서류제출>1차면접 형태로 진행되었습니다.""","경험 및 경력질문, 업무스킬 질문 위주의 질문이였습니다.",편안한 분위기에서 면접 봤던게 기억에 남습니다.
161,(주)루센트블록,IT/웹/통신,"서류+포트폴리오, 1차 실무진 면접, 2차 임원면접으로 진행""","좋아하는 브랜드, 콘텐츠가 있는가?
회사 서비스의 USP가 무엇이라고 생각하는지, 고객에게 어떻게 콘텐츠로 전달할 것인지?
스타트업 특성상 긴박한 일이 생길 수 있다. 이때 받는 스트레스를 어떻게 관리하는 편인지
금융, IT 도메인 지식이 필요하다. 공부할 의지가 있는지?
콘텐츠 기획 업무를 맡았을 때, 제작 담당자와 협업해본 경험이 있는지?...","어려운 질문이 있을 때 답변이 막혔던 적이 있는데, 압박하지 않으시고 생각할 시간과 배경상황을 던져주셔서 제 생각을 잘 말할 수 있었습니다."
162,(주)코드브릭,IT/웹/통신,"헤드헌터 통해서 진행했습니다
1차, 2차까지 진행함""","- 과제 있었음, 과제 관련된 질문
- 개발자와의 커뮤니케이션 정도
- 개인적인 목표에 대해 물어봄","- 예상했던 질문들을 주로 얘기함
- 영어를 사용해야했기에 영어 관련 질문도 꽤 있었던 것 같음"
163,(주)히릿소프트,IT/웹/통신,"서류 합격하면 이메일로 안내 메일이 온다.""",1. 경력 사항 2. 성과 설명하기 3. 힘들었던 경험이나 동료,대표님이 굉장히 친절하셨다.
164,언제나디자인,IT/웹/통신,"문자로 연락이 오고 이틀 뒤 팀장님과 1:1 면접으로 진행""",전 직장을 그만두고 이직을 하는 이유 / 성격&성향 / 업무능력,딱딱한 분위기가 아닌 1:1 부드러운 형식으로 진행하여 부담감이 느껴지지 않음.
165,(주)에이비일팔공,IT/웹/통신,"채용 프로세스가 빠르고 시원시원하고 좋았습닌다.""",팀원들 중 생산성이 떨어진 팀원이 있다면 어떻게 할 건지? 팀 간 커뮤니케이션은 어떻게 할 건지?,답을 꼭 듣고 싶어 하시는 것 같았습니다!
166,(주)처음소프트,IT/웹/통신,"면접 연락이 와서 바로 날짜 잡고 면접참여하였으며, 당일 바로 합격 통보받았습니다.""",경력 관련 질문 및 독서토론 진행하는데에 대한 의견 그 외에 딱히 기억나는 질문은 없었음,크게 부담스러운 면접은 아니였으며 물어보는대로 맞춰서 편하게 대답하였음
167,(주)반스토리,IT/웹/통신,"먼저 스몰토크를 던져주기도 하시고 해서 긴장하지 않는 상태로 면접에 임할 수 있었고 간단한 질문과 전공 관련 시험(정말 간단함)을 봤다.""",일을 시작하면 좀 바쁠 수도 있으니 열심히 할 수 있겠느냐...라는 등의 질문. 질문같은 경우는 진짜 스몰토크만 했고 나머지 역량은 쪽지시험을 통해 봄.,다른 곳에서는 느껴보지 못한 편안함을 느꼈다. 압박면접 전혀 없고 지원자 배려를 중요하게 생각하시는듯.
168,(주)링키지랩,IT/웹/통신,"이메일과 전화로 면접 합격 연락 옴.
면접 분위기 매우 편안함. 여태까지 면접 봤었을 때 분위기랑 다르게 편안한 분위기라 준비한 모든 것들은 편안하게 어필 가능

보통 면접자만 어필하는 경우가 많은데 여기...""",이 회사가 아무래도 장애인 표준 사업장이라 근무시 장애인들과 근무해야 하는 부분에 대해서 어떻게 생각하냐고 묻는 질문이 있었음. 처음 이런 곳에서 근무라 어떻게 시스템이 돌아가는지 궁금하다고 물아보니 어떤 식으로 장애인들과 근무하는지 세세히 답변해주셔서 내가 일할 때 어떻게 해야할지 판단내리기 좋았음,보통 다른 면접들은 이 회사가 어떻게 굴러가는지 모르고 대략적인 형태만 알랴주는데 이 회사는 쌍방으로 소통하는 느낌이 있었음. 면접자가 회사에 대해서 잘 모를 수 있으니 회사를 소개시켜주고 덩달아 나도 나에대해 소개할 수 있는.. 쌍방 소통이 가능한 면접이었습니다.
169,(주)네임드스튜디오,IT/웹/통신,"서류 합격 발표까지 일주일 걸렸습니다.""","이전 회사에 대한 질문 - 퇴사이유
회사의 핏과 맞는지에 대한 질문
해당 기업을 어떻게 알게됐는지에 대한 질문","업무가 많아보였다. pt 준비하는 짧은시간 동안 계속해서 업무이야기를 했다.
면접 결과는 알려주지 않음"
170,(주)에이프릴세븐,IT/웹/통신,"자유로운 분위기 속에서 전문영역 질의응답 내용 진행 하였습니다""","에이프릴세븐에서 가장 하고 싶은 일은 무엇이며, 성장을 도모하기 위한 방향은 무엇일까요?","자유로운 분위기 속에서 날카로운 질문 등이 이뤄졌으며, 입사하고 싶다는 생각이 들었음."
171,(주)인터비즈,IT/웹/통신,"나름 편안한 분위기에서 진행
면접은 3:1로 진행
회사에서 뭘하고싶은지 같은 회사에 들어와서의 질문들을 많이 함""","제출한 서류 위주로 물어봄
’입사한다면?‘의 질문들을 많이 물어봄
회사 비교, 분석에 대한 질문을 물어봄","면접시간은 2-30분정도
자세하게 질문한다
회사에대한 질문을 많이 한다"
172,(주)엘박스,IT/웹/통신,"면접 자리에서 라이브코딩 했고 인터뷰가 꽤 길었던 기억""",이전 프로젝트에러 힘들었던 경험이나 극복했던 과정 등 설명,"경험과 가치관 중심으로 설명
면접본지 오래되었지만 나름 좋은 인상으로 남아있다"
173,(주)액션파워,IT/웹/통신,"포트폴리오를 화면에 띄워놓고 면접자분이 궁금하셨던 부분을 물어보심. 친절하고 편안한 대화방식으로 진행되지만 예리한 질문들이 들어옴""",이 프로젝트에서 어떤 성과를 어떻게 냈는지 설명해달라고 하심,전체적으로 따뜻하게 맞이해주시고 사무실 분위기도 좋았습니다. 꼭 가고싶었는데 결과가 안좋아서 아쉬웠어요
174,(주)리버스랩,IT/웹/통신,"대면인터뷰1회, 분위기는 좋았습니다. 편안한 분위기속에 진행하고자 하는 의지가 보여 괜찮았어요.""","그동안 했던 직무, 주말 로테이션 출근 가능여부, 입사시 모두가 바쁠때엔 어떻게 업무 진행할거냐","당시 이사, 팀장, 인사팀장 으로 이루어져 조금 너무 많은 사람들이 들어온거 같아요. 지금생각하면 이사님은 왜 들어오신지 모를 ㅎㅎ"
175,아날로그플러스(주),IT/웹/통신,"크게 어렵진않음 스타트업에 지원한 이유, 어떤 업무능력 갖고 있는지 물어봄""",많은 업무를 할수있는데 다 해볼 수 있냐 등의 적응능력을 물어봄,"면접 분위기는 무겁지않고 유쾌했으며, 인사담당자와 대표님 모두 좋아보이긴함"
176,디뉴미디어,IT/웹/통신,"질문 받는 타임 후 질문할 타임이 있어서
면접자도 회사에 대해서 더 알 수 있음""","전 직장에서 내가 잘했던 일과 좋아했던 일은?
광고와 홍보의 차이는?","면접 분위기는 편안함
채용공고에 직무에 대해 자세히 안나와서 질문을 많이 함"
177,(주)박스풀,IT/웹/통신,"차에서 화상면접 진행, 퇴사 사유를 믿을 수 있게 하려면 어떻게 해야 하죠?""","차량에서 받으셔서 양해 구하시는 내용,
짧은 경력들의 사유와 재차 말씀드린 솔직한 퇴사 사유에 거짓말인지 아닌지 모르겠다고 하셨습니다","차량에서 받으신 것부터 면접에 대한 예의는 벗어났다고 생각했는데, 나머지 질문은 대면에서 해라, 퇴사 사유를 믿을 수가 없다고 하신 건 이 기업의 첫 면접에서 무례하다 느꼈습니다. 면접 후 갈 의사 없다 말씀드리려다 대표님이신지, 부장님이신지 소개가 없으셔서 차마 연락은 안 보냈지만 정말 어떤 회사인지 알 것 같았네요."
178,(주)신신엠앤씨,IT/웹/통신,"사람인으로 이력서 접수 및, 이력서 접수 후 빠른 면접일정을 잡아 대면 면접을 보게되었습니다. 대면 면접후에 합.불합격 통보가 날아오는데 오랜시간은 걸리지 않았고 면접은 편안하게 1층에 마련된 카페에서...""","직장상사와 트러블이 발생했을때의 처리방식, 직장 동료들과 어우라지는데 본인의 강점 및 약점, 전자기기를 취급하다보니 전자기기에 대한 기본적인 지식 및 관심도.","일의 전문성을 우선으로 보는것보단, 직장 동료들과의 원활한 커뮤니케이션 능력이 있는지를 중점으로 보는듯한 느낌이였습니다."
179,휴먼정보(주),IT/웹/통신,"근처 공공기관에 있는 카페에서 면접을 진행했음. 이력서를 보고 학력/자격증/경험 위주로 물어봄.""","대표이사, PM 두분이서 면접을 봤고 주로 이력서 위주의 물어보고 그 이후로는 근무에 관한 설명을 받음.",기술보다는 근무지에 오래 있을지 순환근무 가능한지 물어봤음.
