,company,job,title,question,answer
64,케이네트웍스(주),IT/웹/통신,"면접은 그냥 편하게 대해줍니다 그리고 여기는 기업이3개가 합쳐져있어 일이많고 간단한 업무로합니다""",그냥 언제부터 일할수있는지 관련일을 해봤는지 배우면그래도 다할수있다는 느낌?,편하게 그냥 있는대로 말하면 일을 빨리시작할수 있는거를 많이봅니다
65,몬스타(주),IT/웹/통신,"지원자의 지원분야도 확인 하지 않은 채 진행된 설교식 면접""",(웹디로 지원했었음) 이력에 외국 다녀왔던데 영어로 자기 소개해보세요.,이해가 되지 않았으나 영어소개 했습니다. 영어실력이 부족하다길래 근데 웹디가 영어회화를 잘해야하는지 물어보자 ‘아. 웹디로 지원하셨냐고’….제발 면접자에 대한 기본적 예의는 갖춥시다. 이후 10분간 자기 사업인생에 대한 훈수 후 끝..^^
66,(주)엑스오컴퍼니,IT/웹/통신,"이력서 접수 후 2주 뒤 면접보러오라는 연락이 와서 면접을 보러갔습니다. 그리고 2주뒤에 발표가 났습니다.""","일을 해본 경험에 대한 질문
전 회사 퇴직이유
일을 잘 할 수 있을 것 같은지에 대해 계속 질문하심",편안한 분위기에서 면접봄
67,(주)주연테크,IT/웹/통신,"면접분위기는 친절한편
압박면접은 없었고 무난한 면접이었음.""","디자인관련해서 많이 물어봄
자기소개
포폴 pt
지원동기 같은거",면접분위기는 차분하고 편안했습니다.
68,(주)카멜,IT/웹/통신,"물 한잔 안주고 면접관 두명이였고 회사설명해주고 면접 한시간봄""","자기소개, 통근소요 시간, 이전직장 경력, 마지막으로 하고싶은말 외에는 기억안남",이력서와 자기소개 기반으로 솔직하게 답변함 면접관이 잡플래닛 리뷰 언급하는게 참 인상적이였음
69,전시몰닷컴(주),IT/웹/통신,"면접관이 많아서 놀랐고 분위기는 나쁘지 않았음
면접을 1번만 봐서 편했다""","자기소개
중고거래 해본적? 당근마켓 이용하나?
리퍼비시 제품에 대해 아냐?
마지막 하고 싶은 말",그냥 저냥 무난한 면접
70,디에스티인터내셔날(주),IT/웹/통신,"잡코리아 연락 와서 면접 봄, 원하는 면접 일자를 확인해 해당일에 면접 진행""",개인의 성격은?. 우리 회사를 어떻게 생각하나?,긍정적
71,(주)유니온앤이씨,IT/웹/통신,"서류 합격 후 전화로 면접 일정 잡고 방문하였던걸로 기억합니다 ㅇㅅㅇ.""",이전 회사 업무와 일을 하게 되면 어떤 일을 하게.될것이다 이런 내용들.,걍 기존 면접들과 비슷
72,범우정보기술(주),IT/웹/통신,"최초 면접 후 만남 2번 연봉 관련 질문
그리고 계약""","년차, 자격증, 연봉 등 여러가지 질문합니다.","연봉 협상 잘하셔야합니다.
자기가 원하는 금액과 그만한 이유를 말하셔야합니다."
73,(주)모션테크놀로지,IT/웹/통신,"주먹구구, 그닥 어려울거 없고, 단순함""","없음, 매운 단순한 것들이고 기본이 않되있어서 별거 없음",없음
74,썬컴퍼니(주),IT/웹/통신,"면접 일정 조정이나 다른 건 별 다른 문제가 없었지만 토요일 예배를 고지해주지 않은 점이 매우 부정적""","장단점, 주변관계, 가족관계, 취미, 열정에 대한 이야기",열정을 강조하고 옛분위기가 강했음
75,디지레이(주),IT/웹/통신,"온라인 지원후 면접 보게되었고 딱딱한 분위기가 아닌 비교적 편안한 분위기에서 면접봄""","간단한 자기소개랑 전에 어떤일을 했는지, 자소서에 써져있는 것들 위주로 질문해주심",편안한 분위기로 면접볼수있게 대화를 이끌어주셔서 좋았음
76,(주)앤앤에스피,IT/웹/통신,"준비해간 이력서와 자기소개서를 토대로 한 질문들이 많았습니다. 편안한 분위기였습니다.""",기대와 다른 직무를 맡게된다면 어떻게 할지에 대한 면접질문이 가장 기억에남네요,정확하게 기억나진 않는데 일단 맡게된다면 최선을 다해서 하겠다는 식으로 답변했던듯합니다
77,(주)엠브레인,IT/웹/통신,"1대1면접 진행
이력서 위주의 질문으로
업무와 관련된 내용만 질문
연봉 관련 질문 등""","오래 다닐 수 있을 것 같은지
다른 팀원들과의 화합을 중요시 하는 것 같았음","어렵지 않고 쉽다고 느껴졌음
면접관님이 편안하게 해주셨음"
78,에스씨에스프로(주),IT/웹/통신,"면접관분들이 굉장히 친절하시며 최대한 편안한 분위기에서 진행될 수 있게 해주십니다""",직무와 관련된 질문들이 주를 이루었고 대체적으로 예상 가능했던 질문들이었습니다.,편안하게 답변하였고 분위기도 굉장히 좋았으며 회사 이미지가 좋다고 느꼈습니다
79,이피네트시스템즈(주),IT/웹/통신,"인성에 대한 질문이 많았습니다 장기근속을 중요시 하였습니다 면접은 1대1로 보았습니다""","1.업무에 대해 경험을 해본적 있습니까?

2.가족사항

3경력상황",편안함
80,엠토스솔루션스(주),IT/웹/통신,"지원한 포지션에 대해 얼마나 기본적인 상식이 있는지 물어보고 무난하게 진행""",업무의 능력도 중요하지만 열정적인 자세로 배우고자 하는 마음이 있으면 더 좋다,사회 초년생으로서 열심히 하겠다
81,(주)명인이노,IT/웹/통신,"면접관 다대일로 진행하며, 자소서를 기반으로 질문.
최대한 면접자가 편안한 환경에서 답변할 수 있도록 분위기를 조성해주심""",기억 나는 질문은 동료 직원과 관계가 안좋아졌을 때 어떻게 해결할 것인지,"어떤 회사인지 사전에 조사하고, 지원한 직무와 내가 가지고 있는 역량이 어느 정도 일치하면 평이하게 면접 볼 수 있음."
82,(주)에이텍시스템,IT/웹/통신,"개인적인 정보 왜이렇게 물어보실까요? 결혼여부 애낳을건지여부^^""","결혼, 애낳을건지 물어봤는데 안낳는다니까 출산율 얘기까지 제가 들어야하나요^^!",저얘기 듣자마자 기분이 상해서 대충 대답하고 대충 면접봤습니다 저런 질문이나 들으니까 더 애낳기싫어짐
83,ADATA Korea,IT/웹/통신,"이해할 수 있는 질문, 경력에 맞는 상식적인 대화, 경영진의 유연함을 확인""",야근을 해도 버틸수 있는가? 나의 5년 후 모습에 대해 심도있게 물어봤습니다.,"야근은 가능, 5년 후 팀장"
84,(주)티앤에스인터내셔널,IT/웹/통신,"다대다 면접이였는데 전반적인 흐름자체가 압박면접이였음.어려운 질문을 해서 압박면접인게 아니라 대답하면 꼬리에 꼬리를 잡아 거의 시비 거는 수준이였음""",무역용어에 대해서 얼마나 이해하는지 알아볼려는 의도였는지 CY가 뭔지 얘기해보라고 했음,답변이 어떻던간에 상대방의 말을 존중하는 태도 1도 없고 어떻게든 흠집잡아 연봉을 깍을려는 의도가 보여서 면접 중간부터는 대충 대답함
85,한성컴퓨터(주),IT/웹/통신,"보통 회사 면접이랑 같음 다를 수도 있겠다..""","** 상황에서 어떻게 할 것인지
스트레스 관리 잘하는지
** 상황에서는 또 어떻게 할건지",합이든 불이든 연락 주셨으면
86,티에스라인시스템(주),IT/웹/통신,"계약직이라서 상주하는 프로젝트로 가서 pm,pl 하고 면접 진행하고 편안한 분위기""","이력서에 있는 프로젝트 내용으로 질문 및 사용한 기술에 대한 질문, 그리고 해당 프로젝트에 대한 업무 설명 들음",편안한 분위기로 면접진행
87,모뉴엘(주),IT/웹/통신,"야근가능여부와 디자인에 대한 질문을 위주로 했고 이전 경력에 대해 상세히 물어봄""",새로운 부서에 적응을 잘 할 수 있는지 묻기 위한 질문으로 성격이 활발한 편인지 차분한지 물어봤음,활발한 편이지만 일하는 동안은 차분해진다고 대답
88,(주)이노앤시스,IT/웹/통신,"구직사이트 이력서 제출후 며칠후 연락이왔다""",어떤걸 배우고싶은지 회사의 궁금한점 회사가 하는일,압박면접은 하나도 없었고 부드러운 분위기에서 진행됐었다
89,(주)투비스마트,IT/웹/통신,"대표님과의 직접 면접 2회를 통해 기존 업무경력 및 입사 후 사업 & 영업-마케팅 방향성을 논의하는 방식으로 매우 편안하고 자유롭게 면접을 마무리하였으며, 이후 입사 일정 상호 조율 후 입사""","투비스마트의 성장 가능성?
투비스마트의 향후 사업영역 확장 및 방향성?
본인의 커리어 성장을 위한 노력과 과정?",자유롭고 개방적인 대화식 면접 진행으로 평가/삼사 대상이라기 보다는 함꼐 일하고자 하는 동료를 맞이하는 느낌
90,초이스테크놀로지(주),IT/웹/통신,"면접은 편안한 분위기에서 봄, 자기소개 등 얘기하였음""","출퇴근거리, 경력관련질문, 연봉 질문",소기업이다보니 배울점은 많지 않을듯 싶습니다
91,(주)디지아이,IT/웹/통신,"면접 연락이 문자로 오는데 우선 면접 의향 있냐고 물어봅니다. (상세한 내용 포함)
면접 본다고 하면 무슨 동영상 보내주는데 대충 어떤 회사인지 알려주는 홍보 동영상같은거에요 대충대충 봄
면접보러가면 무슨...""","개인 신상에 대한거 물어보는데 이 부분에서 아 요새 회사는 아니구나 약간 느낌 남
전 직장 업무 방식을 상세하게 물어봄
왜 전 직장에서 받은 연봉보다 희망 연봉이 높은지 물어봄 (많이 받고 싶은건 당연한거 아닌가)","대표하고 인사담당은 비교적 젊음
나이 많은 본부장이 개인 신상 물어보는데 뭐 기분 나쁜 수준은 아니고 그냥 아 나이 많은 사람이라 그렇구나 이런 느낌
1:3으로 하다보니 좀 긴장되는 부분 있는데 면접 진행하다보니 괜찮아짐
이직 사유에 대해 좀 집착하는 느낌
교통비 받음 (정말 교통비)
야근에 대한 생각을 물어보는데 느낌상 야근이 많을 것 같음"
92,(주)테크빌,IT/웹/통신,"기본적인 전공관련질문과 기타사항을 질문""",전공기초대한질문 대학생활에관한질문 가족관계등개인적인사항질문,면접은 어렵지는 않았으며 편하게 대답하면 될거같습니다
93,영우씨엔아이(주),IT/웹/통신,"필기시험 후 실무진 기술면접 그 후 대표와 인성면접순으로 진행했습니다""","Python 사용여부
DB 다대다 테이블에 대한 이해
그리고 필기시험 본걸 바탕으로 면접 진행","Python은 사용해보지않았다
그 외 질문들에 대해 답변을 다 답했습니다"
94,(주)브이씨에이테크놀로지,IT/웹/통신,"메일로 연락이 왔고 회사 방문후 간단한 코테와 면접을 진행 했습니다.""",멀티 스레드와 멀티 프로세스에 대한 차이점을 설명해달라는 질문,면접 난이도가 어려운 편은 아니었지만 공고에 올라온 직무와 상관없는 질문이 몇개 있었음
95,(주)엔시스템즈,IT/웹/통신,"면접 분위기는 편안한 분위기에서 진행되었으며
하루뒤에 결과가 나왔습니다""","OSI 7 레이어를 대해 설명하시오
OSPF에 관해 설명하시오","아는대로 답변 하였고 편안한 분위기에서
긍정적으로 마칠 수 있었다"
96,레드스톤시스템(주),IT/웹/통신,"인사과 팀장님이랑 지원부서 팀장님 두분께서 면접보는데 질문자체도 별거없고 쓸대없는 질문이나 함""",인사과 팀장님이 여자친구있냐고 뮬어봤음 ㅋㅋㅋ진짜 별시답잖은 소리함 부담갖을 필ㅇ요없음,여자친구있다고 했고 그때 자기랑 2년안에 헤어진다고 월급빵 내기하자함 그분은 까먹었을지라도 나는 다 기억함
97,(주)대승인터컴,IT/웹/통신,"서류포폴 통과 후 실무진 면접 후 채용""","대략적인 업무 내용 설명후 일이 가능할지?
다루는 프로그램",불필요한 절차는 딱히 없었음. 실무위주로 물어봄
98,알파디스플레이(주),IT/웹/통신,"가족관계 질문
본인의 회사 설립하기까지의 과정을 알려줌
어떤 마인드로 임해야하는지 말해줌""","가족관계 질문
왜 이 직무에 지원하게 됐는지 질문
질문은 별로 없음",가족관계 답변했고 별 기억은 없다 대표님의 스토리와 어떤 의지로 업무에 임해야하는지 들음
99,(주)메이커스테크놀로지,IT/웹/통신,"면접관 2명, 지원자 2명으로 거의 10년만에 다른 지원자와 단체 면접진행 함""","이직사유, 결혼 여부, 흡연 및 음주 여부, 입사가능일 등을 질문합니다","두명 모두 입사를 이미 결정한 듯한 분위기에서 진행하여 편안했으며, 생각했던 것보단 탄탄한 느낌이 있었지만, 우린 연봉을 많이 줄 수 없다며 희망 연봉보다 낮게 제시할 것을 암시합니다. 희망 연봉을 줄 수 없으면 아예 면접 제안을 안 하는 게 맞지 않나요? 인재를 얻어 성장하고 싶으면 그만큼 투자도 하는 게 맞습니다."
100,지테크시스템(주),IT/웹/통신,"인격모독 당하고 경력도 무시하고 답변들을 비웃듯이 비꼬기만 했음""",긴장해서 말 더듬었다고 어휘력 딸리고 일상생활도 그런 식으로 하냐는 등 경력 일부분 살려서 가는건데 다른 경력도 없으면서 왜지원했냐 너가? 여기를 지원해? 라는 비아냥거리는 태도와 질문들로 면접 진행함,"오히려 면접 때 이런 회사를 거를 수 있어서 다행이었고 원수한테도 이 회사는 가지 말라고 말릴 것 같음.
이런 인성을 가진 상사들 밑에서 무슨 일을 배우나 싶고 문제있는 회사임
그래놓고 합격했다고 출근하라는데"
101,(주)뷰넥스,IT/웹/통신,"서류제출 후 문자로 연락옴
면접일정 잡은 후 방문""","1. 회사지원동기
2. 성공경험은?
3. 공부는 어떤 방식으로 하고 있는지",생각보다 무난했고 압박면접 없었음
102,(주)크레아코퍼레이션,IT/웹/통신,"면접 시간 30분 내외, 대부분 포트폴리오에 관한 질문이라 비교적 쉬운 면접이었음""","- 입사시 새로운 분야를 배울 생각 있는지
- 언제부터 출근 가능한지
- 작업 속도는 빠른 편인지",성장을 위해 노력하는 직원을 원하는 기업
103,(주)두이즈,IT/웹/통신,"과정은 어렵지 않았어요,친절하게 설명해주셨어요,회사에 대해 업무내용들을 설명해줬어요""",어떤 경험있는지 업무내용은 받아들일수 있는지에 대해 물어본게 인상에 남았어요,"순조로운 느낌이 약간 있어요,면접 봐주신분은 엄청 친절했어요"
104,디젠(주),IT/웹/통신,"1차 면접 및 영어 구술/작문 면접 후 임원진 면접 진행됨""","회사에 궁금한 점을 역으로 물어보는 경우가 많았음.
문제 접근 방법 및 해결 과정에 대해 물어봄",답변을 올바른 방향으로 이끌어 주려고 노력함. 압박면접 없음
105,컴박스테크놀러지,IT/웹/통신,"체계적이지 않고, 주먹구구식이고 회사에 충성도나 애사심을 알지도 못하는 지원자에게 바라는 질문등을 함""",주량 야근여부 상명하복여부 직무와 전혀 상관없는 질문들을 늘어놓음 하지만 이 질문들이 무얼 의미 했는지 입사하면 알게 됨,면접보면서도 어이가 없음 면접보는데 고성방가와 악쓰는 소리가 들림
106,동명에스앤디(주),IT/웹/통신,"그냥 일반적인 면접임 실무자나 대표가 편안하게 티타임 형식으로 진행됐음""",쇼핑몰 어디어디 다뤄봤나? 매출 많이 내봤나? 이런 질문들 위주,전문적인 면접은 아니고 실무 관련 능력을 확인 하는 수준입니다
107,코발트레이(주),IT/웹/통신,"면접은 쉬움, 인력이 없어서 아무나 채용하는 느낌 쓰다 버리는 느낌""",그냥 출근하세요 잘하실꺼같아요 이러셨음. 포폴 이것저것 물어보길 바랬으나 자기 자랑만 하셨음,뭐지?..뭐를 검증하고 오라는거지?.?
108,(주)테크아이,IT/웹/통신,"면접분위기는 딱딱하지않습니다
업무적인 질문보다는 회사에 대한 얘기를 많이 해줍니다
합격만 연락을 주는듯 합니다""","기억에 남는 질문은 딱히 없는 것 같습니다
질문보다는 사무실 분위기가 너무 조용하고 담배냄새가 났습니다","면접을 기다리면서 느낀점은 직원분들이 다 젊은편입니다
그리고 다들 바빠보였습니다"
109,(주)인터패스,IT/웹/통신,"사는곳 과거 이력 등 그냥 이력서에 있는거 물어보는 형식""","전 직장에서 왜 그만두게 됐는지, 전 회사가 무엇을 하던 회사였는지",이력서라도 한번 읽고 들어왔으면..
110,올넷전자(주),IT/웹/통신,"그냥 식당쪽가서 왜 지원했고 이러한 일하는데 할수있냐고 물어봄""",너무 오래되서 기억이 잘안나는데 위에 과정이랑 비슷한가물어봄,느낀전 딱히없고 어차피 다니다 나갈거라서 대충 대답햇는데 붙음
111,에이팀벤처스(주),IT/웹/통신,"원티드에서 지원하고 메일로 연락이 와서 1차는 화상, 2차는 대면 면접이었습니다. 1차도 팀장, 대표 2차도 동일하게 팀장, 대표와 면접을 봤습니다. 당시 코로나가 심했을 시기였는데 마스크 벗고 면접 봤으면...""",1차 화상에서는 그동안의 해온 일들에 대해서 질문을 받았었고 2차 대면에서는 1차에서 말하지 못한 또다른 포트폴리오에 대한 질문을 받았습니다.,1차에서는 실무진하고만 봐도 좋을 것 같다는 생각을 했습니다.. 요즘은 그렇게 하시는지 모르겠지만요. 대면 면접에서 작은 회의실이었는데 마스크를 벗고 보자는게 좀 당황스러웠던..
112,(주)씨아이피시스템,IT/웹/통신,"채용사이트를 통한 지원 후 대면면접을 진행하였습니다.""","교육에서 어떠한 것을 배웠나?
무엇을 사용해 보았나?
잘 할 수 있을 것 같은가?",편안한 분위기에서 진행되어 부담없이 볼 수 있었습니다.
113,이슬림코리아(주),IT/웹/통신,"잡사이트에서 공고를 보고 고민끝에 지원하게 되었습니다.""",전공에서 배운점과 아르바이트는 어떤곳에서 해봣는지 취미 꿈 등,무난했습니다
114,(주)포엠아이,IT/웹/통신,"온라인으로 보고 연락해서 면접 진행 , 진행 후 입사""","희망 연봉, 어떤일하는지, 뭘 좋아하는지","그냥 있는그대로 말하고 솔직하게 말함
잘 들어주고 편함 하지만 잘 안물어봄"
115,(주)인성아이티,IT/웹/통신,"면접은 실무진, 대표이사 두번의 과정있음""",자기소개서 기반으로 다양한 질문 있음,좋았습니다.
116,(주)사우정보기술,IT/웹/통신,"본사 면접합격후 투입될 사업장이 있으면 사업장 면접 없으면 본사에서 교육 대기""","면접 전 문제풀이 ,운영에 대해 알고 있는지 , 어떤 분야로 가고싶은지",답변을 잘 못해도 오히려 설명을 더 자세히 해주셨습니다.
117,엣지아이앤디(주),IT/웹/통신,"서류 접수 후 1차면접 진행-해당 직종 부서장과 팀장이 면접을 보았고, 추후 2차 면접때는 인사담당자와 면접을 봄""","지원한 직종과 관련된 프로그램을 어떤걸 사용하는지, 비전이 어떻게 되는지, 발전방향에 대한 포부","사용할 수 있는 프로그램과 자격증에 대하여 말했으며, 전자칠판 시장에 대한 비전과 개인적인 소견을 내놓았음"
118,(주)엠알티인터내셔널,IT/웹/통신,"처음 메일로 연락이 왔고 일주일 내 면접날짜 잡고 면접을 봤다""","했던 프로젝트 설명, 성격의 장단점, 하고싶은 일",전체적으로 편안했고 분위기가 좋았다
119,(주)에스앤티,IT/웹/통신,"면접보기전 서약서 같은거 작성하고 대표가 직접 뭐 할수 있는지 물어봄 그 후에 합격함""",학교에서 뭐했는지와 뭘 할줄아는지 그리고 집은 어딘지 정도,허접함을 느낌
120,지아이시스템(주),IT/웹/통신,"개발자 채용한다고 해서 갔더니 모 기업 하청으로 들어가서 qc 시키더군요,
그러면서 하는 말이 하다가 나중에 개발자로 부서 옮겨줄 수 있다고 하네요.. 어이가 없습니다""","1. 이런 직종 해봣냐
2. 취미가 있냐
3. 집이랑 가깝냐","전문적인 지식 없이 일상대화하듯이 면접봐서 합격했습니다.
말만 할 수 있다면 합격할 수 있을 거 같습니다."
121,(주)엠아이티소프트,IT/웹/통신,"실무적인 질문 보다는 개인적인 질문이 많다""",대표 본인의 이야기를 많이 늘어 놓는다 대표적인 중소기업 면접이다.,대표 본인의 자랑만 하다 시간이 다 지난다. 면접에 있어서 어려움은 없다
122,(주)브로나인,IT/웹/통신,"채용부터 개별연락 및 1,2차 면접으로 진행하였고 면접결과는 이메일로 통보받았음.""","전반적으로 이전 직장의 경험, 스타트업 생태계, 직무관련 질문으로 진행되었음.",긍정적인분위기
123,(주)이제이정보시스템,IT/웹/통신,"채용사이트 이력서보고 먼저 연락이 와서 면접을 잡음""",이전 경력과 관해서 질문이 많았음. 전자칠판 알고있는지. 언제부터 나올 수 있는지,면접 시간이 저녁6시 이후임. 내가 면접을 보는데 면접관이 말을 더 많이함.
124,뉴엔텍(주),IT/웹/통신,"이력서 제출 후 면접 연락이 오며 일대일 혹은 이대일 면접을봄""",회사에 대한 장점 회사의 복지 등을 설명하면서 회사 어필을함,부드러운 면접진행
125,HP Inc.,IT/웹/통신,"총 2번의 인터뷰
첫번째는 담당 팀 엔지니어 분들과 면접
두번째는 시니어 엔지니어 및 경영진과 면접""","1. 연구개발 경험/경력
2. 소프트웨어 활용
3. 수상실적 (대내외)",편안한 면접분위기 형성
126,에버린트(주),IT/웹/통신,"지원하고 나서 전화가와서 면접을 봤는데 처음에 기다리는 동안 인사팀(?) 인사과 팀장같은분이 기다리라면서 안내해줬어요. 딱딱하지 않게 대해주셔서 편안하게 기다렸던거같아요.""","1. 이전 직장에서 무슨 업무를 어떻게 봤는지?

2.
전공관련 내용보다 어떻게 하면 오래다닐 수 있을거 같냐 라는 뉘앙스의 질문이 많았어요.
퇴사율이 높은지 아닌지 모르겠지만 업무강도는 간간히 잔업이 있다는걸 어필하는것을 보니 근무시간이 조금 길었던거 같아요.","1. 아직 체계적인 느낌은 들지않았다.
2. 열정이 엄청 강한거 같다(뭔가 의욕이 엄청 강하다는 느낌이 들었다)
3. 내가 여기서 일하게 되면.. 이라는 전제가 많았다"
127,에이치피코리아,IT/웹/통신,"업무에대한 경험이 가장 중요함. 총판-파트너 비즈니스 유경험자를 가장선호하며 영어 능력 매우 중요""","1:1 개별면접으로 기존 직무에 대한 설명
성공적으로 진행한 프로모션 소개
파트너영업에 대한 이해","면접 난이도는 낮으며
업무의 전문성과 경험이 가장중요
HP가 어떤 총판, 파트너와 협업하는지 알면 합격 확률 높음"
128,(주)에이알미디어웍스,IT/웹/통신,"본인의 대학교에서 시간 교수로 들어오신 대표님과 대화하여,
본교 내부 흡연장에서 얘기를 나누며 면접을 진행하였다.""",기본적인 어도비 툴 관련 기초 지식과 유니티 및 3D 활용을 할 수 있는지에 대한 질문을 주고 받음.,"어도비 및 3D 관련 툴에 대한 기초적인 부분은 수업을 진행하면서 직접 확인.

느낀점은 본인의 역량을 키워주겠다는 언급을 통해
대표님의 책임감 있는 모습을 기대함."
129,(주)지엔피컴퍼니,IT/웹/통신,"면접에서 채용까지의 과정은 쉬움 서류 면접 통과 후 면접 후 바로 연락옴""","자신의 장단점을 말해보세요
희망 연봉이 어떻게 되는지?",가벼운 인성면접 정도의 수준
130,(주)텔라움,IT/웹/통신,"서류제출 - 면접 - 합격의 괴정으로 이루어집니다. (면접비는 없음)""","1.품질부서가 존재하는 이유는 무엇이라 생각하는가?
2. 회사를 선택함에 있어 중요하게 보는 요소는?
3. 야근과 워라밸에 대해서 어떻게 생각하는가?","2:1 (임원, 팀장) 면접 진행하였습니다.
회사는 깨끗하고 깔끔해서 좋았습니다.

직무에 대한 디테일한 내용보다도 본인에 대한 인성, 성품 등 어떤 생각을 갖고 사는지 가치관등을 중요하게 보는 것 같습니다. 상황에 따라 어려운 질문이 될 수도 있으나 그사람이 평상시 생각하는 깊이나 사물에 바라보는 관념, 기준 등에 의하여 질문의 난이도가..."
