,company,job,title,question,answer
0,(주)하나텍시스템,IT/웹/통신,"경력 위주로 질문하였음
회사 소개와 직무 소개 해줬다!!""",경력 위주로 물어봤고 회사에 궁금한 점 물어보셔서 준비해간 질문들 물어봄,편안한 분위기에서 진행되었고 궁금했던 질문들 상세히 답변해주심
1,디에스글로벌(주),IT/웹/통신,"자기소개를 먼저 하고, 사용하는 tool, 경력에 대한 상세질문, 그리고 스트레스해소 방법 외 기타등등""","구동부 설계, 스트레스 해소방법, 사용가능 tool에 대한 질문이 있음",기본적인 지식이 있다면 면적이 어렵지는 않음.
2,엠아이티마스(주),IT/웹/통신,"온라인지원으로 이루어졌고 코로나 시기여서 원격으로 면접진행""",자기소개 진행 영어로 질문진행 일에 임하는 태도,그냥 간단하고 별 문제없었습니다
3,(주)포인트모바일,IT/웹/통신,"서류 입사지원 후 바로 다음날 면접을 보았습니다""","회사의 업종에 대해 아는가
집과의 거리
하고싶은 업무나 목표","면접 분위기도 좋았고
입사하고 싶었는데 아쉬웠습니다
불합격 연락은 따로 주시지 않는다고 들었습니다
좋은 경험이였습니다
면접비 챙겨주십니다"
4,(주)디지텍시스템스,IT/웹/통신,"분위기도 좋았고, 전문적인 질문이 있었습니다.""","이직사유, 희망연봉, 입사포부에 대한 질문",매우 좋았던 기억
5,(주)딜리,IT/웹/통신,"서류 제출 후 전화로 연락이 와서 1차면접 일정 조율. 1차 면접 합격 후 전화로 합격통보하고 2차면접 일정 조율. 2차 면접 후 전화로 합격 통보.""","1. 시사 관련 영어 질문에 대해 영어로 답하기
2. 회사 제품들에 대해 아는지
3. 어떤 동료와 함께 일하고 싶은지",질문은 무난했고 분위기도 평범함
6,러닝플러스(주),IT/웹/통신,"서류 지원 후 다음날 연락와서 면접 바로 잡아서 50분동안 1:1로 진행 > 이후 2일 이내 연락 준다고 했지만 무반응으로 있다가 11일 이후 연락와서 2차면접 있다고 통보함 > 다대다로 또 50분 내외 면접 봄""","1. 결혼 이슈가 있다면 어떻게 할 것인지?
2. 각자 MBTI로 장점과 단점을 말해보시오
3. 안정적인 기업이란 어떤 기업이라고 생각하는지?","채용전형 절차 안내 없이 2차 면접까지 진행하는 경우는 처음 이었습니다.
1차 50분내외 2차 50분 내외로 2시간 동안 아주 많은 질문을 받습니다.
합격 안내도 2일 이내로 된다고 했다가 11일 이후 진행하면서 1차 합격한 것은 또 신기했고, 체계가 없고 안내가 너무 부족하여 지원한 입장으로는 참 힘들었습니다."
7,(주)엔와이컴퓨터,IT/웹/통신,"자기소개 후 전 직장에서 어떤 일을 했는지에 대한 질문""","야근에 대해 어떻게 생각하는지
전화업무에 대한 거부감이 없는지",경력면접이라 경력 위주의 질문이었고 편안한 분위기에서 진행됐습니다.
8,(주)아임유,IT/웹/통신,"인사담당자의 유선 연락을 통해 면접일정 잡음""","1. 가족적인 분위기
2. 투자사와의 공동체 업무
3. 장기근속","전체적으로 가족적인 분위기로 근무할 수 있는 사람을 원하는 듯 했으며, 면접관 모두 질문에 대해 친절하고 자세하게 설명해줌"
9,(주)씨앤에스,IT/웹/통신,"기본적인 영단어를 기본적으로 쪽지 시험 식으로 진행하고 일정 기간 동안 학습한 내용을 바탕으로 발표함""","집에서 가까운지, 선호하는 라인 있는지, 기숙사 여부 등",대체적으로 면접은 간단했지만 인원이 잘 안걸러지기 때문에 이상한 사람이 현장으로 투입될 가능성도 잦음
10,한국화웨이기술(유),IT/웹/통신,"서류-전화면접-1차면접-2차면접

전화면접 보시는 한국인이 중국어를 못한다. 여기서 아,, 화웨이도 개판이구나 느낌. 1차면접 한국인이 봐주시는데 제일 면접 같았음. 2차면접은 중국인분들이 봐줌.

연봉...""","자기소개(영어, 중국어)
지원동기
별거없고 매우 쉬웠음.","키스템프 2023년 계약직->정규직 된 분이 전체에서 총2명이라고 함.

계약직은 정규직 될 가능성이 매우 매우 희박하니 입사하자마자 이직 준비하는게 좋을듯."
11,지2터치(주),IT/웹/통신,"1 2차로 나누어져있음
면접관이 무려 4명이던가? 5명이던가? 들어와서
실무하고 아무런 상관없는 20년도 더 지난것들을
질문함""","개인이 하고다니는 것, 생겨먹은 것을 아무런
생각도없이 함부로 지적하는 뉘앙스의 질문",아무리 취업때문에 갔다고해도 서로 최소한 예의는지킵시다
12,(주)인포웍스,IT/웹/통신,"서류 심사 후 1회 면접
임원 2, 팀장 1 참석
전반적으로 호의적인 반응
지난 업무에 대한 질문 위주로 면접 진행""","면접 후에 MBTI랑 평소 대인 관계에 대해 물어봤음
영어 점수나 자격증이 있으면 도움이 됨",경험 위주로 설명하고 이 회사에서 활용할 수 있다고 생각하는 점을 어필하는 것이 중요한 것 같음
13,인베니아(주),IT/웹/통신,"지원후 3일(?)정도 후에 연락옴. 면접은 첫 연락후 1주일 이후에 봤음. 3명(팀장 책임연구원 인사팀장) 으로 구성되어 업무에 관련된 부분 확인 및 경력사항 확인""",이직에 관련되어 이직 하려는 이유 와 내 경험상에 PLC를 얼마나 다룰수 있는지에 대한 부분,이직관련하여 이직이유 솔직하게 이야기하고 못하면 못한다 할줄 아는거면 할줄안다 라고 솔직히 답변함 또한 말로 넘기는 것보다 예시를 드는게 좋음.
14,(주)하이퍼정보,IT/웹/통신,"구직 사이트를 통해 지원했고 면접 시 질문이 황당해서 저도 비슷한 태도로 행동했습니다.""",1. 경력관리 2. 전직장 업무 3. 출근거리,면접 시간이 10분이나 지나서 들어갔는데 일단 인상이 좋지 않아 보이는 면접관 1인과 면접을 보았고 경력 관리에 대한 문제 제기를 하는데 그건 서류 전형에서 진행 된 것을 왜 굳이 면접에서 문제 제기하는지 이해가 안됐습니다.
15,(주)콘텐츠브릿지,IT/웹/통신,"다른곳과 함께 면접을 진행하였고 면접당시 분위기는 상당히 좋았습니다.""","개별,조별 등 심화면접은 없었으며 중소기업 답게 인성을 보고 이사람이 잘할 수 있는지 판단하기 위한 질문",있는 그대로의 생각을 이야기 하였습니다
16,(주)에이플러스엑스,IT/웹/통신,"이력서 제출하고 전화문자로 면접제의 옵니다""","1. 왜지원했는가
2. 급여는?
3. 채용해야하는 이유는?","사람불러놓고 답변은 듣는둥 마는둥
결과통보 해준다고 했으면 통보하는게 맞지않나요?
약속은 지키셨으면 좋겠네요
기본입니다"
17,아이티스정보통신(주),IT/웹/통신,"전체적으로 편안하고 좋은 분위기에서 진행되었습니다!!!""",영업지원으로 취업을 하는 것이었어서 직무전환사유에 대해 여쭤보셨습니다!,더 새로운 도전을 위해 변경하게 되었다고 답을 드렸고 전체적으로 좋은 분위기에서 진행되었습니다!
18,(주)아이디어오디션,IT/웹/통신,"대표 직접 면접 진행
정확히 58분 면접 진행하였고 합격여부 안내는 이틀뒤 연락옴""","요즘 중소에서 경험하기 힘든 압박면접스타일
면전에서 자존심상하는 질문을 서스럼없이 하는 편
본인 커리어가 망했다고 생각하지 않나?
나이에 비해 경력이 없는데 왜 다른직종으로 이직하나?",모든 회사가 그렇지만 어떻게 빼먹을수 있을지 고민하는게 눈에 보이는 대화방식
19,(주)앱코,IT/웹/통신,"전화 통보 후 시간에 맞춰 사무실에서 대면 면접""","경력이 어떻게 되는지 중점으로 물어보고
나이는 이력서에 나와있는 데 구지 또 물어보더라구요
취미는 말했더니 자기와 다르다고했습니다.
주량은 잘못마신다고 대답했는데 소주 기준으로 끝까지 물어봤습니다.",면접 때 사진이랑 제 모습이 다르다고 증명사진이랑 다르다고 그거밖에 잘 기억이 나지 않습니다.
20,인천스마트시티(주),IT/웹/통신,"서류심사 통과하고 얼마 지나지 않아 다대 다 면접을 보았고, 다음날 바로 합격통보""",인사랑 노무의 차이가 무엇인가에 대한 질문이 생각이 남,뻔한 대답 적당히 이야기 하였음. 좋은 질문은 아니였다고 생각함
21,(주)디에스전자,IT/웹/통신,"면접을 하는 사람들이 무슨 업무를 시켜야하는지,전체적인 프로세스나 업무 스타일을 모르고 들어옴
자기가 알고 있는 지식에서만 질문함 하지만 그게 업무랑은...""","자기 경력에 대해서 설명해주세요
전에 다닌회사에서 문서작업을 하셨네요 무슨 문서인가요?",자기능력에 대해 설명만 한다면 엄청 쉬움
22,(주)씨코드,IT/웹/통신,"면접 시 자바에 대한 기본 개념과 안드로이드에 대한 질문을 하시고, 잘 대답하지 못했을 때는 상세히 설명해 주십니다.""","평소에 깊이 생각하지 못했던 이론에 대해 질문하셨고, 대답하지 못했을 때 하나 하나 알려주셨던 게 기억에 많이 남습니다.","알고 있는 부분에 대해서 대답했고, 이사님께서 알려주신 것을 들었을 때, 제가 아는 게 제대로 아는 게 아니라는 걸 느꼈고, 더 공부해야겠다고 생각했습니다."
23,엑토(주),IT/웹/통신,"물건 종류가 매우 많았고 배울려면 어려울것같았습니다.""",근교에서 잘 알려진 업체이고 실무 경력으로 질문하셨습니다.,종류가 많아 외울게 많을거같습니다.
24,(주)바이렉스,IT/웹/통신,"1. 전화 인터뷰
2. 대면 면접(1,2차 통합)
3. 인적성 검사

*1,2차 통합 대면면접 시간이 길다""","직무가 중국어를 보는 직무여서 영어(작문),중국어(구술) 시험이 있었다 (영업관리 제외 어학 면접이 있는지는 모르겠음)","면접을 정말 자세히 보시고 회사에 잘 녹아 들 수 있는 사람을 뽑는다는 느낌이 있음
(면접비 있음 !)"
25,(주)덴컴,IT/웹/통신,"서류 제출 후 서류 합격후 대면 면접""","1. 지원동기
2. 이력서에 서술된 기술 질문
3. Front-end 관련 프레임워크 질문",기술적으로 많이 이야기 할 수 있는 경험
26,(주)백퍼센트,IT/웹/통신,"잡코리아에서 확인하고 이력서 넣고 면접 진행""",자기소개 꿈 10년 후 나의 미래 전직장,그냥 그랬어요 별 거 없었고 무난했어요
27,(주)글로벌텔레콤,IT/웹/통신,"경력직으로 이직했으며 이력서 제출 후 경력 관련 면접이 이루어졌으며, 곧바로 최종면접까지 이어졌습니다.""","이직 사유, 희망연봉, 앞으로의 비전",당시 담당 면접관님으로부터 지원자를 배려해준다는 느낌을 많이 받았습니다. 편한 분위기 속에서 자유롭게 면접을 할 수 있었습니다.
28,(주)크리에이츠,IT/웹/통신,"서류전형- 코딩테스트- 실무진 면접- 채용""","이직 사유가 뭔가, 지원동기는?, 취미는?","학업, 개발자로서의 보람, 골프"
29,(주)사이언,IT/웹/통신,"1대1 면접으로 직무기술에 질문해주셔서 서술하는 형식으로 진행했습니다.""",방산 전문 용어를 물어보셔서 알고 있는 지식이라 다행이 대답해 드렸습니다.,체계가 있는 회사라고 생각했습니다.
30,빅솔론(주),IT/웹/통신,"2번 면접 봅니다.
1차가 기술질문
2차가 임원면접
2차까지 가면 한 반정도 붙은거.""","지원이유 물어봅니다.
업무관련 질문도 했었음
크게 어려운 기술질문 없음",수직적
31,(주)동탄이엔지,IT/웹/통신,"어려운 부분은 없고 기본적인 사항들만 물어봤습니다.
집은 어디인지,성실하게 열심히 근무할수 있는지, 건강은 어떤지 물어봤습니다""","기억에 남는건 딱히 없었고, 일반적인 면접형식이라 생각됩니다. 그래도
편한 분위기속에서 면접을 진행해서 수월했습니다.",친절하셔서 긴장 안하고 면접 진행했습니다.
32,로봇앤컴(주),IT/웹/통신,"갑자기 내일 올수 있냐, 면접 보고 결과 일주일내로 알려준다함""","var,let,const 차이는?
본인이 원하는 연봉 최저점",젊은 회사
33,코츠테크놀로지(주),IT/웹/통신,"서류합격 후 연락오고 면접일정이 잡혀서 면접 진행했습니다.
1대 3 면접으로 진행했고, 면접관들은 팀장급 이상의 분들이 오셔서 진행했습니다.
이력서보시고, 프로젝트에서 무엇을 했는지에 대한 질문들을...""","1. 야근이 있으면 어떻게 할 것인가?
2. 프로젝트중에서 내가 한 역할
3. 가장어려웠던 일은 무엇인지",그냥저냥 솔직히 편안한 분위기에서 진행했습니다.
34,가민코리아(유),IT/웹/통신,"(1차) 인사 담당자 폰스크린, (2차) 한국 Country manager 와 Marketing manager 직무 면접, (3차) 아시아 지역대표, 아시아 마케팅 총괄""",한국 시장 내 마케팅 전략에 대한 직무 면접을 진행함.,APAC 본사인 대만 직원들과 화상으로 면접 진행하였음. 면접과정이 체계적이고 HR 담당자가 굉장히 친절하고 투명하게 면접 과정을 진행해주었음.
35,(주)리더스시스템즈,IT/웹/통신,"실무진 면접 후 바로 간단하게 임원 면접?이 있었습니다.""","주로 전회사에서 한 업무에 대한 질문이었습니다.
어떤 업무를 해왔는지, 퇴사한 이유 등
그리고 지원한 회사가 어떤 분야의 회사인 것을 아는지 질문이 있었습니다.","분위기는 나쁘지 않았습니다.
이 회사 분야에 대해 알고 가면 좋을 것 같습니다.
면접비를 받아서 좋았습니다."
36,(주)씨아이제이코리아,IT/웹/통신,"처음 회사 지원 동기랑 자신의 강점등을 물어봤고, 후엔 회사가 어떤일을 하는지 설명해 주셨습니다.""","1.출장이 괜찮은지
2.성실하게 일할 수 있는지
3.차가 있는지","편안한 분위기에서 면접이 진행되었고, 업무에 관해 설명해주셨습니다. 처음엔 이 회사가 저에게 맞을까 고민을 많이 했는데, 면접관님께서 정말 상세히 알려주셔서 고민해소에 도움이 많이 되었습니다."
37,에프투텔레콤(주),IT/웹/통신,"면접은 어렵지않으나 뭔가 기분이 좋지않은건 기분탓일까.""","면접질문은 무난했으며, 직무에 대해 물어보기 보단 인성 질문이 대부분이였다.",면접을 보면서 이회사의 분위기와 지원부서의 흐름을 파악하다보니 특정직무가 자주공고가올라오고 리뷰가삭제되는지 알거같았다.
38,(주)딥엑스,IT/웹/통신,"하루에 면접이 진행되며 1대1 면접 위주로 총 3번을 함.""","1. 본인이 가진 일에 대한 철학
2. 왜 해당 회사에 지원하게 되었는지의 동기
3. 어려운 상황에서 해결하는 방법",스타트업이지만 사람들의 실력이 좋은 것으로 느껴졌었음.
39,(주)지에스디랩,IT/웹/통신,"1회 연락 , 1회 면접, 보통 일주일내로 연락 줌
면접 분위기는 나쁘지않게 만들려고 노력함""","면접을 여러명이 봤는데 대표가 제일 늦게 옴
애인있냐는 질문이 제일 기억에 남네요
스펙에 대한 부분은 크게 확인을 안합니다.",그냥...피곤하겠다
40,(주)앤비젼,IT/웹/통신,"1차-실무면접(1:1)
2차-사장면접(1:1) & hr면접(2:1) 진행""","이직사유
인성질문
입사하면 담당하게 될 실무 이야기 등","실무, hr 면접은 긍정적이었습니다. 지원자를 압박하는 분위기가 아니라 편안한 분위기에서 진행됐습니다.
대표면접은… 지원자 앉혀놓고 1-2분 정도 본인 자리에서 업무?보다가 면접 시작했습니다. 굉장히 무안하더군요
질문도 고등학교, 대학교 위치 등 인성질문과는 거리가 먼 느낌을 받았고 그냥 관상면접 보는 느낌이었습니다."
41,(주)디엘티,IT/웹/통신,"서류 합격하고 나면 카톡으로 면접 제의 연락이 오고 바로 전화가 온다 모든 과정을 대표님이 직접 하신다 면접날 들어갔는데 아무도 신경을 안 쓰는 분위기였다 앉아서 5분 기다리니 대표님이 오셨다 보자마자 왜...""","1. 본인이 회사 다니는 중에 뭐라고 하면 꽁해 있을거냐
2. 배울 자세가 없으면 편의점 알바나 해라 어떻게 생각하냐
3. 내가 ~씨 답변하는 거 따라할테니까 잘 봐라 어떤 거 같냐",면접내내 지원자를 향한 존중이 없었습니다 지금까지 본 면접 중에 최악이였습니다 계속 편의점 아르바이트에 대한 비하를 했습니다
42,(주)삼보컴퓨터,IT/웹/통신,"면접 분위기는 좋았습니다. 세 분과 면접을 진행하였고 경력과 직무에 관련하여 상세하게 면접을 진행하였고 이차 면접 결과를 기다리는 중입니다.""","비지니스 회화가 가능한 영어 실력을 갖추고 있는지, 제품 디자인 양산까지 팔로우 하였는지, 집과 근무지와의 거리에 대해서 여쭤보았습니다.",면접을 보며 회사에 대해서 잘 설명해주셨고 직무에 관련하여 자세하게 설명을 해주었습니다. 전체적인 면접 분위기도 편안한 분위기에서 진행되었습니다.
43,(주)이비즈테크,IT/웹/통신,"면접제의가 와서 면접을 봤습니다.
그런데 멀리서 면접온 사람에 대한 예의가 전혀 없더군요
먼 시간을, 스케줄을 비워서 간곳인데 면접제의를 한곳이엿음에도 불구하고
코치코치 캐묻고, 예의없는 말투와, 기분나쁜...""",그런식으로 설명하면 알아들을수가 없다. 사수 없이도 바로 업무투입해서 일할수 있냐,"정말 예의가없고, 면접자에 대한 존중이 전~혀 없는곳입니다.
괘씸할정도로요."
44,(주)유니텍,IT/웹/통신,"면접에서 기술적인거 간단한거 몇개 물어보고 끝입니다 신입면접이라 쉬웠던것같아요""",담배를 피우는지 여자친구가 있는지 tcp udp 차이가 뭔지 이렇게 기억에 남네요,별거아닌것도 질문하는 느낌 인성을 많이봄
45,하나시스(주),IT/웹/통신,"평이하게 학업에 대한 질문 및 취미등을 질문하였으며, 직무관련 경험에 대한 질문""",별로 특별한 질문이 없어서 기억에 남는게 없다. 술얼마나 마시냐는 질문정도,편안
46,(주)럭스로보,IT/웹/통신,"로보틱스 관심이 생겨서 서류 냈는데 합격하고 코테 합격""","1. 경력직이라서 제출한 이력서 기반 프로젝트에 대한 질문
2. 왜 럭스로보에 입사하여야 하는가?
3. 10년 후 나의 모습?",전반적으로 편하고 자기 커리어가 확실하면 무난한 난이도
47,(주)에즈웰플러스,IT/웹/통신,"3차면접까지 있는데 이력서로 어느정도 내정하고 1차 면접 진행하는 듯. 1차 면접 통과하면 1개월 인턴한다고 함. 아마 인턴 중간에 한번, 인턴 끝나고 한번 해서 3차 면접 진행되는 것 같음.""","가족관계, 꿈, 그 외 회사에 대해 궁금한 점.",1차 면접 질문은 크게 대답하기 어려운 건 없었음. 그냥 사람인지 아닌지 보는 정도 느낌의 가벼운 면접이었음.
48,누리콘(주),IT/웹/통신,"사람인 서류 제출, 1회 면접, 2주 후 결과 발표, 연봉, 입사일정 협의""",담당 업무 관련 내용을 주로 물어 봤던 것으로 기억한다.,면접 난이도는 비교적 쉬운 편
49,디아이,IT/웹/통신,"1차 면접 후 임원 면접 진행 그 이후 인터뷰""",이력서 위주의 질문으로 본인이 한 일을 말하면 됩니다,이력서를 보고 있었던 내용을 답변함
50,(주)씨엔피테크,IT/웹/통신,"면접 때 업무관련이 아닌 사적인걸 물어봄""",가족관계. 주거지만 물어봄 면접보는 사람이 정해져 있지 않아 입사한 사람마다 후기가 다름,그냥 관상보고 사람을 뽑아서 제대로된 사람이 안옴
51,(주)바이텍테크놀로지,IT/웹/통신,"개별면담 방식. 일반적인 면접 방식입니다. 큰 이슈사항이 있지는 않음""",업무적인 부분. 회사적인부분 일할수 있는지 정도 확인하는 느낌입니다.,크게 기억에 남는 점은 없습니다.
52,어드밴텍케이알(주),IT/웹/통신,"전화로 날짜와 시간을 조율해서 전달받음. 당일 방문 후, 면접관 2 본인 1 형태로 면접 진행 (수시채용)""","특정 전공수업에서 어떤 것을 배웠는지, 공백기동안 뭐 했는지, 회사에 입사해서 어떤걸 이루고 싶은지, 엑셀 함수 중에 자주 쓰는게 뭔지","굉장히 조용한 분위기에서 차분하게 면접이 진행되었고, 압박면접같은건 전혀 없었음. 오히려 부드럽게 대해 주셔서 긴장을 줄이는데 도움이 되었음."
53,아구스(주),IT/웹/통신,"직속 상사 1차, 본부장 2차 면접 후 채용됨""","1. 전공과 다른 직종의 구직이유
2. 여가시간 어떻게 활용하는지
3. 곤란할때 대처 방법",전무님께서 능력보다는 가능성을 보고 채용하려는 느낌을 받았습니다
54,팀넷코리아(주),IT/웹/통신,"기본적인 질문은 미리 제출 된 이력서 바탕으로 진행되었다""",저기 pr 항목에서 어떤 부분을 최고로 해보고싶냐는 질문,지원자에 대한 기본적인 예의를 갖춘 느낌을 받았고 답변 경청 자세 또한 나쁘지 않았음
55,(주)프리그로우,IT/웹/통신,"소스를 가지고 거기에 대한 리뷰를 해주는 형식""","개발을 시작하게 된 이유, 내 개인 소스로 리뷰를 해주는 방식",내 소스를 꼼꼼히 봐줘서 리뷰를 하니 당혹스러웠고 내 소스를 다시 떠올리게 되었음
56,(주)아싸컴,IT/웹/통신,"좋은 면접관분들. 개발,라이브러리 등 개념에 대한 질문들도 있으므로 코딩도 중요하지만 개념도 잘 익혀가는것이 중요해보였음""","공유를 원치 않아하시는것 같아, 자세히 적지 못하겠지만 코테는 1개, 기술질문은 약 10개정도였던것으로 기억합니다. A4용지에 질문이 적혀있고, 이에대한 응답을 말로 서술하는 형태입니다.","면접관분들이 상당히 친절하셨어요. 아직 부족한 실력임에도 불구하고 절대 까내리지 않으시고, 괜찮다하며 위로해주시고, 장점들만을 찾아 칭찬을 해주십니다.
참고로 1:2로 면접관 2분과 진행했습니다."
57,(주)에이직시스템,IT/웹/통신,"간단한 대화만 하다가 끝나고 일주일 뒤 연락""","지원 동기, 전공과 다른데 지원한 이유, 취미 활동",전체적으로 무난했고 어려운 느낌의 질문은 하나도 없었다
58,케이디텍(주),IT/웹/통신,"면접은 간단했으나 문자 안내 등 소통 및 통보가 최악이였음.""",면접은 20분내로 끝났고 딱히 궁금점은 없어보였다. 편집디자인 전망이 좋지 않은데 왜 편집디자인을 하냐 그런 질문을 했다. 본인이 뽑을 사람한데 그런질문을.....,편집디자인이 적성에 맞고 하고 싶었던 일이라 하고 있다고 말함
59,서울스탠다드(주),IT/웹/통신,"사람인 이력서로 지원하여 1주일 후 면접 연락이 와서 보게 되었습니다.""","입사 지원 동기, 야근 가능한지? 출장 가능한지? 납땜 가능한지? 말고는 잘 기억이 안나네요",다 가능하다고 말했고 딱히 드는 생각은 없었습니다. 평범한 면접이였습니다
60,(주)케이티엔에프,IT/웹/통신,"이력서 지원한 후에 면접 요일 통보
면접시 팔 다리 다 붙어있으면 통과""",술 잘먹나? 출퇴근에 관하여 그외잡담,면접이랄게 없다. 그냥 가면 됨
61,중방정보,IT/웹/통신,"3명 동시에 면접진행하여 질문이 많지도 않고 대충대충 보는면저임""",잘할수있냐. 열심히 할수 있냐. 영업에 대해서 아는가. 여기가 뭐하는곳인가.,아무나 뽑아서 일단 일부터 시키고 거기서 맘에드는사람 안자르고 계속 지켜보는것 같음
62,(주)테트라,IT/웹/통신,"면접일정은 문자 안내로 받았으며 경력사항을 위주로 면접이 진행되었습니다.""",결혼유무와 자녀 출산 계획 관련 질문을 했습니다. 질문보단 면접관 말이 더많은편,기혼자라는 사실을 들으신 이후에 대놓고 출산계획을 물었으며 출산계획은 아직 없다 대답하였으나 일어나지도 않을 일에 대해 걱정하며 부정적으로 면접을 보셨습니다.
63,(주)미러로이드,IT/웹/통신,"헤드헌터에게 연락받고 면접 진행 후 불합격""","문제 풀이 과정, 잘 되었다고 생각하는 작업, 안되었다고 생각하는 작업",답변이 까다로운 질문이 많았다.
