,company,job,title,question,answer
132,(주)피디정보통신,IT/웹/통신,"서류통과 후 연락이 와서 대면 면접을 봄 1대1 면접이였고 긴장되지 않게 분위기를 잘 풀어주심 기술질문 조금 있고 기본적인것을 물어보심 코딩테스트 있음""","1. 지원동기
2. JVM,JRE,JDK 차이
3.포부",너무 면접느낌이 아닌 대화 느낌이였음 편한 분위기 이기는 하나 도움은 안됨
133,디비에프아이에스(주),IT/웹/통신,"이력서제출 후 일주일 이내 연락 및 전화인터뷰
최종까지 신속하게 진행됨""",질문은 무난했으나 인상깊었던 점은 대표 및 임원들의 면접자를 대하는 태도에서 사소하지만 면접때문에 귀한 연차사용해주셔서 감사하다는 말이 인상깊었음,면접자를 대하는 태도가 상호동등한 분위기
134,(주)아비도스,IT/웹/통신,"간소한 분위기로 1:1로 대화 하듯이 했음, 이력서 지원 후 1차 인터뷰만 진행""","기본적인 이직사유, 이력서 내용에 대한 질문, 입사가능일?, 희망연봉 등 기본적인 질문만 있었던거 같음",분위기는 좋았습니다
135,(주)웨이센,IT/웹/통신,"면접 결과를 세 번이나 미루고, 약속 따위 지키지도 않고 면접자 무시하는 최악의 경험""","1. 포트폴리오 위주의 질문
2. 자기소개 + 전의 회사에서 했던 업무 위주의 질문
3. 영어 질문","규모가 그렇게 크지 않는 회사라도 진짜 면접 결과 과정에서 체계가 없으며 면접자에 대한 배려가 1도 없다고 생각함. 심지어 먼저 면접제안을 왔으며 면접을 본 날에도 1일 후에 면접 결과 알려준다 말하고, 그 뒤로는 그 다음주, 그리고 2-3주 (여기부터가 말이안됨) 에 결과가 어떻게 되었든 알려준다고..^^ 해놓고 완전 잠. 수
다른 회사 어차피..."
136,에스티아이네트웍스(주),IT/웹/통신,"사람인 이력서 열람 후 문자왔음. 바로 면접 날짜 잡고 면접 진행봄.""","인성 면접, 학원에서 배운 것, 다양한 제품을 배울 수 있으니 공부 열심히 해라.",면접 자체는 어렵지 않음. 그냥 편하게 물어봄.
137,이씨뱅크(주),IT/웹/통신,"서류 합격하면 전화 연락으로 면접 날짜 맞춰주셔서 좋았습니다.

대부분 이력서, 자기소개서 기반으로 많이 물어봤습니다.

끝나면 필기 시험을 보는데, 대학 전공 수업에서 배웠던 지식들로 풀 수 있을 정도의...""","프레임워크가 뭐라고 생각하는지에 대해서 물어봐주셨던 질문이 기억에 남습니다. 프레임워크의 정의 정도는 생각하고 갔었는데, 저의 의견을 물어보시는 것 같아서 기억에 남습니다.","트랜잭션, AJAX, Database 등 프로젝트에서 사용하거나 혹은 필요한 부분들을 많이 물어보는 것 같습니다. 면접 분위기는 나쁘지 않고, 질문하면 대답도 해주시고 편안한 분위기 였습니다."
138,써티웨어(주),IT/웹/통신,"보통 인맥과 지인 추천으로 인해 들어가는 경우가 많으므로 결과가 확정된 수준에서 면접이 진행됨""","대학교에서 진행한 프로젝트에 대해 간략히 설명
dbms는 무엇인가",면접느낌보단 얘기하는 수준의 느낌이듦
139,(주)삼인에이치엔티,IT/웹/통신,"경영지원팀에서 문자와서 본사 방문
팀 이사 1명, 경영지원팀 1명 면접 진행
면접 결과 문자로 받고 출근""","딱히 없음 기본적인 질문 물어봄
지원동기, 입사하게되면 포부",지원동기나 입사하게되면 포부 같은 것 물어봤음
140,(주)다온티에스,IT/웹/통신,"서류 넣고 전화로 합격 연락주고 면접 의사 확인함, 첨여 의사 전달하면 면접 안내 문자 옴""","1. 채용 후 직무가 변경되면 어떻게 할 것인지
2. 상사가 나이가 어릴수도 있는데 어떻게 생각하는지
3. 술 잘 먹는지","사무실 도착해서 면접을 보기까지 과정이 체계적이고 전문적으로 느껴졌다
면접 복장이 정장이었고 분위기는 딱딱하지 않지만 장난스럽지도 않은 분위기"
141,(주)하이퍼라운지,IT/웹/통신,"자소서 기반의 면접
하지만 기술적인 부분이나 전문적인 부분은 물어보지 않음 아직 기술적인 부분을 많이 접해보지 않아서 그런 거 같음""",10년 뒤의 계획이 무엇인지 어떤 계획을 가지고 있는지 목표 등,편안한 분위기 하지만 자소서를 보면서 전문적이지 않다고 느낀 듯 함
142,아스펜스(주),IT/웹/통신,"사장,팀장과 2대1로 면접이 진행되었고 프로젝트 경험이나 인성관련 질문만 받았음. 코테는 없음.""",팀 프로젝트 경험 관련 질문중 본인이 팀플에 얼마나 기여한것같냐고 물어보심,솔직히 답변하였음
143,(주)브이스퀘어,IT/웹/통신,"간단함 자기소개 후 제출한 포트폴리오를 기반으로 어떠한 업무를 하였는지 짧은 pt를 진행하고 회사 진행과 전반적인 설명을 들었음.""",pt를 통하여 굳이 질문을 받지 않아도 어떤 업무를 진행하는지 전달할 수 있었음,자기소개와 같은 긴글보다 경력자의 역량을 볼 수 있고 어필할 수 있는 면접이 었다고 생각함
144,(주)프로엔솔루션,IT/웹/통신,"서류 작성 후 면접 관련 연락을 받음. 가서 자기소개하고 여러가지 지식물음""",딱히 기업에 남는 면접질문은 없습니다. 개발 지식을 물어봅니다. 기초지식,별로 특별하지는 않다
145,(주)매사,IT/웹/통신,"서류 합격 연락 오고 면접 날짜랑 시간, 장소 알려줍니다
알려준 날짜, 시간, 장소에 맞추어서 가시면 됩니다.""",우리는 인성을 중요시한다고 하시면서 자소서에 관한 질문들을 하십니다. QA직무 였는데 직무에 대한 것은 잘 없습니다.,"차분하게 답변하시면 됩니다.
최대한 면접자가 편안하게 하실려고 노력하십니다.
합격 연락을 받으시면 입사에 대한 것들도 상세하게 알려주십니다.
연봉과 복지 등이 직원을 생각하는 점이 보여 좋았고, 함께 하지 못하여 아쉬움이 남을 정도의 좋은 기업인 것 같습니다."
146,인사커뮤니케이션(주),IT/웹/통신,"전화와서 면접보자고 했고 1:1로 면접 진행했음""","왜 직종 옮겼는지, 왜 우리회사 지원? uiux에대해설명",면접 보러갔는데 일단 늦게옴 근데 죄송하단말도 없이 면접진행 무슨 사람 심문하듯이 면접보고 말하다가 짜름 예의가 없었음
147,(주)데이터마케팅코리아,IT/웹/통신,"1차 실무진 면접, 2차 대표와의 면담""","지원동기
경력사항
워라벨에 대한 생각","홈페이지 검색해서 데이터 어쩌고 하며 지원동기 말하면 픽 하고 웃음.. 아마도 많은 사람들이 그렇게 대답해서 그런가봄.
워라벨에 대해 물어봐놓고서는 대표는 워라벨 안좋아한다고 함"
148,(주)랩오투원,IT/웹/통신,"길디긴 면접 1회로 끝났습니다 기술면접1시간 인성면접1시간""",딱히 기억에 남는 질문은 없고 쉬웠습니다 자바스크립트 기초,리더가 잘 이끌어주실것같은 느낌을 받았습니다
149,새롬씨앤씨(주),IT/웹/통신,"공개된 이력서를 보고 전화를 주셨으며 무척 친절하셨습니다.""",특별히 기억에 남는 질문은 없습니다. 기술적 질문은 없었던 것이 특별하네요.,기술적 질문은 없었고 파견을 나갈 수 있는지 위주로 보시는듯 했습니다.
150,(주)상상인,IT/웹/통신,"구인구직 사이트를 통해서 먼저 연락주시는 편이며 면접 제안이 옴.""","평이하게 성격관련, 스트레스해소 , 가치관 관련",무난한 편이라고 생각합니다.
151,이노솔루텍(주),IT/웹/통신,"자기소개 처음에 시작하고 그 다음에 별도로 편한 질문 해주십니다 2명의 면접관이 번갈아가면서 질문해주십니다""","희망연봉 얼마로 생각하냐 질문, 들어와서 공부 많이해야되는데 가능하냐, 이직 생각있냐",면접관분이 웃음이 많아서 편하게 진행했습니다
152,에스유지(주),IT/웹/통신,"서류를 넣고 바로 면접을 보러 오라는 연락을 받아서 면접을 봄.""","우리 회사가 뭐하는 회사인지 아냐, 우리 사업 아이템이 뭔지 아냐, 언제부터 출근 가능하냐",면접이 아니라 회사 소개를 들으러 간 기분이었고 전문적이지 않아 신뢰도가 떨어짐
153,뉴라인컨설팅(주),IT/웹/통신,"친절하게 응대해주셨고, 편하게 임할 수 있었다.
아직 결과를 기다리는 중이다. 감사합니다.""","지원동기, ?... 일반적인 면접 방식과 동일했고 큰 차이는 없었다.
감사합니다.",좋았다
154,원텍시험연구소,IT/웹/통신,"스킬범위를 확인하려고 하고, 대기업 관련 경험유무를 굉장히 선호함.""",야근가능여부/출근가능여부(지리상 위치로 인한 부담성 확인하려는 것 같음/그외는 뭐 그닥,이력서 순서대로 읽어가며 궁금한걸 물어보는 인터뷰 같았음
155,(주)브이웨이,IT/웹/통신,"경력직을 슈퍼맨으로 보는 시선이 느껴졌습니다. 구직자도 기업의 이미지를 판단하는데, 별로 신경쓰지 않는 것 같습니다. 차선책이 있기에 다른 회사를 선택했습니다.""",업무적인 질문 이외에 별다른 질문은 없었습니다. 구체적으로 어떤 업무를 했는지 캐묻는 느낌이 강합니다. 경력직 면접인데.. 실제 경력인지 의심하는 느낌.,경력직한테 뭐 이리 바라는 게 많은지 모르겠습니다. 기대하는 수준이 지나치게 높은 것 같습니다.
156,(주)오렌지씨큐리티,IT/웹/통신,"어렵습니다 굉장히 폭 넓은 지식을 여쭤보세요.
얕게라도 넓은 지식을 갖고 가시는게 좋을 것 같습니다.""","보안 컨설팅과 모의해킹의 차이가 어떻다고 생각하세요?
주요정보통신기반 시설에 대한 진단 경험이나 실습을 해보셨는지",어려워서 대답을 많이 못한 부분도 있으나 결과적으로 많이 배우고 나왔다라는 생각이 많이 들었다.
157,산들네트웍스(주),IT/웹/통신,"인성면접을 중점적으로 보고 하게될 일에대해 설명해주고 미래 방향에 대해 말해줌""",딱히없었음. 열심히 할수있는지에 대해 계속 알아보는것 같았음.기억나는 질문없음,별로없음
158,(주)미니소프트,IT/웹/통신,"분위기는 먼저 부드럽게 풀어주셔서 좋았으며, 질문을 하시기보다는 역질문을 많이 하게 유도하셨음.""","공백기간 뭐했는지
전공이 아닌데 바꾼 이유가 무엇인지
좋아하는 브랜드나 어플이 있다면 이유가 무엇인지",질문에 대한 이해를 하지 못하면 잘 설명해주심
159,대신네트웍스(주),IT/웹/통신,"면접은 실무진(부장) 1 대표 1 면접자 1 로 진행되었음. 자기소개 하고 포트폴리오 조금 보시더니 기술 관련 질문 거의 없음. 코딩테스트 없음. 면접 자리에서 합격 통보 받고 입사일에 와서 계약서 작성을 함""","1 잘 할 수 있겠나
2 부모님 뭐하시는지",면접에서 채용까지 과정이 굉장히 빨라서 이게 맞나 싶었고 면접 때 부모님 직업을 물어보는 지금은 없어진 옛날식 질문에 회사 분위기를 약간 엿볼 수 있었음.
160,디에스앤지시스템(주),IT/웹/통신,"서류 지원 후 면접 일정 조율 후 면접진행 - 합격여부 문자통보""","학과와 지원한 직무와 차이가 큰데 어떤일인지 알고 지원했느냐, 왜 지원하게되었는가",이력서를 꼼꼼히 보신 느낌이 들어 좋았습니다
161,(주)나우시큐리티,IT/웹/통신,"면접 후 채용되는 과정이고 기술팀장과 회사 대표가 참석하여 2:1로 면접봄""","1.팀장으로서 가장 중요하게 생각해야하는 점, 원팀에 대해 어떻게 생각하느냐
2.기술적 질문 (리눅스 message 로그에 남는 정보, 윈도우/리눅스의 네트워크 이중화 명칭, tcpdump 명령어의 특정 호스트 로그를 확인하는 법, DBMS 의 명령어를 모아놓은 집합을 무엇이라고 하는가)","1.팀장은 팀원의 불만을 해소하고 업무에 집중할 수 있도록 하는 것이 중요하다. 원팀은 무슨 의의인지 잘모르겠다고 대답
2.message 로그에는 리눅스의 프로세스 관련 로그와 접속 로그등이 남는다
이중화 명칭은 현장에서 기억이 안나서 모른다고 대답(답 : 티밍/본딩)
tcpdump -i 인터페이스명 host IP주소
DBMS 명령어를 모아놓은..."
162,인텔렉추얼데이터(주),IT/웹/통신,"헤드헌터 통하여 지원서류 접수 및 면접 일정 잡음
1차 면접 대표이사와 줌으로 진행
경력에 관한 질문 진행""","어떤 직무를 수행했는지
타사와 다른 직무 타겟에 대해 어떻게 생각하는지
취미가 무엇인지","면접시 지원자의 대한 질문이 많은 게 맞지만 일방적임
면접 결과 안내 없음"
163,(주)레이풀시스템,IT/웹/통신,"이력서 제출 후 문자로 면접 날짜를 조정했습니다. 대부분 이력서내에 적혀있는 내용을 여쭤보셨습니다.""",그전에 해봤던 프로젝트와 사용가능한 언어를 여쭤보셨습니다.,제가 할 수 있는 부분을 최대한 어필했고 편안한 분위기에서 면접을 보게끔 도와주신 것 같습니다.
164,범일정보(주),IT/웹/통신,"개발자에게는 풀스택을 요구하며 엔지니어는 별 관심이 없음 그냥 다 붙음""",기억에 남는 질문이랄게 없을 정도로 임팩트 없는 면접이였음,그냥 저냥 평범한 인생을 살아왔으면 엔지니어로는 다 붙을거같움
165,(주)위주,IT/웹/통신,"앱으로 지원해서 면접 날짜 잡고 1회 면접 후 채용""","출근 여부, 복지 관련, 기술문의",좋았어요
166,일루텍코리아(주),IT/웹/통신,"전화로 면접 일정을 잡은 후 면접보고 다음날 전화로 합격 통보하였음.""",1. mbti 2. 부모님 직업 3. 개발 역량,"한 분은 진지하게 개발 관련하여 개발 스킬, 개인프로젝트 등을 물어보았고 한 분은 그냥 mbti 같은 거 질문함"
167,(주)한결피아이에프,IT/웹/통신,"1:1 면접이었고 2차 면접까지 진행""",자기소개 장점 단점 등등 영업지원도 있는데 괜찮은지?,편안하게 해주셨지만 그렇게 즐거운 면접은 아니였던거 같습니다~ㅠ
168,(주)르뮤제,IT/웹/통신,"면접 후 수습으로 일하게 되었습니다.""","회사 근처에 사는지 , 이전회사를 왜 그만두었는지, 개발 잘하는지 물어봄",좋습니다.
169,(주)스마트시티코리아,IT/웹/통신,"전화로 면접 일정 잡고 그 날짜에 방문함""","1. 전 직장 퇴사 이유
2. 회사 홈페이지를 봤을 때 어떤지
3. 이력 내용에 대한 질문","솔직하게 답변함. 다만, 어차피 뽑을 생각도 없어 보이는데 왜 부르는건지.. 시간 내서 가는건데 장난치지말고 진지하게 임했으면"
170,(주)에이쓰리시큐리티,IT/웹/통신,"구직 플랫폼을 통해 직접 지원했고 연락이와서 면접을 보러감""",형제는 있냐 ? 여자형제냐 남자형제냐? 어디사냐? 시시콜콜한 질문위주로 함,업무랑 상관없는질문을하며 분위기는 압박면접….당황스러웠음
171,(주)마인즈앤컴퍼니,IT/웹/통신,"까페에서 진행되었고 자유로운 분위기에서 편안하게 대답할수있었음""",데이터 사이언트스트로 지원했지만 개발쪽에 더 포트폴리오가 맞아보인다거 하셔서 데이터베이스 관련 질문을 하셨음 성능최적화를 위해 어떤게 중요할지?,피드백도 잘 해주시고 진로 방향 설정에 도움주실만한 것들을 많이 말해주셔서 역대급 좋은 면접경험이였음
172,부영에이앤브이(주),IT/웹/통신,"얼마나 다닐 수 있는지 집이랑 얼마나 걸리는지 같은 간단한 질문만 받음""",지금 취업 무슨 준비하고 있는지 회사 퇴사후에 어떤 방향으로 취업할건지 등등,서류에서 뽑을 사람 정해놓고 면접은 형식적으로 보는 느낌
173,엠로케이션,IT/웹/통신,"문자로 면접 연락 왔으며 회사 부근 카페에서 면접 진행. 질문은 어렵지 않았으나 2차 면접은 실기.""","우리 회사에 지원하게 된 동기, 자신의 장점, 전공 관련",실무 경험자를 찾고 계신다
174,(주)에이브레인,IT/웹/통신,"전화연락후면잡일정캐치후전화통보가온다 생각보다 연락이 빨리 오는 편이다""",살아오면서 가장 기뻣던 기기억 에이브레인을 어떻게 샹각하는지 어려운상황에서 어떻게 극복하는지,나쁘지않은듯 좋은듯 애매합니다
175,스마트넷테크놀로지(주),IT/웹/통신,"1차, 2차 순으로 면접을 진행하며
바로 출근이 가능한지를 계속 물어보셨습니다.""","1. 부모님 무슨일 하시는지
2. 주량이 어떻게 되는지
3. 출근 바로 가능한지",2차면접은 형식상인거 같습니다.
176,휴앤시스(주),IT/웹/통신,"전화로 프로그램 만들줄아는지 / 유지보수 시키려고한다 / 전화 다음날 면접가능한지""",1. 학교에서 뭘배웠는지 2. 출장지역을 알려주고 괜찮은지 3.이전에 뭘했는지,"그냥 코딩쪽보다는 일반적인 질문들이많음 , 비전공이 아니라고 설명해도 다시 비전공이라고함"
177,(주)캐롯닷밀,IT/웹/통신,"자연스러운 대화를 하며 면접을 봤다.""",분위기는 좋았다. 작품 관련된 이야기보다 나에 대한 이야기를 좀 더 했던 기억이 있다.,나쁜 기억은 없다.
178,타파크로스(주),IT/웹/통신,"이력서 넣고 전화가 옴 유선상으로 날짜 확정 후 대면 면접""","데이터란 무엇이라고 생각하는가?
트렌드를 읽는 방법은 뭐가 있을까? 등",데이터에 대해서 자세하게 알고 있는지 확인하고자 하는 것처럼 보였음
179,(주)신시웨이,IT/웹/통신,"전화로 서류 합격 안내 후 면접관 4명과 면접자 1명으로 면접 진행""","자기소개 , 진행했던 프로젝트 관련 질문, 회사에 궁금한 점",주로 프로젝트 관련 질문을 많이 한다.
180,(주)아이디알인비전,IT/웹/통신,"사람인을 통해서 면접제안을 받고 이력서를 제출했음""","1. 어떤 걸 위주로 개발을 해왔는지?
2. 어떤 디비를 써봤는지?
3. 어떤걸 개발하고 싶은건지?",크게 업무에 도움되는질문은 없던거 같다
181,(주)헬스앤메디슨,IT/웹/통신,"지인의 소개였어서 실무진, 부대표 면접이 한번에 진행 되었네요.""","딱히 남는 기억은 없고, 개발 얼마나 했고, 평소에 취미는 뭐고 그런 일상적인 대화들?","있는 그대로 답변 했고, 애초에 지인의 소개로 들어간 터라 부담없이 대화를 주고 받았네요."
182,제이브릿지컴퍼니,IT/웹/통신,"오픈된 이력서를 보고 연락이 옴, 1차 면접 2차 과제 3차 티타임 거쳐 선발""",마케팅은 무엇이라고 생각하는지? 면접에 왜 응했는지? 영어 질문,"경험과 느낀점 토대로 답변, 면접관이 성실히 이력서를 보고 참석한 티가 났고 면접관들끼리 사이가 좋아보였더"
183,(주)케이브레인컴퍼니,IT/웹/통신,"담당자 연락 후, 면접 진행하였습니다.""","스트레스 푸는 방법, 어려움 극복 경험, 직무 관심도 등","신입이다보니, 직무스킬에 대한 압박보다는 관심/열정 등을 확인하는 느낌입니다."
184,엔에이치엔크로센트(주),IT/웹/통신,"헤드헌터를 통해 입사하여 1,2차의 면접 과정을 통해 입사""","외근이 많을 수 있고 지방 출장가면 6개월이나 더 많이 있어야 할 수 있는데 괜찮은지?
AWS 어떤 서비스 사용해봤는지?
Detective 와 Inspector 설명",기초적인부분에 대한 질문을 하지만 면접자들이 잘 모른다고 생각함
185,우리엔아이에스(주),IT/웹/통신,"연락을 받고 날짜를 정한뒤 임원진 분들과의 대면 면접으로 채용이 되었습니다.""","업무 난이도에 대한 질문, 회사를 처음 봤을때 분위기, 포부",좋은 말씀을 많이 해주셨습니다.
186,(주)디지포머싸스랩,IT/웹/통신,"압박 분위기속에서 진행됨
대표이사의 행동이 매우 딱딱하고 불친절하였음""","싸스가 뭔지, 어느정도로 알고 있는지에 대한 질문
뭐하는 회사라고 생각하는지",검색 결과에 나올정도의 답변과 최근 시장현황에 대한 답변
187,인피노브(주),IT/웹/통신,"인피노브 측에서 연락이 왔고 회사 소개를 해주고 파일을 보내주심
읽어보고 면접 보러 간다함""","공백기 동안 무엇을 했는가?
할 줄 아는게 무엇인가?",전체적으로 좋게 봐주셨음
188,제이엔테크놀러지(주),IT/웹/통신,"전화로 연락이 와서 1차 면접 보고, 후에 2차 면접은 유선상으로 진행""","SQL 에 대해 이것저것 물어봄.
야간 작업 및 외근 가능한지.","아는 한도 내에서 대답했고, 야간 작업 및 외근도 가능하다고 답변"
189,알엠에이(주),IT/웹/통신,"딱딱하지 않는 면접 분위기에서 자유롭게 질문 대답을 하면서 면접을 했습니다.""","1. 빠른 시일 내에 근무할 수 있는지?
2. 주도적으로 일을 설계할 수 있는지?
3. 꼼꼼하게 일을 처리하는지?",무난하고 딱딱하지 않은 분위기에서 면접을 했습니다. 긍정적인 분위기였습니다.
190,(주)포메이션투,IT/웹/통신,"인사관리팀에서 연락이 와서 일주일뒤에 면접을 오라고함
사무실에 주차타워가 있어서 편하게 자차이용 가능했고
면접 분위기는 편안하게끔 배려해주심""","기본적인 자기소개와 이전직장에서 무슨일을
했는지 집에서 멀은데 출근이 가능한지
일반적인 면접이고 난이도가 있지는 않았음",대부분 웃으면서 들어주셔서 편하게 면접이 가능했어요
191,이너인포(주),IT/웹/통신,"제안이 온 후 면접 일정을 잡고 대면 면접 실시.""","프로젝트 및 기술스택 질문
근무지로 출퇴근에 문제가 없는지
자기소개","사실 그대로 답변함. 꼬리 질문 형식.
면접자의 프로젝트 경험만 쏙 빼먹고 떠보는 듯한 느낌의 말투 매우 불쾌했음."
192,엑스컨텍(주),IT/웹/통신,"정규직보다는 계약직으로 굴리는 것을 선호하는 회사
별의별거를 묻고 따진다""","부모님 유무
공부 왜 포기했나
다른길을 알아보는게 나아보인다
등",형편없고 이런 곳도 면접을 보는 구나 싶더라
193,(주)백두테크놀로지스,IT/웹/통신,"간단한 기술 질문 후 컬쳐핏 면접.
기술면접 난이도 낮은편 리액트 하던 사람이라면""","리액트 관한 질문들과 전 직장 경험 질문들
전 직장의 부정적 얘기는 좋지 않을듯",꽤나 괜찮고 기분 좋은 면접 본인은 떨어졌지만 리액트 관한것만 잘 공부하고 가면 좋을듯! 어렵진 않음
194,(주)티페이정산,IT/웹/통신,"구직사이트에서 면접 신청을 하고 일 이차 대면면접으로 진행하였다.""",본인의 장단점 및 상황이 주어졌을 때 문제 해결력 그리고 협업,장단점과 어떤 상황에 놓여졌을때 해결책을 말함. 분위기 좋았습니다.
195,지오그레이트(주),IT/웹/통신,"특이함. 굉장히 까다로웠음. 4단계의 과정을 거쳐야 함.""","전화면접, 대면면접 때 녹음을 원함. 자잘한 업무, 반복적인 업무에 대해 어떻게 생각하냐는 질문이 개발 관련된 일이라 생각했지 잡다한 타부서 업무를 뜻하는 질문인줄 입사하고 나서 꺠달음. 사원이 1명이라 모든걸 도맡아 해야함. 경영지원, 영업, 전화, 계약 등등",면접 선물은 좋았음
196,(주)위덱스정보기술,IT/웹/통신,"2:1 면접

업무적인 질문 70%, 사적인 질문 30%
경력적이라서 주로 경력사항에 대해 하나하나 질문함

면접 분위기는 너무 딱딱하지 않게 편하게 해주려고 하는게 느껴졌으나 사적인 질문 할때 기분이...""","전회사 퇴직 사유
회계프로그램 장단점
전회사가 뭐하는 회사인지 이력서에 썼고
면접때도 얘기했는데 잘 이해를 못하는게 느껴져서
전회사 소개를 자세히 함..

주로 경력 위주의 질문을 했는데 아래 질문은 기분이 나빴습니다.

가족관계는 어떻게 되는가?
남편 회사 지역은 어디인가(이해 안되는 질문)
야근 가능 여부
(내가 2시간 정도는 가능하다고 하니 그럼...",면접관분들이 나이가 있으셨는데 10년전의 면접 스타일로 질문을 해서 당황했음
197,링크투어스(주),IT/웹/통신,"면접시 편안한 분위기로 면접이 진행되고 이전 업무에 관련된 질문이 대부분""","참여했던 프로젝트에서 맡은 부분.그리고 참여도 정도
그 해당 부분에 대한 설명",쏘쏘
198,(주)우리아이티,IT/웹/통신,"지원서 -> 임원/경영진 면접 과정으로 진행""",인생에서 가장 슬펐던 일은? 이 가장 기억에 남음,분위기 좋음
