,company,job,title,question,answer
199,(주)에코시스템,IT/웹/통신,"프로젝트 내용을 물어봄
약간의 기술면접이 있는데
인성 면접을 더 중요시 하는 거 같다""","A프로젝트랑 B프로젝트랑 차이점이나
왜 ㅇㅇ언어를 채택하게 되었는지","친절하게 잘 응대해준 느낌
면접만 보고 놓는다면 괜찮은 면접이였다"
200,컴패니언시스템(주),IT/웹/통신,"채용사이트에서 이력서 제출 후 전화로 연락이 오셔서 면접을 진행했습니다.""","기술적인 질문은 물어보시지 않고 성적장학급 받았는지, 군대는 어디 나왔는지, 전 회사 퇴사 이유등 인성면접을 주로 봤습니다.",인성면접 위주로 면접 자체는 쉬웠고 면접 전에 필기시험이 작게 있었습니다.
201,(주)뉴엣지,IT/웹/통신,"공개된 이력서를 바탕으로 연락와서
빠르게 면접을 진행하였습니다.""","취미생활하고있는지
내근 외근 업무에대해서
술?주량이얼마나되는지","전반적으로 회사 소개 및 간단한 질문 후 면접 종료하였음
최대한 편하게 하려고 하는 것은 좋았으나 질문이 기분이 나쁠수도 있음"
202,데이터스(주),IT/웹/통신,"인사과분이 면접을 진행해주셨고 아주 친절하셨던걸로 기억합니다. 이후 대표님과의 면접을 하였었습니다.""","하고 싶은 일이 무엇인지
앞으로의 계획
함수가 무엇인지 설명해봐라
원자성과 데드락에 대해서 아는데로 말해주세요",면접 답변은 가지고 있던 생각들을 솔직하게 말하였고 존중받는다는 느낌으로 진행되었습니다. 개인적으로 재미있었고 좋았습니다.
203,(주)유스비,IT/웹/통신,"실무위주로 물어봅니다. 자소서나 경력사항에 대한 부분보다는 실질적으로 바로 업무 투입될 수 있는지 여부가 가장 중요합니다.""","1) 프론트 핸들링 경험, KYC에 대한 이해도
2)핀테크 업계의 산업 이해도
3) 연봉/ 근무조건 처우 협상 시도","아직 체계적으로 프로시저가 잡힌 회사는 아닌 것으로 보이며, 별도의 인사부서는 없는 것으로 보입니다. 경영진이 면접에 참여합니다."
204,(주)훈랩,IT/웹/통신,"여태까지 본 면접 중 이렇게 무례한 경우는 처음이었음
면접관의 태도가 실례가 될 수 있는 질문을 생각없이 함""",해외 경험 관련 질문과 향후 출퇴근 방법에 대해 물어보는 기본적인 질문이었음,"간단하게 편하게 얘기하였음
면접관의 태도가 회사에 대한 이미지를 만드는데 붙어도 가고싶지 않은 회사임"
205,(주)필라웨어,IT/웹/통신,"팀장과의 1:1 면접으로 내가 얼마나 알고 있는 지를 주로 물어보는 면접""","- osi 7계층에 있는 시스템
- 어셈블리어는 어떻게 공부했는지
- 정규형을 알고 있는지",알고 있는 만큼 답변함
206,(주)하이콘소프트,IT/웹/통신,"편안한 분위기에서 면접을 실시했으며, 기술적으로 어려운 질문은 크게 없었음.
면접자에게 발언한 기회를 많이 주어, 편하게 여러가지 진술을 할 수 있었음.""","기술향상을 위해서 어떤 노력을 하고 있는가?
업무상 닥친 어려움을 이겨내는 특별한 노하우가 있는가?
입사 후 어떤 포부와 계획을 가지고 있는가?","편안하게 질문에 대한 답변을 주고 받았고,
면접자에 대한 배려가 많았음."
207,엔에스스마트(주),IT/웹/통신,"1차 면접에서 개인 프로젝트 관련하여 담당업무를 설명하고 깃허브로 코드리뷰를 함 2차면접에서 임원 면접을 보았으며 SQL관련 질의응답을 몇가지 하고 연봉협의를 함""","본인이 수행한 업무는?
DB구성에서 가장 기본이 되는 것은?
이직사유가 뭔가요?",긴장을 많이 하는 탓에 조금 떨렸지만 무난히 면접을 보았습니다. IT회사라 그런지 딱딱한 분위기가 없었습니다.
208,이플랜소프트웨어앤서비스(유),IT/웹/통신,"인사관리자의 포지션 제안 -> 모집요강 확인후 서류접수 -> 면접""","1. 기술영업 경험 및 역량
2. Eplan 이해도
3. 영어 일상질문","모집요강에는 국내출장에 대해 명시되어 있지 않습니다.
면접 중에 면접관으로 부터 잦은 국내출장이 있다 들어서
조금 아쉬웠습니다."
209,클라우드포유(주),IT/웹/통신,"대표님과 1:1 면접 후 전화로 합격 통보""",기존에 진행했던 프로젝트에 대한 질문과 개발 알고리즘 관련 질문. 그 외는 딱히 생각나지 않아요,보통 대표님과 면접하면 인성확인용 질문만 받아왔는데 개발 알고리즘 질문을 하셔서 아주 살짝 놀랐어요. 그래도 나쁘진 않았습니다
210,(주)에스엔에이,IT/웹/통신,"1차 팀장면접 2차 임원 면접으로 이루어져있으며 자기소개서 위주로 질문함""",대학생활과 여태까지 살아온 인생위주로 많이 물어보며 질문자체는 자기소개서 위주로 질문합니다,딱히 어려운질문은 없었습니다
211,(주)원츠넷,IT/웹/통신,"면접 시간보다 20분이나 일찍 도착했음에도 40분 넘게 기다리라고만 함, 늦게 들어와서 미안하다는 말 한마디 없었음""","본인 연봉 최대 얼마나 깎을 수 있는지, 관상을 봐야하니 마스크를 벗어봐라(코로나시기였음),
지금 이 자리에서 본인의 파이팅을 얼마나 보여줄 수 있는가","본인들의 시간만 아주 중요히 여기고 지원자에 대한 배려가 전혀 없었음, 회사 자랑과 임원진 인생스토리 푸는데 열중하셨고 연봉 많이 깎는 지원자를 뽑을려고 하신듯, 흡사 재래시장..."
212,(주)에이젠글로벌,IT/웹/통신,"이력서 제출하고 합격하면 연락이 와서 면접을 봅니다. 대면으로 진행되었어요.""","자기소개 및 지원동기
했던 프로젝트에 대한 질문
파이썬 관련 질문",어렵지 않았습니다.
213,위지원시스템즈(주),IT/웹/통신,"대채로 포트폴리어 설명 위주로 진행됩니다.""","학교에서 배운것을 회사에서 사용하기 어려울 수 있다 어떻게 생각하냐??
일이 힘들거나 재때 끝내지 못하면 어떻게 할 것이냐??
야근에 대해서 많이 부정적인가???
근속은 어느정도 생각하고 있냐?","보통 생각하기에 보편적인 답변을 하면 됨
느낀점이라고 하면 회사 관계자의 성향을 알 수 있음"
214,(주)알앤씨소프트,IT/웹/통신,"연락와서 인터뷰 일정 맞추고 1차는 개발직원분과 2차면접은 대표님과 총 두번을 합니다""","기억에 남는 프로젝트는 어떤게 있었나요??
거기서 어떤 역할을 하였나요?",잘모르겠습니다..ㅎ
215,(주)수인소프트,IT/웹/통신,"면접인데도 면접에 대한 질문뿐 아니라 면접관의 시선에서 왜 그런질문들을 하는지 알려주셔서 좋은 팁이 되었습니다.""","전직장의 퇴사이유, 이직한 이유, 간단한 기술질문",비록 불합격하긴 했으나 다음 면접을 위한 팁들을 많이 얻을수 있었기에 좋은경험이었다 생각합니다.
216,넷츠(주),IT/웹/통신,"헤드헌터 통해서 연락이 왔었는데, 헤드헌터는 LGCNS랑 면접본다고 구라치고..
정작 넷츠랑 면접 봄. 연봉 안맞춰줘서 패스 할려는데 보자고해서 봄.
꼰대놈들 면접 태도를 가지고 뭐라 그러네. 사람 귀한줄 모르네""","왜 이직을 자주했는가?
매일마다 점심 굶어가면서 15시간 넘게 일함",꼰대 놈들 사람 귀한줄 모르네.
217,(주)태거스,IT/웹/통신,"서류먼접 - 대면면접 - 과제면접
순서로 진행되었으며,
대면면접은 대표 / 그리고 팀리드 / 팀원
과제면접은 대부분 들어왔던것으로 기억함""","1. 과제면접 중 계속해서 그렇게 생각한 이유에 대해서 물어본것이 인상적이었음
2. 본인을 어떤 마케터라고 생각하는지
3. 예산은 얼마정도까지 드라이브 해본 경험이 있었는지","전반적으로 대면면접, 과제면접 등이 크게 어렵거나 하지는 않았음"
218,(주)오에스씨코리아,IT/웹/통신,"경영지원과 대표가 같이 참석하는 면접.
이직사유~ 기술경력등 간략하게 질문""",평이한 수준의 질문들을 해서 특별히 기억에 남는것이 없다,엔지니어링쪽으로는 어느정도 기반이 있는듯 하지만 개발쪽으로는 조금 약한 느낌
219,(주)로아인텔리전스,IT/웹/통신,"간단한 회사 소개 후, 무엇을 할 수 있는지 관련 이야기, 질문 주고 받기""","머신러닝 이론에 대한 것 설명. 이력서 관련 질문, 개발 잘하는지",면접관들은 무난무난했습니다. 합격하고 다녀보니 면접에 들어오지 않은 대표 때문에 다들 힘들어 했습니다.
220,(주)비아엘,IT/웹/통신,"사람인 지원했고 면접 보러 오라도 함 원룸 비슷한 곳에 간이 사무실 있고 거기서 봄""",지인들 중에 개발자 있냐 어떤 개발자가 되고 싶냐라믄 질문을 했던 곳 같음,그냥 그랬늠
221,(주)페타바이트,IT/웹/통신,"최초 연락은 문자로, 그 이후 면접은 1회 대표 및 이사진 면접으로 이루어져 있음""","1. 자기소개 해보세요.
2. 우리회사가 뭐하는 회사인지 알고있는가?
3. 야근이 있을 수 있는데 괜찮은지?","대체적으로 대표 혼자 질문하고 답변을 하는 형식임. 거의 대표 혼자 말하며, 면접자도 대표로부터 훈계의 시간이라고 생각하면 될듯. 대표한테 그냥 훈계 받고 그냥 가는 경우도 있었음"
222,아이티맨(주),IT/웹/통신,"서류 -> 면접 -> 합격 과정으로 이뤄집니다.""","사실 기억이 잘 안 납니다.
1. 본인이 가능한 언어 스킬은? 메인 언어는?
2. jar파일 배포를 주로 진행했었는데, was로 프로젝트 진행해도 문제가 없을지?
3. jsp는 어느정도 다룰 줄 아는지",그냥 포트폴리오에 있는 내용들을 물어보고 본인이 진행한게 맞는지 확인하는 질문 하나씩 툭툭 던지십니다.
223,(주)펀진,IT/웹/통신,"잡사이트를 통해 먼저 제안면락이 와서 면접을 보았고 1차 면접으로 전형은 종료되었습니다.""",과거 경력 및 스타트업 경험 함께 만들어 가야 한다는 이야기,입사지원자가 없어 사람이 급하게 필요하다는 느낌을 받음
224,팜피(주),IT/웹/통신,"사내 자기소개폼이 있어서 자기소개와 같이 이력서와 포트폴리오 첨부함. 면접공지는 메일로옵니다.""","-팜피지원한이유
-주말에뭐하는지
-집에서얼마나 걸리는지/ 개발직이다보니 갑자기 나와야할수있는데 어떻게생각하는지
-왜개발자로",자유로운분위기와 편하게 대해줍니다.
225,(주)맥시우스,IT/웹/통신,"면접은 대체적으로 심플하고 이력서 위주로 물어봄.
그리고 업무 위주로 질의를 많이함.""",이력서에 있는 내용 꼼꼼하게 다보고 질문했던 기억이남. 퇴직사유를 많이 물어봄1,무난하게 잘봤었고 합격여부 금방 알려줌
226,(주)디어소프트,IT/웹/통신,"사람인 통하여 지원하였고, 일정도 사이트에서 통보받았습니다.""","공고 자체에는 경리,회계 등 일반 사무라고만 적혀있었으나 회계의 비중보다는 과제에 대하서 집중적으로 질문하심.","채용할것처럼 분위기는 좋았어도 연락이 없었음. 또한 면접시간이 굉장히 길었음. 지원자가 많았으나 공고가 오랫동안 올라와있는것도 그렇고, 공고기한때문에 마감 됐는데도 바로 다시 올라온거보면 아직도 채용을 안하신듯. 고민과 신중함의 정도가 많이 높으신듯함."
227,(주)인우기술,IT/웹/통신,"서류합격후 면접일정을잡고 경영진과 면접을 봄 팀장이거나 그 이상사람이 들어올수있음""",이 회사를 계속 다닌다면 10년 후의 자신의 모습이 어떨 것 같냐는 질문을 받음,기술적으로는 그리 신경쓰지않고 인성과 자신감을 판단하는 면접
228,대진정보통신(주),IT/웹/통신,"면접 연락받아서 회사로 면접 보러가서 바로 합격통보 받음""","어디사냐, 무슨 공부 해봤냐, 몇시간 걸리냐","어려운거 물어보지 않았음, 공부 경험 등"
229,레플커뮤니케이션(주),IT/웹/통신,"2:1 면접 심층 질문 많음 생각보다 분위기가 유하지는 않음""",그래픽 스킬이 어느정도냐라는 질문이 많았고 전 직장 기여도나 연봉에 대해 질문하였습니다,생각보다 분위기가 딱딱하고 직장에 다니고 싶다라는 생각은 들지 않았습니다
230,시스네트(주),IT/웹/통신,"잡코리아에 이력서 제출 후 전화와서 면접일정 잡고 면접보고 합격""","조별주제, 과제주제, 업무관련주제
이력서 내용으로 면접이 진행됩니다.......",쉬웠다
231,(주)애니스마트,IT/웹/통신,"카페 면접 후 연봉 협상과 계약 완료했습니다""",어려운 질문은 없어고 기본 경력과 기관 내 일하는거 가능 여부 확인,없음
232,와이어드컴퍼니(주),IT/웹/통신,"온라인 입사 지원후 인사팀 연락받고 온라인 면접 진행했습니다""",간단 자기소개. 경력. 오래돼서 기억이 안나네요,무난했습니다. 압박면접은 아니에요
233,(주)에이취큐텍,IT/웹/통신,"분위기는 나쁘지않았음 그리 엄숙하지도 마냥 밝지도 않고 딱 적당한 분위기""","컴퓨터 잘 사용하나?
분석하는 것에 흥미가 있나?
꼼꼼하고 세심한가?",다른 곳도 다녀본 경험으로는 아주 평범하다
234,만두커뮤니케이션,IT/웹/통신,"회사 팀장급이 먼저와서 이야기를 나누고 모든 면접의 질문이끝나면 대표가와서 이야기르란눈다.""","이일을 하게된이유, 공부하는방법, 앞으로의목표",일반적인 평범한 면접이며 크게 긴장할것없이 대화하듯이 면접을 진행한다.
235,(주)체인어스,IT/웹/통신,"자유로운 분위기 속에서 면접이 진해되었습니다.""","본인이 작업했던 경력사항에 관해서
영어 잘하는지 여부
어떤 업무를 하고 싶은지",면접비까지 챙겨주셨습니다.
236,디비디랩(주),IT/웹/통신,"과제 전형 이후의 면접이다보니 면접 내용도 주로 제출했던 과제를 위주로 진행되었음""",과제 제출 후 개인적으로 생각나는 아쉬운 점에 대해 물어보,작성했던 코드들에 대해 본인의 생각과 설계등을 말했습니다
237,(주)가드텍,IT/웹/통신,"그냥 대강대강 물어보면 대강대강 답해줬음""",뭐가없음 사는곳 물어보고 언제부터 일할수있냐고 물어봄 연봉협상? 그냥 자기들이 지정함,그냥..그저그런 회사구나 싶음 . 처음에는 좀 포근하게 다가와주는데 속지마셈
238,(주)비즈앤테크컨설팅,IT/웹/통신,"면접 일정,장소 문자로 알려주고 해당 날짜에 가서 면접 진행""","자신의 장점, 자신의 단점, 무슨 일을 하고 싶은가","자신의 장단점을 경험을 통해 느낀 것을 자세히 말함.
내가 하고 싶은 분야 일을 말함."
239,(주)아이디어빈스,IT/웹/통신,"간단한 실무면접 정도여서 부담없고 편한 분위기로 진행되었음. 면접관 2명, 면접자 1명으로 진행""","전직장 담당업무, 퇴사 사유, 프로그램 사용 가능 여부, 희망연봉 등등",있는 그대로 대답
240,(주)성심소프트,IT/웹/통신,"면접 연락이 날라왔고, 면접하고 코딩 테스트를 봤습니다. 1차 면접에 합격해서 최종 면담 후 입사하게 되었습니다.""","정말 이력서에 대한 여러가지를 질문을 하셨습니다.
마음가짐이나 전직장에 대한 느낀점, 진행 프로젝트 관하여 등등
많은 질문을 해주셔서 질문 중 대표적으로 이 3가지가 기억 나네요",편안한 분위기로 진행했었습니다.
241,코아네트(주),IT/웹/통신,"전화로 연락이 와서 면접을 보러갔습니다 명접비가 있습니다""","지방 출장 가능한지, 주량 몇병인지 유사경험있는지 물어봤습니다",어렵지 않고 편안하게 질문해주십니다
242,(주)픽스다인웨이메이커,IT/웹/통신,"정직원이 아닌 프리랜서 계약이어서 그런지 분위기는 생각보다 훨씬 유연하고 부드러웠음.
딱딱하거나 격식있게 질문하고 그런 것보단, 주로 회사 소개와 담당 업무를 소개해주는 게 주였음.
당일에 바로 계약서를 썼음""","파견근무라 근무지가 회사랑 상이한데 괜찮은지, 디자인툴 스킬 정도, (사실 딱히 질문이 없었음)","면접 난이도는 매우 쉬웠고, 담당자분도 분위기를 부드럽게 풀어가시려고 하는 게 느껴졌다. 이력서를 제출했을 때 서류통과를 했다면 그냥 합격인 느낌?"
243,(주)에스제이정보통신,IT/웹/통신,"간단한 면접이라서 크게 걱정안해도 됨. 일은 어차피 안에서 배우면 된다라는 의미도 있음""",얼마나 길게 할수 있는지 원하는 연봉에 관한 문의이외에는 없음,현실가능한 선에슨 맞춰주려함
244,비엔티솔루션(주),IT/웹/통신,"기술이사 한명과 면접을 했고, 대표와는 합격 이후에 직접 만나고 대화를 함. 별다른 큰 과정은 없음""","이전에 사용하던 기술들 프레임워크, 이전직장에서의 주된 역할, 어떤이유에서 이직을 하게 된 것인지","면접시 기술면접을 보지 않아 들어갈때부터 조금 의심을 했었고 개발자가 여럿 있어서 팀웍으로 일하지 좋다고 하였으나, 임원이 사기를 치고 확인해본 결과 웹 개발자는 위에 한명밖에 없어서 당황하였음.."
245,위즐리앤컴퍼니(주),IT/웹/통신,"처음 상무님과 면접 진행 이후 대표님과 면접 후, 채용""","지원동기, 컨설팅이란? 어떤업무 가능한지",그냥 별로 어렵진 않았어요
246,젠트넷정보기술(주),IT/웹/통신,"모욕적, 비인간적 그 자체임 사람대우 받을생각 접고 들어가셈 진심임""",성기 크기를 대놓고 물어봄 ㅎㅎ 왜 물어보냐고 물어보니까 질문하지 말라면서 소리지름,곧 망할 회사다
247,엘지히다찌(주),IT/웹/통신,"서류 합격 후 1차면접 진행하여 3대1로 면접 보았음.""","자기소개 등 취미, 실례인걸 알면서 사적인 질문, 회사에 궁금한 점","댜체로 부담없이 면접을 보았기에 긴장없이 진행함.
경력이지만 특별한 내용은 없었음"
248,(주)제이더블유시스템,IT/웹/통신,"면접은 한번 봤고
10분 컷했음. 나름 질문이 체계적이었어요
중소라서 자기소개를 시킬 줄 은 몰았는데
자기소개 시켰고 사람인 비율 보니깐 나름 쎄서 살짝 걱정 했는데
됐데요""","스트레스 어떻게 푸는지..?
공모전에 대한 내용을 알려달라해서 알려줌",좋았어요 다니고 싶단 욕심이 좀 들었어요
249,굿센씨엠에스(주),IT/웹/통신,"채용공고를 보고 지원했고, 답신이 와 대면면접 진행했습니다""","회사가 무슨일을 하는가
회사에 궁금한점이 있으면 상세하게 물어봐라
간단한 문제풀이","일단 면접관님이 상당히 차분하셨습니다. 말씀하시는 기업의 하는일과 인재상이 제가 생각한 인재상과 겹쳐서 면접때 선배 개발자의 말을 경청하는 느낌이 좋았습니다. 다만, 현재의 실력이 미흡하여 아마 붙지는 않을것같습니다. 능력이 된다면 그에대한 대우는 확실히 좋아보였습니다. 기술면접으로는 간단한 코딩문제를 손코딩하였습니다. 또한 즉각적인 피드백을 주셔서..."
250,젠컨설팅(주),IT/웹/통신,"딱딱하지 않은 분위기
표정으로 결과를 예상할 수 있음
1분 자기소개 준비""","비전공자인데 적성은 맞을 거라고 어떻게 예상하냐
강점 여러가지","신입에게 많은 것을 요구하는 느낌을 받음
약간의 압박면접"
251,(주)아라인,IT/웹/통신,"기술적인 내용은 많이 안물어봄. 쉬웠었습니다. 아주 살짝 압박면접 느낌""",가족관계를 물어본게 기억에 남음. 기타 인적사항도 물어 봤는데 이유를 모르겠음.,좀 더 기술적인 내용을 체크하는게 좋지 않을까 함
252,(주)율호,IT/웹/통신,"최초 연락 후 면접은 총 2번 봤음. 팀장 면접 -> 경영진 면접
면접비 지급 해줬음.""","1. 상사와 트러블이 있으면 어떻게 할건지
2. 야근이 잦을 수 있는데 괜찮은지
3. 그 외 학교에서 배울만한 IT 질문. (업무 관련은 크게없음)","1차면접때는 옆에서 면접본 분이 많이 떨어서 오히려 내쪽으로 관심이 쏠렸음.
2차면접때는 크게 취업이 급하다는생각이 없었으나, 붙게되어 만족했음."
