,company,job,title,question,answer
118,(주)위메이드커넥트,IT/웹/통신,"지원하고 거의 다음날 열락와서 빠르게 일정 잡음""",상사없이 하는 일 어찌 생각하는가? 작업한 포트폴리오 중에 가장 마음에 드는것은? 엠비티아이가 무엇인가,원화팀장님이 대화를 이끌어나가며 긴장을 풀어주실려고 하셔서 편안한 면접이 되었습니다.
119,(주)스코넥엔터테인먼트,IT/웹/통신,"1차 실무자 면접 후 2차 임원 면접 진행
전형적인 면접 질문으로 구성되었다고 생각
자기소개, 강점, 장단점 등등이었음""","특별히 기억에 나는 부분은 없음
전형적인 면접 질문으로 구성되었다고 생각됨
강점 어필을 잘하는 것이 중요하다고 생각됨",보통
120,(주)마상소프트,IT/웹/통신,"채용사이트에서 공고보고 홈페이지로 지원, 사내내규연봉으로 동의 체크를 하라고 함(얼만지도 모름) 면접 일자 선택지를 두 개를 줘서 거기서 골라야함.. 시간도 정해져있음""","자기소개,포트폴리오 발표,작업 속도,이전 직장 그만둔 이유,성격이 어떤지,취미가 뭔지,꿈이 뭔지 등등 거진 두시간동안 면접보는데 질문이 많아서 자세히 기억이 안남","면접시간이 쓸데없이 너무 길다. 회사 규정인지 억지로 두시간 채우려고 하는 모습들이 보였다. 1차면접 합격하면 2차면접도 있다. 면접 결과를 면접 후 10일 이내로 알려준다 했지만, 더 오래걸림. 면접 과정부터 시작해서 무슨 대기업 면접 보는줄"
121,(주)제페토,IT/웹/통신,"수시 채용이었고, 해당 직장에 근무하던 사람의 소개로 지원하게 되어 면접까지 진행함""","입사하면 어떤 걸 해보고 싶은가
일이라는 게 무엇이라고 생각하는가
제출한 포트폴리오가 만족스럽다고 생각하는가",다른 질문은 별로 상관없지만 포트폴리오의 만족도에 대한 물음은 그냥 꼬투리 잡기나 압박을 가하려는 의도로만 보였음
122,(주)마코빌,IT/웹/통신,"1차 기술면접 2차 임원면접으로 진행
1차 1대 3
2차 1대 1
분위기는 다 좋았는듯""","1차 cs 질문 및 전 회사 했던일 등.
2차 인성면접",무난함
123,반다이남코엔터테인먼트코리아(주),IT/웹/통신,"이력서를 넣고 바로 전화와서 면접을 갔습니다. 다들 친절하시고 사무실 분위기 좋았습니다. 노트북으로 언어시험 있습니다.""","좋은 번역이란 뭐라고 생각하는지
본인은 팀워크 인간인지 개인플레이 인간인지
스트레스를 뭘로 푸는지",간단하게 답을 해도 호응을 잘해주셔서 마음이 편했습니다
124,(주)에이치투인터렉티브,IT/웹/통신,"전화로 연락 받아 면접일에 대하여 조율한 뒤 면접 후
채용결과를 전달받았습니다.""","이전 직장에서의 경험이나 게임에 대한 관심 등
전체적으로 크게 어려운 질문들은 없었습니다.","압박 면접은 아니었기 때문에 차분한 분위기 속에서
진행되었습니다."
125,워게이밍,IT/웹/통신,"온라인으로 진행된 면접으로 편한 분위기로 진행됨""",담당 프로덕트에 개선을 위해 어떤 부분이 필요하다고 생각되는가?,"충실히 모두 들어주었으며, 지속적인 질문의 확장이 이어졌다."
126,(주)엑시아,IT/웹/통신,"1층 카페테리아에서 면접 봄
기본적인 코인관련 알고있는지 출근 언제부터 가능한지""","코인관련 질문 받았고 이쪽일은 해본적 있냐고 하셨지만
저는 처음이라 처음이라고 말함",그냥 무난했습니다
127,(주)하트게임즈,IT/웹/통신,"면접은 사무실 내부에 있는 회의실에서 정적인 분위기에서 1:1 면접으로 진행됐고
채용 시에는 전화로 소식을 전달받았습니다.""","야근가능한가?
주말에 나올 수 있는가?
JS에 대해서 설명 해보시오",대부분 긍정적 이게 대답하였고 기술 관련 질문은 생각보다 많지 않았습니다.
128,(주)버티고우게임즈,IT/웹/통신,"서류통과 이후에 영상 통화로 경영진과 대표와 함께 면접을 보았고 입사 전에 마지막으로 직접 본사 사무실로 가서 대표와 팀 담당자와 미팅을 가졌습니다.""","팀으로 일 할 때의 성향과 인성, 결정할 때 최악의 상황일 경우 어떡해 대처하는지, 같은부서내에도 비밀유지 가능한 책임감인지",경영지원 및 인사팀 부서인만큼 비밀유지와 얼만큼의 책임감으로 임하는지를 중요시 여기는것 같았습니다
129,(유)체리츠,IT/웹/통신,"남자 두분이 들어오셔서 면접을 진행 했고
사실상 포트폴리오의 확인에 가까운 면접이였습니다
직무에 직결된 두분은 아닌것같앗음""",전 이력(포트폴리오)이 회사와 연결되어있는데 구체적으로 어떻게 진행했냐는 질문,고객의 니즈가 제일 중요했고 원래 그리던 그림체에 개인적인 취향을 빼고 넣었다고 전달함 / 사실 근데 별로 관련된 작업이 아니였다고 생각함
130,(주)브이투알,IT/웹/통신,"기본적인 질문과 작업시간 등등 물어보고, 면접이라기 보다는 회사 자랑과 회사 제정이
안정적이니 괜찮은 회사라는것을 어필하는 면접이었다는 생각이 듭니다.""","이 작업물 얼마나 걸립니까? 야근 자주 할 수 있습니까? 여러가지 업무를 맡게 될텐데 괜찮습니까?

이정도 3가지 질문이 기억에 남네요","기본적인 질문에 대답을 스무스하게 하였고, 조금 빡셀텐데 잘 따라올수 있겠냐고 물어보시는거 보니 업무강도가 상당히 있을것이라는것을 느꼈습니다."
131,(주)핸디커뮤니케이션즈,IT/웹/통신,"결과 통보까지 문자 연락이 왔고 일정이 맞아 면접 자리 했습니다. 처음 실무진과 10분정도 면접을 진행하고 팀장급 면접이 진행되었습니다. 실무진분은 이력서를 사전에 꼼꼼히 보지 않으셨다는 인상을 받았습니다....""",이전 경력위주로 QnA가 진행되었습니다. 충원인지 결원 채용인지 채용 배경과 어떤 게임장르를 좋아하는지 원하는 최소 연봉이 얼만지 왜 지원했는지 등 현실적 조건들에 대한 이야기도 나누었습니다.,여러번의 면접을 보며 입사시험도 따라 치루어 왔지만 테스트 난이도와 구성 대비 주어진 시간이 부족했다고 느꼈습니다. 저의 역량 부족일수 있으나 좋은 소식을 들은 곳에서의 패스한 시험구성을 복기할수록 다시 돌아가도 무리였을 구성이었습니다. 최근 및 희망 연봉테이블이 높다는 피드백도 있었습니다. 또한 대체로 남자 지원자를 더 선호한다는 부분도 면접 도중...
132,스카이피플(주),IT/웹/통신,"이력서 공개 후 연락옴 1/2차 진행""","자기소개, 전직장 퇴사사유, 좋아하는 게임",분위기 편안했고 그리 어렵지 않음
133,케이넷피,IT/웹/통신,"면접에서 채용까지는 큰 특징은 없었음""","일반적인 왜 우리 회사를 들어오게 됬는지, 포부, 어떤일을 잘할수잇는지",면접은 관습상 평범하게 하는 질문이구나 라고 생각함.
134,이너스게임즈,IT/웹/통신,"포트폴리오를 보며 얼마나 걸렸는지, 어떤툴로 작업했는지 물어봄. 본인의 타입에 웹툰/일러스트 어느쪽이 괜찮은지 물어봄. 딱히 업무에 관한 질문은 없었음""",기억에 남는것보단 우리 직원들은 이런거 4시간만에 그린다~ 라고 계속함,면접이라기 보단 그냥 대화.. 인터뷰에 가까웠음
135,(주)어뮤징파크,IT/웹/통신,"스카우팅 - 면접 - 채용 순으로 진행하였습니다.""","자기소개
코테
기본적인 수학 물리 영어 수준","첫 면접이라 그런지 당황했던 것 같습니다.
코테에서 답변을 잘 못해서 좀 빨리 끝내고 싶어하는 느낌?"
136,(주)프렌즈게임즈,IT/웹/통신,"인터뷰 분위기는 전체적으로 긍정적. 다만 면접 후 연락이 오래 걸렸습니다.""","최근 재밌게 한 게임, 5년 후 자신의 모습, 장르에 대한 이해도","강압적이거나 공격적인 태도 없이 부드러운 분위기 였지만, 호락호락하지 않다는 느낌이 강했음"
137,(주)슈프림게임즈,IT/웹/통신,"전반적으로 깔끔했던 기억
채용까지 일사천리...인사팀이 일을 무척 잘했던듯..""","야근을 어떻게 생각하는지
팀원들이랑 안맞을때는..",답변은 그럭저럭 했었고...이미 제가 지원했던 분야가 공석이라..급히 채용하는 모습이 보임
138,(주)스카이문스이아이게임즈,IT/웹/통신,"1차 실무자(팀장) 2차 개발이사 면접""","1.게임 좋아하니?
2.무슨 게임 제일 많이 했니?
3.너가 좋아하는 게임하고 개발하게 될 게임하고 많이 다를건데 괜찮니?",국내 모바일 게임 개발 환경은 익히 들어서 별 감흥은 없었습니다.
139,(주)퍼플오션,IT/웹/통신,"이력서 지원, 서류 전형 합격 후 면접, 면접 후 채용""","회사이름 뜻, 어떻게 지원하게 되었는지",대표님께서 회사를 사랑하시는 모습이 많이 느껴지는곳이였습니다. 배려를 많이 해주시는 느낌을 받았습니다.
140,(주)스마트빅,IT/웹/통신,"편안한분위기에서 면접이 진행되었음, 업무 진행사항에 관련된 질문이 많았음, 미리 업무에관해 알아두고 면접보는것을 추천""","나의장점이 무엇인지, 직원들과의 소통에있어서 문제가발생하면 어떻게 대처할지 등",편안한 분위기에서 진행되기때문에 좋았음
141,(주)이제이엔,IT/웹/통신,"2차면접까지 진행되었고 1주일 간격으로 진행되었습니다.""","서비스 사용해본 경험, 원하는 업무, 스트레스 어떻게 푸는지",편안한 분위기로 진행되었습니다
142,(주)뉴딘콘텐츠,IT/웹/통신,"대표님과 팀장님 그밑에 직원분하고 셋이 보았습니다
이력서를 보고 질문해주셨고 생각보다 제 전회사들을 대표님께서 많이 파악하고 계셔서 놀랐습니다""","참바보같이 대답한 질문이 기억나네요...
민망할뿐입니다...하하","팀장님도 대표님도 좋으신분이었고 개인적으로 오고싶었지만
역시 우려한바와같이 제 역량이 부족한 탓인것 같습니다
그래도 즐거운 면접이었고 앞으로 번창하시는 기업이 되셨으면 합니다"
143,(주)레이싱조이,IT/웹/통신,"최초연락은 지원한 당일 왔던 것 같고 면접은 그 다음주 중으로 봤던 것 같아요 분위기도 압박적으로 하지 않으셨고 교통비도 따로 주셨음 그리고 합격연락은 일주일 뒤에 왔음""","전공과 다른 업무인데 괜찮냐, 전 직장은 왜 그만뒀냐, 주말근무 괜찮냐 등등",다른 전공 관련 회사에 합격해서 여기를 못 가게 됐는데 그냥 여기 갈걸 그랬음
144,(주)링게임즈,IT/웹/통신,"1차 면접 파트장,
2차 면접 대표님,cto
2번의 면접 후에 합격""","1.컴퓨터 공학과에서 배운거 말해보세요
2.자료구조 생각나는거 말해보세요
3.이정도 웹사이트 만드는데 시간 얼마나 걸릴거 같으세요?",전반적인건 대답했다
145,머지플러스(주),IT/웹/통신,"구직사이트를 통해 지원하였고 서류 합격 후 1,2차 면접 진행""","경력 중 가장 어려웠던 프로젝트, 장점과 단점 등등... 기본적인 평범한 면접이었음","가감없이 사실대로 말했고, 완만한 면접진행이었음"
146,먼데이오프(주),IT/웹/통신,"서류전형 - 과제전형 - 면접 - 결과통보""","과제를 하면서 힘들었던 부분은?
1인 개발 어떻게 생각하는지
돈을 많이 버는 게임 vs 재미있는 게임","면접 중에 지원자의 긴장을 풀어주려고 해주시는게 보여 감사했습니다.
자기소개 후 회사 소개, 질문, 역질문 순으로 진행했습니다.
연봉은 기본급 + 수당으로 지급된다고 들었고, 사내 복지, 워라밸은 좋아보였습니다.
개발자+디자이너 한 팀으로 작업하게 된다고 하며 개발자가 1인개발 + 기획까지 맡아 합니다.
면접 내내 분위기는 좋았던 것 같으나..."
147,(주)더블에이트게임즈,IT/웹/통신,"기술적인 질문이 주로였었고,
구현이나 로직에 대해 구체적인 질문이 있었음""","포괄을 아직 시행하고 있다라는 질문같지 않는
질문..
더이상 기억하고 싶지도 않고요…",같이 가고 하는 동료로써의 대우보다는 돈으로 사람을 쓴다라는 느낌을 강하게 받았습니다
148,트라이픽스(주),IT/웹/통신,"문자 연락 및 유선연락 후 면접일자 잡고 사내에서 면접진행""",프로젝트에 대한 안내와 팀구조 업무환경,편안한 분위기엿습니다.
149,어썸피스,IT/웹/통신,"1차 면접 - 2차면접 - 채용 현재 1차 면접 후 결과를 기다리고 있습니다. 1차는 실무진 면접 2차는 경영진 면접을 본다고 했습니다.""","1. 왜 운영 직군을 선택하게 되었는가?
2. 특별히 어썸피스에 지원하게 된 이유는?
3. 자기소개서 위주의 질문들",면접관 분들께서 자기소개서를 전부 읽고 들어오셨다는 느낌을 받았습니다. 제가 하는 답변도 잘 들어주셨고 면접 질문들도 전부 자기소개서 위주의 질문이었습니다. 본인이 자기소개서 때 쓴 내용을 잘 숙지하고 구두로 설명이 가능한 정도로 준비를 해야할 듯합니다.
150,(주)한빛드론,IT/웹/통신,"서류심사 통과하고 본사건물로 부름받아 임원들과 면접 진행후 합격되었습니다""","수행해야 하는 업무가 많은데 다 소화하실 수 있을까요
거리가 좀 먼 편인데 상관 없으신가요
이전의 업무경험에서 이제 수행하여야하는 부분에서 잘 적용하실수 있을까요?","이미 어느정도 뽑혔다는 느낌으로 진행되었고
평이하게 작성한 것에대한 진위여부 정도로
면접 난이도는 쉬운편에 속합니다."
151,소프트닉스(주),IT/웹/통신,"서류 지원 5일 후 1차 면접 연락이 옴.
1:1 면접이었고, 편안한 분위기에서 진행 됨.
상식적인 질문들 위주였고, 어렵지 않은 질문들이 대부분이었다.
면접비 2만원을 주셨다.
면접 후 약 한 주 후...""","- 호이스팅이란?
- 동기/비동기의 사용 기준?
- Hooks 란?","- 코드의 맥락에서 함수의 선언이 가장 위로 올라가는 현상
- 사용자의 대답이 코드의 흐름에 영향을 미칠 경우, 동기 방식을 선택한다.
- 코드를 재활용 할 필요가 있을때 Hooks로 패키지화 해서 사용한다."
152,(주)넥사이팅,IT/웹/통신,"메일로 연락해서 기술면접, 임원면접을 거쳐 진행됨.
임원면접은 사실상 합격을 점찍어놓고 진행한 느낌.""","오래되서 기억은 잘 안남.
개인적으로 분석해보았던 프로젝트가 있냐
라는 질문을 받았었는데, 당시 분석한 것은 있었으나 확실하게 대답을 하지 못했음.
그때 면접을 담당했던 분께서 방향성을 확실하게 제시해주어서 후에 큰 도움이 됨.","아는 척을 하면 더 깊게 물어보며 끝까지 물고 늘어진다.
모르면 모른다고 솔직하게 대답하고 그 부분에서 호기심을 표하면 좋은 점수를 받는 듯.
발전 가능성을 크게 보는 것 같음."
153,엠콤(주),IT/웹/통신,"압박이 없고 편안한 분위기의 면접, 간단한 자기소개와 질문에 대한 답변으로 이루어짐.""","자기소개, 기존에 했던 업무, 프로젝트에 대한 소개, 앞으로 목표.","개인적인 소개와 경력, 프로젝트에 대하여 소개하였고, 앞으로의 목표를 회사와 연관하여 대답함."
154,블루게임즈(주),IT/웹/통신,"회사에서 먼저 면접 연락이 옴
회사에 찾아가서 1차 면접
임원진 2차 면접
2차 면접 후 채용 진행""","본인을 소개해 주세요
게임의 재미는 어디서 오나요
리듬 게임 해보셨나요","전문적인 답변을 많이 해주셨고
제가 모르는 걸 배우기도 했습니다.
늘 공부해야 한다는 걸 깨달았습니다"
155,씨씨알(주),IT/웹/통신,"취업 사이트에서 이력서를 올린 후 며칠 안되서 연락이 왔습니다.
면접 일자는 제 스케쥴에 조정을 해줘서 나쁘지 않았습니다.
면접 시간은 40분 가량 봤던 것 같고, 팀장님 한분과 면접을 봤습니다.
면접...""","1. 본인이 회사를 이직 한 이유
2. 본인만이 가지고 있는 업무를 잘 할 수 있는 강점
3. 이 직무에 대한 이해도","1:1 면접이었고, 팀장님 께서도 분위기를 딱딱한 분위기가 아닌 편안한 분위기를 조성해 주셔서 그래도 좀 긴장을 덜 한 상태에서 면접을 볼 수 있어서 좋았습니다."
156,(주)플레이위드게임즈,IT/웹/통신,"서류 접수후 팀장 면접 및 임원 면접 후 입사""","1.게임에 대한 흥미
2.회사 게임을 해본적이 있는지?
3. 앞으로의 포부",평소 게임에 대한 흥미에 따라 합격이 나뉘는것 같다.
157,(주)포캣,IT/웹/통신,"전형적인 압박면적으로 연봉깍으려는게 눈에 보이는 곳""","1. 포폴 완성 시간 얼마나 걸렸는가
2. 사회경험이 있는가
3. 포폴 어떤 부분이 작업이 어려웠는가","2:1 면접봤고
난데 니가 어쩔거야?라는 포스를 풍기는 곳은 처음이라 당황스러웠다...

여태 면접본곳은 이 과정에 대한 초점을 두었다면
""이걸 니가 어떻게 해?""
""이 시간 안에 했다고?""
이런 질문이었다. 핵심적인게 텅빈느낌???"
158,(주)마프게임즈,IT/웹/통신,"게임잡 이력서 통해서 메일 연락옴. 날 잡고 하루에 1차, 2차 모두 봄. 2차는 면접이라기보단 대표님의 회사 소개 같았음. 2일 후 합격 전화 옴""","최적화에 관련된 질문, rpg 게임에서 원거리 공격 구현 질문, 팀원과의 커뮤니케이션 방법 질문","비교적 무겁지 않은 분위기에서 면접이 진행되었으며, 얘기에 귀 귀울여 주셨음."
159,(주)나인트리,IT/웹/통신,"용산의 나인트리 호텔임
채용사이트 지원-인사팀 문자연락- 이메일로 안내받음-면접보러감-""","1.업무를 해본 경험이 있는지
2.연봉이 낮은데 괜찮은지
3.자기소개",직전연봉 확인하고 부르세요
160,(주)펀플웍스,IT/웹/통신,"팀전원이 들어와서 면접을 봤었으며, 코딩테스트와 1번의 면접으로 진행 난이도가 있다고 느껴졌음""",대학시절 학점이 몇점이냐고 물어보셨음,나쁘지 않다고함
161,(주)아이닉스소프트,IT/웹/통신,"면접제의받았고 면접보게되었습니다. 사무실은 역에서 가까운 편입니다.""","직원들과 원만하게 잘지내나
작업 기한은 잘 마추나
13분의 1 연봉",가면않되겠다고 느꼈지만 다니고나서 혹시나가 역시나였습니다.
162,넷마블앤파크(주),IT/웹/통신,"1차 실무진 면접 후 과제 제출. 후 2차 임원진 면접.""","1. 어떤 디자이너가 되고싶나
2. 야구게임을 좋아하는지(프로젝트가 야구 프로젝트)
3. 스트레스 해소방법은?","1차 면접은 긴장을 많이 했는데 긴장풀어주려고 편안한 분위기에서 진행되었다.
2차 임원진 면접은 그냥 얼굴 확인하는 자리라고 했음"
163,엔타즈(주),IT/웹/통신,"잡코리아에 이력서 보냈고 면접 전화가 와서 일정잡고 면접진행했습니다.""","1.야근할 수 있냐
2.게임 많이 하냐
3.본인 성격의 장단점 정도..","1.알겠다.
2.게임 많이 합니다.
게임에 대한 세세한 얘기는 없었습니다. 그냥 단순한 면접"
164,(주)제제컴즈,IT/웹/통신,"인사팀이 없어서 대표와의 1:1 면접 형태""","1) 야근에 대해 어떻게 생각하는지
2) 자사 제품을 사용해 봤는지
3) 포트폴리오에 관한 질문",대표가 전공자가 아니다 보니 기술적인 질문은 거의 없었고 인성 질문이 대다수 였다.
165,디지털프로그(주),IT/웹/통신,"지원 후 1차 면접 후 2차 임원면접 그리고 채용""","왜 이 회사에 지원하였는가?, 전 직장에서 가장 인상깊었던 업무, 앞으로의 포부",시종일관 편안한 분위기의 면접이었음
166,EA Korea,IT/웹/통신,"이력서 포트폴리오 경험 현재 진행 업무와 그간 업무 스킬 기반 및 인사이트 까지 폭 넓게 질문합니다""","본인이 했던 기획에 대해서 설명
프로젝트에 관한 의견
기존 업무 경험","편한 분위기에서 여러가지 질문이 있었고
면접관이 면접자만큼 준비를 많이 하고 오시는 것 같아 인상깊었습니다."
167,(주)니트로스튜디오,IT/웹/통신,"지원 - 면접 - 결과통보,
과제전형이 있다고 들었는데 생략했었고,
금요일에 면접보고 그 다음주 월요일에 결과가 나왔다.""","특별한 질문은 없었고, 이력서에 쓴 내용 위주로 물어봄",편한 분위기로 가볍게 진행
168,(주)모티프,IT/웹/통신,"경력직이라 메일로 제안 받음 > 1차 면접 (실무) > 2차 면접(대표) > 합격인데 갑자기 경영지원팀 윗사람 들어온다고 > 3차 면접(티타임 형식) 까지 함 ....... ..""","1. 직원들이 잘못했을때 어떤 부모님의 모습으로 대하느냐

2. 자기소개 (경력이지만 자기소개 시킴)

3. 이전 직장 퇴사 사유","실무 면접 무난했지만, 2차 대표 면접때 똑같은 질문 중복 되어 왔엇음

그리고 대표가 면접시간 늦어서 앉아서 30분 정도 기다림"
169,(주)겜브릿지,IT/웹/통신,"별 생각 없이 그냥 아무나 뽑는것같음 지원자가 없어서.........""",성격 자기소개 기본적인거 물어보고 프로젝트보여주면서 설명한 후 어떠냐고물어봄,딱봐도 아닌것같아서 안감
170,(주)수퍼브,IT/웹/통신,"1차 실무 면접 2차 대표님 면접으로 진행했었어요.""","아이돌 좋아하는지?
팬클럽 활동을 한 적이 있는지?
좋아하는 게임 장르는?","보통이었어요. 쉽지도 어렵지도 않은 면접
2차때 보통 인성 면접으로 볼 것 같았는데 실무진에서 물어보 거 거의 똑같이 물어보셔서 당황했었네요."
171,(주)클래게임즈,IT/웹/통신,"1차 면접때 경영지원팀의 회사 설명과 실무팀과의 실무 면접 그후 대표 면접까지 일사천리로 진행되는점이 만족스러웠고 전반적으로 분위기 좋게 진행되었던 기억.""",무난무난한 질문들이라 딱히 기억에 남는 질문은 없었다. 실무 위주로 포폴 확인과 실무 스킬 위주의 질문들과 앞으로 맡게 될 자사 게임에 대한 설명이 주를 이뤘다.,다음번 면접때 회사 규모나 급여가 더 좋은 다른 회사에 붙어서 이 회사와 고민하다가 다른 회사로 결정해서 입사는 하지 않게 되었지만 전반적으로 면접자를 배려하는 느낌을 받아서 긍정적인 면접 경험으로 남았었다.
172,(주)라인피알,IT/웹/통신,"도착 후 초인종을 누르면 안에 계신 직원분께서 맞아주셨습니다 기다렸다가 안쪽 대표실에서 대표분과 1:1 면접을 진행하였습니다""","1.일을 하게된다면 지원한 디자인에 한정되지 않고 다른 디자인 또한 함께 할 수 있는데 자신만의 디자인적인 고집(?)이 있으신지
2.포트폴리오에 대해 설명해보세요
3.여기서 일 하고 싶으신지","회사에 대한 자부심이 느껴지셨고, 먼저 회사의 대한 대략적인 내용을 설명해주셨습니다
먼저 회사의 방향이나 대략적인 내용을 말씀해주시는 부분은 좋았으나,
제 포트폴리오를 설명하였을 때 경청하시는 느낌은 받지 못하였습니다."
173,(주)락스퀘어,IT/웹/통신,"1차서류 2차 실무면접 3차 임원면접. 일반적인 면접 프로세스임""",비포괄이아니라 포괄인데 괜찮냐는 질문이 기억 남. 괜찮다고대답한듯,압박면접이 심하다
174,펍지(주),IT/웹/통신,"서류 심사 후 따로 과제 제출은 없고 1차 면접 진행함.""",솔직히 기억에 남는 질문 없지만 굳이 꼽자면 영어로 어떤 상황을 설명해보라고 한거?,면접 자체는 정말 무난했습니다. 하지만 면접 봐주시는 분이 바빠서 그런지 무슨 이유인지 모르겠지만 배틀그라운드 관련해서는 거의 물어보지 않고 다른 것만 오리무중으로 물어본 느낌
175,(주)맘모식스,IT/웹/통신,"이력서 제출 이후 면접 연락이 전화와 문자로 왔고 일정을 잡아 면접을 보았으며 일주일 정도 안에서 합격 전화가 왔습니다.""","작업물에 대한 질문, 회사의 비전에 대한 이야기들.",어려운 질문이 없었다.
176,(주)에스앤케이인터랙티브,IT/웹/통신,"짧은 면접시간, 질문보다는 본인이 이야기하는게 많았음""",이전 직장 하던 일 대인관계는 좋은지 인성에 관한 질문이 많았음,열심히 답했지만 본인 말이 더많았음
