,company,job,title,question,answer
177,모비온(주),IT/웹/통신,"실제로 진행했던 업무에 대해 상세하게 말하고 안해봤던 업무나 앞으로 배울 의지에 대한 부분을 상세하게 얘기했습니다""","회사이직을 하려고 하는 이유와 자기 회사를 알게된 경로, 평소 회사에 대해 어느 정도 관심이 있는지를 알아봤습니다","면접관이 친절하고 앞으로 해야할 업무, 팀의 분위기를 잘 설명해줘서 긍정적인 면접 경험이였습니다"
178,유징테크(주),IT/웹/통신,"온라인으로 이력서 제출 후 얼마 지나지 않아 면접 연락을 받았음. 면접 일정 조정 후 사무실에서 대표와 직접 면접을 진행했고 이후 대표로부터 직접 연락을 받고 입사결정을 내림.""","회사 업무 특성상 출장이 잦다 괜찮은가?
대부분의 직원이 부장급인데 적응하는데 괜찮겠는가?
본인이 자신있는 분야는 어느 쪽인가?",딱히 기술적인 부분에서의 질문이 없어서 면접 자체의 난이도는 낮은 편이지만 오히려 기술적인 부분에서 질문이 없어 사람을 뽑는데 있어서 기준이 없는건가 하는 의문이 들긴함
179,(주)아이벤토리,IT/웹/통신,"부서별 관리자 총 세명이 돌아가면서 질문하면서 면접을 봤고 무거운 분위기 보다는 유쾌하게 면접을 봤음""",이전 직장을 퇴사하게 된 이유 성격의 장단점 이 회사의 비전,회사 특성인지 몰라도 면접관들이 생각이 열려있어서 좋았습니다.
180,네이버 라인 플레이,IT/웹/통신,"리쿠리터를 통해서 지원
코딩테스트부터 시작""","sorting
UIVIEW
kth largest element","2시간안에 다 풀어야함
문제가 어려웠음"
181,세가퍼블리싱코리아,IT/웹/통신,"직원분들이 사람 대하는게 굉장히 좋게 느껴져서 그 부분은 좋은 인상을 받음""","이전 회사 왜 그만뒀냐/힘들었던 점
성격 단점/극복하려고 어떻게했냐

직무조사가 부족하다는 피드백을 받았는데 모집공고에 직무도 약자로 적혀있어 조사 많이 했으나 직무파악이 힘들었음","지원 인원 많지 않았고 면접 본 사람도 적을거 같은데 결과 발표까지 너무 오랜 시간이 걸려요
대기업도 아닌데 2주 뒤에 연락 준다고 하는 곳 처음 봤어요
마치 다음 면접에서 보자는 식으로 말씀하시고서는 이주 넘게 지나서 문의 후 겨우 탈락 통보 받으니 희망고문 당한 느낌이네요
그리고 연봉은 마지막까지 모른채로 ????? 이런 느낌인데 어차피 신입..."
182,펀플로(주),IT/웹/통신,"지원후 얼마안되서 연락오고 나서 방문 면접 진행""",이력서에 기재된 내용에 대한 질문이 대다수,"면접자의 이력서와 포트폴리오를 거의 읽지도 않고 면접을 진행한거 같다
민감한 질문도 꺼리낌없이 마구 던지고 시작부터 끝까지 불쾌한 면접이였음"
183,맥스온소프트(주),IT/웹/통신,"서류제출 후 실무진 면접하고 인성 면접하고 합격""",유니티에 관해서 c#에 관해서 포트폴리오에 관해서,어렵지 않은 질문들이라 쉽게 대답 가능
184,(주)피어코퍼레이션,IT/웹/통신,"1,2차로 나누어 면접을 진행.
실무자와 임원이 함께.
질문의 범위가 다양했으며 불편할만한 질문에는 예를 먼저 갖춰서 여쭈어봐주심.
평가보다는 대화의 범주에서 면접을 진행해서 편하게 자기 소견의 이야기 할 수...""",대표님이 질문해주신 입사 후 하고 싶은 업무와 그 이유.,프로젝트에 대한 이야기라 서술하기는 힘들지만 지원분야에 관련하여 서비스중인 프로잭트에 개선하고 싶은 부분을 서술.
185,아레나캐스트(주),IT/웹/통신,"서류통과 후 대표면접 진행
서류통과까지 1주 정도 소요
서류 발표 당일 유선 통보""","기존 업무이력
업무 성과
이전직장 퇴사사유",생각보다 빠르게 면접이 끝났고 빠른출근 요구로 바로 출근
186,한유코리아(주),IT/웹/통신,"평범한 질문 위주로 진행됐으며 분위기는 편안했습니다.""",출퇴근 때문에 괜찮은 월세방 알아다 준다고했었는데 지금보니 그냥 다른이유였던거 같습니다,평범했다
187,(주)웹젠온네트,IT/웹/통신,"서류 - 1차기술 - 2차적성
전화 오고 다음""","기술문제,
팀프로젝트 상황 가정해서 문제
포폴문제",빡셋다
188,구름인터렉티브(주),IT/웹/통신,"잡코리아통해 입사지원후 면접제의. 1차 팀장 면접후 2차 임원면접""","우리회사 입사 지원동기가 무엇인가요
해당부서의 필수역량은 무엇인가요","꼼꼼함과 성실함이 제일 중요합니다.
맡은업무에 책임감도 필수이구요"
189,"HappyTuk Co., Ltd.",IT/웹/통신,"이메일로 기술 인터뷰를 진행한뒤, 1차 실무진 면접, 2차 임원 면접을 진행했습니다.""","프로젝트 기반의 질문을 많이 받았고, 자바 스프링 기반의 질문들을 주로 받았습니다.","무난한 질문들을 받았으며, 어느정도 깊이까지 지식을 알고 있는지 평가하려는 느낌이 강했습니다."
190,(주)플레로게임즈,IT/웹/통신,"기본적인 개발 지식에 관련한 질문들이 주로 이루어졌습니다.""",어떤 장르의 게임을 즐겨하는지? 유니티 프로그램을 사용해본 적이 있는지?,다른 회사에비해 난이도가 낮은 수준의 면접이었습니다. 복잡하게 꼬리물기식 질문을 하지않아 편하게 면접을 진행하였습니다.
191,NetEase Inc,IT/웹/통신,"실무진부터 HR면접까지 세 번 정도 봤는데 실무진 면접 통과되면 이후 면접은 순순대로. 중국어를 잘 못 해도 한국인이라서 그럴 수 있다는 인식이 디폴트라서 편의성을 많이 봐주는 편.""",최근에 즐겨한 게임은? 가장 좋아하는 게임은? 그 게임을 왜 좋아하는지?,"내가 좋아하는 게임들의 공통적인 특징(장르, 게임성, 플레이방식 등)을 설명했고, 왜 좋아하는지에 대한 구체적인 이유를 뒷받침했음. 세 번의 면접 모두 큰 긴장감은 없었고, 오히려 면접관이 편한 분위기를 만들어줘서 긍정적인 분위기를 연출할 수 있었음. 면접은 아주 좋았다."
192,(주)피벗게임즈,IT/웹/통신,"포트폴리오, 이력서 첨부해 입사지원했고, 며칠 뒤에 화상 면접 일정 잡았습니다.""","자기소개, 포트폴리오에 대한 설명, 영상 외에 포토샵 디자인, 스파인 가능 여부 등 질문 받았습니다.",다른 게임회사 면접과 별 차이 없었어요. 다만 화상면접이 익숙하지 않으면 힘들 수 있겠다는 생각은 들었습니다.
193,(주)비빔블,IT/웹/통신,"대면 면접 이후 사무실에서 코딩 테스트 진행하였습니다.""","지원 동기, 업무 스타일, 프로젝트 진행 중 문제가 생겼을때 어떻게 해결했었는지 등에 대한 질문이 있었던 것 같습니다.","면접은 무난한 인성면접 수준이었고, 테스트가 실무와 연관이 있을만한 문제여서 괜찮았습니다."
194,(주)버프스튜디오,IT/웹/통신,"유선으로 서류심사 통과 연락을 받았다.""","1. 지난 회사에서 했었던 업무에 대한 구체적인 질문
2. 회사의 BM이 어떻게 되는 지 질문
3. 전공과 지원 분야의 불일치성에 대한 질문","솔직하게 대답했고, 구체적으로 조목조목 물어보았기 때문에
입사지원서를 상당히 면밀하게 읽어보았구나라는 생각이 들었다.
입사지원서를 면밀하게 읽어보았다는 것은 취업준비생에 대한 배려인데
이 부분에 있어서 좋은 인상을 받았다."
195,지니프릭스(주),IT/웹/통신,"이력서 접수 후 일주일 이내로 연락와서 바로 1차 면접 진행함""","자기개발을 주도적으로 하는가?
주량은 얼마나 되는가?
상사와의 의견 충돌 시 어떻게 대응할 것인가?","면접의 전체적인 난이도는 쉬운 편이며, tv플랫폼 시장이 어떤 것인지 이해하고 면접에
임하면 좋을 것 같음"
196,(주)버킷플레이,IT/웹/통신,"실무적인 질문 위주의 면접입니다.

일상적인 대화하듯이 질문이 오갔습니다.

편한 분위기에 대화를 잘 이끌어 주셨습니다.""","본 회사 게임에 대한 인상

포폴에 대한 설명 요청

복수 프로젝트의 작업은 어떻게 생각하는가.",딱딱하지않고 스무스하게 대화처럼 진행 되었다.
197,(주)루노소프트,IT/웹/통신,"연락 후 면접까지 빠르게 진행됨. 면접 후 이틀 내 결과통보""","프로젝트 작업방식을 소화할 수 있는지에 관한 질문들이 중점이었음.
그 외에는 이전 경력이나 작업 속도에 관한 질문","평소 쓰지 않는 작업방식이라 익숙하진 않지만 어려운 방식은 아니라, 가능하다고 대답함."
198,(주)와이디온라인,IT/웹/통신,"1차는 평범 하게 실무 관련 질문 2차는 임원진들이 들어와서 빈정거리는 인성 질문""",학원은 안다녔다는 말에 학원을 좀 다니시지 그러셨어요?,계속 코웃음을 치며 빈정대는 말투로 인사관련 사람의 질문을 받아 망했다 생각
199,(주)더마르스,IT/웹/통신,"처음 연락주신 분이 상당히 친절했고 일정을 조율하는 부분에서 자유도가 높았음""","이전직장 퇴사사유, 업무스킬, 업무에 대한 애착과 자기만족도","제가 좀 파고드는 성격이라 회사나 업무에 관련된 내용을 엄청 물어봤는데 제 궁금증이 풀릴 때까지 답변을 상세하게 해주셨습니다. 저땜에 면접 시간이 좀 길어졌던..

아 그리고 제가 긴장을 평소에 많이 하는데 그때마다 물도 챙겨주셔서 감동..했어요

기억에 남았던 질문들은 업무 관련 내용이 주로였고, 전문성을 많이 요구하는 느낌? 커피랑 간식은..."
200,엔에이치엔픽셀큐브(주),IT/웹/통신,"서류 합격 후 과제를 받아서 과제 수행을 먼저합니다. 해당 과제를 바탕으로 면접 때 발표를 하고 과제와 자소서 기준으로 질문이 많이 들어옵니다. 2차면접은 없었습니다.""","최근에 한 게임, 과제 관련 여러가지 질문들","자유롭고 편안한 분위기, 압박 전혀 없어서 좋았습니다."
201,(주)라인하트,IT/웹/통신,"이력서 제출 > 체출 후 연락 > 면접 일정 > 면접 후 통보""",svg 사용 가능한가 ? 프론트 쪽 가능한가? 등등 여러가지,"젋은 사원 많음, 주변 맛집 많음"
202,어시스트엔터프라이즈,IT/웹/통신,"면접은 전화로 연락이 왔고 다음 날 시간을 잡아서 면접을 보게 됨""","직전 회사 퇴사 이유, 회사 지원동기, 흡연 여부가 가장 기억에 남음",크게 어려운 질문들은 없었고 대부분 순탄하게 대답할 수 있는 질문들이었음. 그런데 자기들이 이렇게 해서 나간 직원들도 있고 면접 때 이랬지만 실제로는 이런 직원들도 있었다라는 둥 면접자 입장에서 터무니 없는 소리들을 많이 함. 바로 실무로 투입이 가능한 직원들을 원하는 것 같았으나 그렇다고 해서 생신입을 뽑기 꺼려하는 것 같진 않았음
203,(주)비티나인소프트,IT/웹/통신,"지원하자마자 전화옴 / 사무실에 들어가자 마자 나가야겠다는 생각이 듬""",자기소개 시켜서 자기소개함 / 개발경력 물어봄 / 나의 장단점 물어봄,특별한 질문을 하지 않고 형식적인 질문만 하였음
204,제이에스씨(주),IT/웹/통신,"실무면접 1회 / 입사후 대표와 1:1면접함""",이전 회사에 대한 질문과 대학 동아리 활동 질문함,대화하는 식 면접 / 압박질문이나 분위기는 전혀없음
205,페퍼콘(주),IT/웹/통신,"간단한 업무 이력을 물어보시고 그에 따른 답변만 잘 하면 되는 과정이 있었습니다.""",딱히 기억에 남는 것이 없어 어떤 말로 적어야 할지 모르겠습니다.,딱히 느낀 점은 없습니다.
206,(주)패스파인더에이트,IT/웹/통신,"서류전형 실무면접 임원면접순으로 진행""","지원 사유는?
추천할 수 있는 주변 지인 있는지?",부드럽고 안내도 친절했던 면접 이였음
207,(주)파디엠,IT/웹/통신,"1차,2차로 나눠져 있었고 둘다 다대다 면접이였습니다.""","회사에 대해서 물어보는 질문이 있었고, 이력서 외의 경험도 물어보았습니다.","면접은 편한 분위기 였던것같고, 딱히 어려운 질문도 없었습니다."
208,에스디엔터넷(주),IT/웹/통신,"면접분위기는 대체적으로 괜찮았습니다.""",본인 전공에 맞는 것 위주로 질문 주셨습니다. 깊이가 좀 깊었습니다,면접이 어려웠습니다
209,하자드게임즈(주),IT/웹/통신,"인터넷사이트(게임잡)를 통해 지원하였고 면접을 봄""","내가 작성한 포트폴리오를 보고 당시 상황에 대해 질문

내가 가지고 있는 역량이 얼마나 되는지?

현재 진행중인 프로젝트에 대한 가능성을 물어봄","면접이 그렇게 어렵지 않고, 평이하게 흘러갔음"
210,(주)에픽스튜디오,IT/웹/통신,"면접할때 거의 채용될지 느낄수 있음.""","경력위주로 면접을 진행함.
경력기간중 주요 프로젝트에 대한 질문을 많이함.",개인적인 기술과 인간적인 면을 많이 물어봄
211,이데아게임즈(주),IT/웹/통신,"면접 보고 과제심사가 있었습니다 과제에서 떨어진건지 면접에서 떨어진건지는 알려주지 않아서 모르겠습니다""","어쩌다 게임을 만들고싶어졌는지
좋아하는 게임이 뭔가요
우리 게임 그래픽에 대해 어떻게 생각하는지?",질문이 꼬리에 꼬리를 물어서 좀 어려웠습니다.
212,(주)베가게임즈,IT/웹/통신,"따로 인사관련 부서가 없기 때문에 각 부서의 연차 높은 선배님들이 면접관으로 들어옵니다.
서류 전형 통과 이후에 면접을 보고 그 이후 입사 여부를 결정했습니다.""","자기 소개서에 특이 사항이 있다면 해당 사항에 질문은 들어옵니다.
직무와 관련된 필수 질문들도 있습니다.",회사 내에 꼭 필요한 사람을 뽑는다는 인상을 받았습니다.
213,과르네리스튜디오(주),IT/웹/통신,"친구소개를 통해 알게 되었고 대표와 면담을 통해 면접까지 진행함""","자기 게임소개
향후 개발비전
내가 해야할일",처우관련 이야기가 주된이야기라 별건없었ㅇ음
214,(주)덱스인트게임즈,IT/웹/통신,"권위적이고, 무례함
특히 누군가 한명이 그랬음""","왜 퇴사했냐
특정 시스템에 대한 질문이 있음
왜 그 시스템을 그렇게 했냐","기획의도 및 사이드이펙트에 대한 부분 답변
표정이 부정적이고, 맘에 안든다는 듯 꼬리물기 계속함
그런식으로 작은데서 압박면접 하지마세요 기분 나빠요"
215,원모아시스템(주),IT/웹/통신,"잡코리아 등록된 부분으로 휴대폰 직접 연락 그후 면접 채용""","기초적인 개발 지식, 회사 비전, 현재개발상황",면접이 너무 쉬운편이였고 완전 초창기라 아무것도 준비된게 없는 곳이였다
216,스포빌,IT/웹/통신,"본사에서 면접 진행됐으며 해당 직종에 대한 경험 유무 그 외 일반적인 면접 질의 오감.""",면접 장소가 본사 사무실 응대실이었는데 담배 쩐내가 기억에 남는다.,일반적인 면접 분위기와 비슷해서 그다지 느낀점이 없다.
217,(주)문블락게임스튜디오,IT/웹/통신,"연락 받고 바로 다음날 면접일 정하고 10분정도 얘기하고 바로 다음날 출근.""","사는 곳이 어디인지, 술 담배 하는지 여부, 급여 얼마인지 급여일.","뭔가 사람을 급하게 뽑는 느낌을 여실히 느꼈고, 면접을 대충 보는 느낌?"
218,(주)씽크펀,IT/웹/통신,"이전 회사에서 같이 일했던 분이 여기로 이직해서 사내 추천으로 입사하게 됨
이력서 보내고 1주일만에 면접보고 10일정도 후에 결과나와서 입사일 정하고 입사 함""","해외 거주하면서 일하던 회사 근무 관련 질문이 있었는데
그냥 해외도 한국이랑 비슷한지 물어봄",비슷하다고 답변함
219,오키컨세션(주),IT/웹/통신,"이력서 접수후 유선 연락. 1회 다대다 면접으로 진행되었음""","업무 관련 질문, 출퇴근거리 등 일반적인 질문으로 대답하기 어렵지 않음",비교적 편안한 분위기에서 면접이 진행되었고 30분정도 소요됨
220,캐럿게임즈(주),IT/웹/통신,"서류제출 > 전화합격통지 > 1차 면접 > 2차 면접""","운동 좋아하세요? (야근이 많기 때문에 체력 확인)
자신이 왜 남들과 다르다고 생각하세요?
1분 자기소개 해주세요",저를 면접봤던 분들이 제가 다니는 1년 사이에 다 나가셨더라구요.
221,팝조이(주),IT/웹/통신,"1차 서류 2차 개인면담 후 합격 불합격 여부 결정""","어떻게 해서 오게 되었는지, 자신의 장점, 어떤 게임을 만들고 싶은지",압박이 심하지도 않고 질문이 대체로 부담스럽지 않았음
222,와이즈캣(주),IT/웹/통신,"처음 서류 면접을 끝내고 3분이랑 기술 면접을 마치고 합격발표가났다.""",일단은 자기가한 포트폴리오를 처음부터 간단하게 다 설명을 하고 기본적인 기술 질문을 한다음 다른것들을 물어봤다,크게 압박은 없었으며 기본적인 질문 위주로 하셨다
223,(주)아이들상상공장,IT/웹/통신,"평균 작업 시간, 작업의 장단점 등등 기본적인 것들을 문답했습니다.""",딱히 없습니다. 전부 무난하고 보폄적인 질문들이었습니다.,무례하지 않고 부드러운 분위기였습니다.
224,노아시스템(주),IT/웹/통신,"잡코리아에서 보고 서류 넣었고 넣고 3일? 정도만에 연락이 옴.
면접은 1차 2차 두번 있음...""","2차 면접에서 친구랑 인디게임 만들어 봤다고 말하니까 '남자친구?' 하고 물어봄. 남자친구는 있는데 게임을 남친이랑 만들진 않았다고 하니까 '여자들은 보통 게임하는 이유가 남친이랑 놀기 위해서' 라고 함. 너무 구시대적이고 충격적이었음ㅋㅋ...;; 내가 남친이랑 놀다가 게임 회사 입사지원까지 했겠냐.

마스크 내려보라, 담배피냐, 술 좋아하냐... 뭐...","전체적으로 너무 불쾌했음. 1차 면접에서 받은 회사에 대한 좋은 인상을 2차 면접에서 다 날려먹음.

입사 후에도 대화하면서 느낀 거지만 성차별적 발언들을 서슴없이 하심. 근데 기억도 못하실듯ㅋㅋ... 옛날 사람이니까 어쩔 수 없으려니 싶다가도 가끔 화남."
225,(주)글립소프트,IT/웹/통신,"1차 직무 면접 이루 2차 인성면접으로 1,2차 면접 진행합니다.""","이전 회사 업무 내용?
그 업무는 그렇게 처리한 이유?
야근에 대한 생각","이전 회사 업무 내용과 처리 내용에 대해서는 이전에 했던 결과에 대해 답변을 했으며,
야근에 대해서는 긍정도 부정을 표현하지 않았습니다. 대부분의 중소기업은 야근을 한다고 생각을 하고 있어 하면 하는거라 생각했습니다."
226,(주)펀팩토리,IT/웹/통신,"전화로 통보받고 시간 정하고 면접합니다""",너무많은 질문을해서 구체적으로 생각은안나지만 질문이 많고 지원자의 생각을 많이 들으려합니다,편안한 분위기였고 압박면접이라는 생각이 들지 않았습니다
227,다다소프트(주),IT/웹/통신,"면접에서는 그냥 간단한 기술문제만 물어보고 2차로 넘어갔습니다. 2차는 별 거 없고 인성면접 느낌이었습니다.""",회사 지원 이유/자사가 서비스하는 게임을 해보았는지/카지노에 관심 많은지,그렇게 빡센 면접은 아니었습니다
228,플럼비소프트(주),IT/웹/통신,"편안한 분위기에서 진행 이력서 위주로 질문주셨습니다""",팀과 불화가 있을때 어떻게 했었는지 질문주셨고 나름 친화력으로 극복했다고 답변,나름 편한 면접이였지만 큰 기술을 요구하는 질문은 하지 않았습니다
229,재미인터랙티브(주),IT/웹/통신,"한여름 면접약속, 아무리 코로나라지만 한여름에 갔는데 물한잔도 주지 않으시지 않으시고, 물이라도 마시겠나고 묻지도 않으시더라구요^^*""","1. 퇴사사유
2. 리더쉽이 있는 자인가
3. 회사에 궁금한 점","면접시간은 길지만 비슷이야기만 반복하는 느낌..
회사에 궁금한점은 앞서 다 이야기 해주셔서.. 없어서.. 없다고 함"
