,subject,title,content
33,연봉,입사 전 프론트엔드 연봉 재협의,안녕하세요. 프론트엔드로 현재 연봉 협의를 하고 입사날짜도 정해졌는데 일주일 후 다른곳에서 오퍼를 받게 되었어요. 현재보다 300 더 높게 오퍼를 받았습니다. 현재 입사예정인곳에서는 제가 불렀던거에 바로 맞춰주셨는데 당장 초봉을보면 더 높게 받은곳에 가고싶지만 현재 입사결정한곳에 가고 싶습니다. 혹시 이렇게 입사 및 연봉도 협의된 상태에서 재협의 요청을 드려도 되나요? 실례일까요? 시도해보는것도 나쁘지않을까요? 지금 받은곳보다 200정도라도 올려주면 저는 욕심은 없긴한데 고민이됩니다. 선배님들 한말씀 부탁드립니다.
34,연봉,연봉상승률 괜찮은 건가요?,웹프 초봉 4000에 그 외 수당 없음 하지만 야근 많이함 회사 사람들이 다 알만한 큼직한 일들도 많이했음 하지만 협상 과정에서 실력부족이란 지적을 받음 재고여부에 대해 물어봤지만 강경히 거절함 연봉상승률 7.5% 상승후 연봉 4300
35,연봉,비전공 2년차 웹개발 프리랜서 진로고민,"안녕하세요 33나이에 6개월 java web 강의들은후 취업해 si 1년조금넘게 프로젝트 3개정도 투입후 마지막프로젝트에서 대기업의 pm님의 추천을 받아 프리랜서로 전향하여 현재 sm 인력으로 투입된지 얼마 안된 2년조금넘은 개발자입니다(현재36세) 현재 sm하면서 잘모르던 리눅스 , 배포 이런부분 배우는 것도 좋습니다 무언가 배우는 것을 좋아하여 혼자 회사 다니며 주말 이용하여 vue.js , react.js 학원수업도 받았습니다 틈틈히 스프링,스프링부트 인터넷강의 들으며 git에 잔디심어가며 뿌듯함도 느끼고 만들고싶은 앱이있어 열심히 하고있습니다 문제는 당시 저는 6년차로 업계관행인 뻥튀기 시킨경력으로 프로젝트를 투입했었고 현재 맡을때 프리랜서다 보니 연봉이나 이런부분이 너무 높아졌고 현재 제 프로그램이 복잡하고 문제가 많아 제가 좀 끝까지 파는 부분이있어서 잘못된코드 수정및 필요화면 개발 및 배치들의 oom문제등의 처리들을 해오다보니 필수 인력으로 인정받아 연봉이 조금더 높아지게 되었습니다 (7년차가 되어있습니다 현재는) 돈을 많이 벌면 됐지 이런생각보다 조금더 많은 현업에서 사용하는 기술을 익히고싶다 라는 욕심이 자꾸 생깁니다 그리고 나이가있다보니 생각이 많아집니다 이시점에 저를돌아보면 저는 고졸에 2년조금 넘은 아줌마입니다 현재 프로젝트는 너무 오래된프로그램이다보니 자바 + 서블릿 방식의 옛날 프로그램이며, 현재 최신사용 기술과는 다소 멀고 현재 2년을 계약했는데 이 sm업무가 끝나면 4년 조금 넘은 고졸 아줌마를 뽑아 줄곳이있을까 더나이 먹기전에 옮겨야할까 사이에서 고민을 합니다 질문의 요지는 현재의 연봉을 포기하고 원하는 기술을 더 배울수있고 안정적인 곳으로 옮긴다 vs 현재의 연봉에 만족하고 그냥 계약 종료까진 유지해라 나중일은 나중에 생각하자 이렇게 두가지의 선택기로입니다 긴글읽어 주셔서 감사합니다 조언 부탁드립니다"
36,연봉,신입입니다. 연봉협상 같은건 어떻게 해야하나요?,현재 A회사와 B회사를 합격을 했습니다. A회사는 연봉을 정해주셔서 그냥 받아들였습니다. 또 A회사가 마음에 들었기 때문입니다. 하지만 B회사 같은 경우는 아직 연봉협상을 안했는데 A회사보다 훨씬 높게 부르는 방식으로 연봉협상을 하면 좋은 전략인가요?
37,연봉,혼자 개발 연봉 많이 vs 사수와 개발 연봉 적게,"A회사 : 여러명이서 협업하며, 사수가 있고, 내가 주로 공부했던 전공, 존재하는 솔루션이 탄탄해서 안정적, 탄력근무제 그러나 연봉 B회사에 비해 600만원 낮음 B회사 : 사수 없음, 혼자 개발해야하고, 프론트 백엔드 배포 등 다양한 업무 담당 많은 걸 배우고 만들어나갈 수 있음, 현재는 안정적인 솔루션이 없지만 망할 일은 없어보임, 연봉 A회사보다 600만원 높음 두 기업 다 스타트업인데 B기업이 좀 더 스타트업에 가깝습니다. 어디에 가는게 좋을지 다른 분들 의견과 이유가 궁금해서 글 남깁니다 감사합니다"
38,연봉,신입 백엔드 개발자 연봉 질문,"막 졸업한 신입 개발자입니다. 졸업하고 대학 연계하여 3개월 인턴 했던 회사에서 연락와서 잠시 다녔습니다. (A 회사라고 하겠습니다.) 백엔드 개발자로 입사를 하게 되었지만, R&D 업무 및 인공지능 세미나 참여, 유선 상으로는 정규직을 시작하기도로 하였지만 정부 사업 참여를 위해 3개월 프리랜서(연봉은 인턴 연봉) 등 이유로 퇴사하게 되었습니다. 운 좋게 B 회사 2차 면접 후 최종 합격까지 하였습니다. A 회사는 스타트업으로 직원 6명이고 인턴 2800, 정직원 3000 입니다. B 회사는 직원 90명이고 대졸초임 2700 -> 2800까지 가능하다고 합니다. 선배님들의 의견이 궁금합니다. 현재 퇴사하여 구직중인 상황입니다. B 회사 업무는 시스템 유지 보수가 메인이며, 기능 개선 등으로 개발 참여할 경우 인센티브가 따로 나온다고 합니다."
39,연봉,인서울 전공 개발자 초봉 3000 다닐만 할까요?,"안녕하세요. spring boot 로 백엔드 전공을 한 인서울 컴공졸업한 개발자입니다. 어느 회사에 면접을 보아 합격하게 되었는데요. 잡플래닛 평점도 3점이상이고 면접을 보러 갔을때 사무실 분위기, 사람들 전부 좋았습니다. 하지만 그동안 초봉 3000은 그동안 제가 노력한 만큼의 연봉은 아니라고 판단이 드는데 현직자님들의 초봉 생각 듣고싶습니다!! 따끔한 일침 환영입니다 ㅠㅠ"
40,연봉,함께 성장하자는 기업에서 신입의 역할,"제목을 짓는데 참 고민이 많이 됐는데요.. 저는 이제 입사 한달차 프론트엔드 신입 개발자입니다. 회사는 나름 그 분야에서는 인지도가 있지만 개발팀이 없어 이번에 새로 개발팀을 꾸리게 되었고 개발팀만으로 본다면 완전한 스타트업이라고 보면 될 것 같습니다. 현재 개발팀은 4명의 인원으로 같은 부트캠프를 수료한 사람들이 모여서 팀을 이루고 있습니다.(지인 찬스) 백엔드 3명, 프론트엔드 1명으로 저 혼자 프론트엔드를 맡고 있습니다. 그렇다 보니 실력이 제각각이구요. 회사에서도 저희를 뽑을 때 실력이 아닌 의지와 열정만으로 믿고 채용을 했습니다. 저도 엄청난 실력이 있는건 아니라고 생각해 큰 문제가 없을 것이라고 판단했습니다.. 하지만 여기서 큰 문제가 발생하는데 실력이 제각각이다 보니 잘하는 사람과 못하는 사람이 확연하게 구분이 되게 되었습니다. 저는 그중에 잘하는 축에 속했구요. 그렇다보니 계획한 프로젝트가 순탄하게 진행되지 않았고 저도 프로젝트가 잘 되었으면 하는 바람으로 백엔드 한 분을 거의 전담마크해서 제 커리어와 지식을 바탕으로 백엔드를 알려드리고 있습니다. 게다가 최근 디자이너 한 명을 채용해서 UI/UX 디자인을 요구하는데 아예 경험이 없는 분을 채용해 프론트엔드인 제가 그 분까지 가르쳐야 하는 처지입니다.. 임원진, 팀장님도 '잘 가르쳐라'라고만 하시지 실상은 잘 모르시는 것 같습니다. 저에게 너가 잘하니 개발팀 팀장의 역할을 주겠다고 하셨지만 그마저도 오피셜로 정해진건지 흐지부지 넘어간 것 같습니다.. 그 분은 디자인에 대한 열정은 있는 것 같으나 제가 보기엔 디자인 감각은 없었고 UI/UX를 가르치면 배워서 열심히 하겠다는 의지를 보여 채용했다지만 그 분야에 대해 배우고자 하는 의지가 없어보입니다. 참고로 나이가 매우 어리며 사회생활이 처음이라고 합니다. 제가 이 기업에 온 가장 큰 이유는 0에서 부터 100을 만들어 서비스를 오픈할거라는 기대가 제일 컸었고 으쌰으쌰하는 분위기가 좋았던 것 같습니다. 아주 적은 연봉으로도 참고 한 번 다녀보자라는 의지가 강했습니다. 물론 저도 가르치는걸 좋아하는 성격이라 누굴 가르치는 것에 큰 거부감은 없었는데 열정이 없는 사람을 가르치려고 하니 회의감이 크게 오네요.. 유튜브 강의를 들으라고 알려줘도 자막도 없이 이어폰도 끼지 않은 채 10분짜리 영상을 3분만에 보고 꺼버린다던가.. 회사를 다니는 것에 대한 열정이 많이 꺾이네요..ㅎㅎ 내 열정을 죽여가면서 회사에 다녀야 하는건지.. 이런 경우에는 어떻게 하는 편이 좋을까요? 솔직히 말하면 연봉을 올려준다고 하면 다녀볼 것 같습니다. 이런 상황을 통해서 연봉 협상을 요구해야 하는건지.. 현직자분들 조언 한 말씀 부탁드립니다.. 긴 글 읽어주셔서 감사합니다.."
41,연봉,박사 졸업(도메인+ML 연구) 후 데이터 분야로 진로 변경(스타트업 조인..?),"안녕하세요. 저는 23년 2월에 박사를 졸업하고 데이터 사이언티스트-엔지니어로 잡을 구하고 있습니다. 현재는 학교에서 포닥으로 소속되어서 연구를 마저 마무리하거나 새로운 연구를 준비하고 있구요. 학위 중에 AI/ML을 전공한 것은 아니구요. 따로 도메인이 존재하는데 박사 입학 후 2년차부터 AI/ML (주로는 NLP)를 활용해서 연구를 진행했습니다. 주로 저희 도메인 문제를 풀다보니 데이터셋 만들고 문제 해결하고 하는 것은 경험이 많지만 새로운 모델 아키텍쳐를 제안하는 쪽으로 연구를 수행한 적은 없습니다. 최근에는 점차 연구에 NLP 비중을 늘려서 cs + 도메인 컨퍼런스들에 논문을 내는 중입니다. 문제는 올해 대기업이나 제가 생각하는 괜찮은 도메인 + AI 기업에 지원을 한 5군데 정도 했는데 모두 면접에서 탈락했다는 겁니다. AI 연구원으로 지원하기에는 AI/ML 연구를 주로 하지는 않았기 때문에 보통 데이터 계열로 지원했습니다. 다만 저와 도메인 일치도가 상당히 높은 스타트업 하나에서 오퍼가 와서 이야기를 진행 중입니다. 상당히 초기 스타트업으로 업력은 1.5년에 정직원 10명 가량, TIPS 받은 상황(15억)이며 B2B 형태인데 시리즈A 투자 투심위는 끝냈고 올해부터 매출을 꽤 낼 수 있다는 자신감이 있어서 시리즈 A 규모를 크지 않게 가져가려고 한다고 합니다. (대표와의 면접에서..) 그래서 지금 시점에서 옵션이 2가지를 고려중인데 하나는 현재 포닥 중인 곳에서 연구를 더 진행하면서 연구 실적을 쌓고 다시 취업을 도전하거나 학계 진출을 노리는 것이고. (아무래도 1. 채용 한파..?, 2. AI/ML 컨퍼런스 실적 부족, 3. DE로써 필요한 개발 역량 부족이 탈락 요인이지 않을까 싶어서 이를 보완하고)다른 하나는 제안 받은 스타트업에 조인하는 것입니다. 연봉은 전자는 7500 정도고 후자는 8000에 스톡옵션 협의 정도일 듯 합니다. 스타트업 및 데이터 직군 쪽 채용 시장을 잘 파악하지 못한 것 같아서 의견을 여쭙습니다. 감사합니다!"
42,연봉,웹/앱 개발 연봉인상,"안녕하세요 신입개발자인지라 연봉관련에 궁굼한 점이 있어 글 올립니다. 현재 직장에 다닌지는 1년 반정도가 되었는데 올해 말을 기준으로 웹 앱을 포함해서 프로젝트를 웹 간단 2건, 어려움 2건, 앱 간단 1건 심화 1건을 마무리하고 끝낼 거 같은데 정말 터무니없는 소리일 수 있지만 연봉 4,200 을 제시하기에는 많이 무리인가요? 현 연봉은 3000입니다. 중소 기업이여서 앱 1건외에는 프론트 앤드 부분은 거의 1인으로 진행하였고, 현 회사에서 백앤드 전향을 원하는 것 같아서 이것저것 물어본 후 php통신, 소켓통신, 데이터베이스 구축을 개인적으로 공부하고 있습니다. 최소한 내년 시작할때에는 백앤드 관련 답변을 들은 부분에서 부족한 실력이지만 실무를 할 수 있다는 전제하에 답변 부탁드립니다"
43,연봉,연봉협상 틀어지면... 말씀을 어떻게 드려야될까요?,곧 연봉협상인데 제가 생각한 마지노선보다 협상이 안되면 3월쯔음에 그만둘 생각인데... 혹시 그럼 연봉협상때 3월쯤 그만둘거같다고 말씀드리는게 나을까요? 아니면 일단은 받아들이고 2월쯤 그만둔다고 말하는게 나을까요...? 연봉협상 고수님들 답변 부탁드립니다...!😭
44,연봉,2년차 개발자 도메인 변경 이직,"안녕하세요 현재 중견기업에서 근무중인 2년차 백엔드 개발자입니다. 핀테크, 프롭테크 등 금융쪽에 관심이 많아서 해당 도메인의 회사로 이직을 희망하고 있습니다. 1차 희망 회사는 금융+빅테크 기업으로 그래도 조금 큰 기업에서 대량 이벤트 처리, 분산 처리 등을 경험해봐야하지 않을까라는 생각이 듭니다. 2차 희망 회사는 금융 도메인인 회사인데 중소부터 스타트업 위주 공고가 많이 있더라구요. 특히 한 스타트업의 서비스는 직접 사용해보고 회사 관련 뉴스들을 찾아보면서 이 회사에서 일해보고싶다는 생각도 들었습니다. 1차 회사로 이직만 할 수 있다면 고민은 없지만.. (잦은 경력직 서류 탈락으로 자신감을 잃은 것 같기도) 도메인 변경 이직시 회사 규모 상관 없이 이직을 해도 괜찮을까요? 추가로 해당 도메인을 꼭 하고싶다면.. 연봉을 낮춰서 이직해야할지요. 스타트업 이직시에 협의해봐야겠지만 공고에 제시된 연봉은 현재에서 2천만원 더 적은 연봉입니다. 인생 선배님들의 많은 조언 부탁드립니다:)"
45,연봉,(Java) '연봉/워라벨은 좋으나 레거시한 기술스택 회사' 어떻게 생각하시나요?,"최근 나름 큰 기업의 오퍼를 받았습니다. 연봉 및 워라벨은 나름 좋은 편입니다. IT 총판사라고 합니다. 근데 사용하는 기술스택이 Java, 스프링 프레임워크, 전자정부 프레임워크, Vue.js 등이며, 지원자격에 JSP, JQuery 개발경험 등도 포함되어 있습니다. B2C기업, JPA사용 등 조건의 IT회사에 가고싶지만 당장 코테도 준비가 안되어 있어서 원하는 방향의 좋은 기업은 못가고, 코테를 보지않는 괜찮은 기술스택 회사 위주로 알아보고 있긴 합니다만,, 연봉/워라벨이 발목을 잡네요ㅠㅠ (비슷하게 금융권SI도 최신의 기술 스택위주는 아닌 것 같네요) 현재 SI 3년차인데, 여러분들이라면 어떻게 하실 건가요? 조언이나 경험공유 해주시면 감사하겠습니다."
46,연봉,신입 개발자 어디로 갈까요..,"경기 4년제 컴공과 복수전공하고 4개월 인턴 경험있는 취준생입니다! 지금 2곳에 합격해서 어디 갈지 고민중인데요... 의견 부탁드립니다..! 1. Ai 솔루션 회사 직무는 웹개발입니다. Ai 솔루션을 만드는 회사로, 가게되면 어드민 페이지 개발, 사용자 페이지 개발?을 맡게될것 같습니다. 기업 규모는 50명정도입니다. 웹개발팀 규모는 제가 가면 2-3년차 한명과 팀장님 한분 계시는 것 같습니다. 인턴 3개월 근무 후 정규직 전환입니다. 인턴 근무 3개월 동안은 최저임금 받고, 합격하면 연봉은 3500입니다. 2. ERP 솔루션 회사 직무는 풀스택 웹개발입니다. 기업 규모는 70명정도 됩니다. 아마도 그룹웨어 시스템 개발,유지보수를 맡게될 것 같습니다 .여기는 개발팀 규모가 그래도 좀 있는 것 같아요. 제가 갈 팀에 7명정도 계신것 같았어요. 여기도 3개월 수습 기간이 있고, 연봉은 3000입니다. 둘 중에 어디갈지 고민이네요.. 아무래도 연봉이 1이 더 높아서 갈까 고민인데, 인턴전환이 안될 수도 있다는 점이 걸리는데 어짜피 2도 수습기간이 3개월이라 차이가 없어서요. 잡플래닛 후기 보면 1회사가 2점대고.. 야근이 있는편이라는 이야기가 있어서 고민되네요 ㅠ 그리고 웹개발쪽 팀은 규모가 작은것 같아서요"
47,연봉,닫힌 질문,이전에 3년정도 같이 일했던 대표님이 다시 오퍼주셨는데 지금 연봉에 두배를 주신다고 했습니다 이전에 같이 회사가 어려워져 정리된 경험 때문에 이번엔 베시한 연봉 절반을 3년치 가불도 오케이 하셨습니다 대신 가면 개발자가 저까지 총 두명이고 현재 다니는곳은 50명정도 되는 곳이네요 ㅎ.. 연봉이 대략 가게되면 1억 중반이될거 같은데 고민되네요 ㅎ;
48,연봉,신입~1년차 이직 스타트업연봉,"안녕하세요! 현재 중소에서 이번달이면 11개월째 다니고 있습니다! 다른 스타트업에서 이직 제의가 와서 최종 면접까지 다 통과한 상태입니다. 제가 생각했을 때 현재 회사보다 비전도 좋고, 제가 하나만 하는 것이 아닌 기획, 디자인, 개발까지 하는것을 좋아하다보니 해당 제의준 스타트업도 그걸 좋게보고 딱 필요한 인재라고 생각하셔서 최종 합격까지 했습니다. 아직 연봉 협상을 안한 상태입니다. 곧 직접 만나서 연봉 협의를 하기로 했는데요. 현재 고졸에 첫 입사할 때 3000 받고 들어왔습니다. 저는 이곳으로 이직하게 되면 여러가지 일을 다 도맡아서 할 것을 알기에 6~10% 정도만 올려서 협상하고 싶습니다. 괜찮은 걸까요?"
49,연봉,앱 기획자에서 개발로 이직..,"안녕하세요. 저는 29에 앱 기획 1년 10개월차 입니다. 대학교에서는 컴퓨터 소프트웨어를 전공했습니다. 학교에서 가장 재미있었던 부분이 java랑 db였고 학점에서도 java와 db가 항상 높았습니다. 다만 경제적으로 좀 어려워서 요식업 일을 계속하다가 보니 어느덧 5년 넘게 요식업에서 일을 하게 되었고 방황을 좀 오래 했습니다. 주변 대학 동기들은 개발자로 취업해 있더군요.. 요식업을 계속하기엔 미래도 없어 보였습니다. 2년 전에 요식업을 때려치우고 지인 회사에서 기획을 배우며 앱 기획을 하고 있습니다. 재미는 있는데.. 아무래도 신입으로 오다 보니 연봉도 그렇게 높은 편이 아니었습니다. 연봉이 거의 7년 전 요식업에서 받던 연봉이라.. 중소기업 정규직으로 입사하였고 급여는 낮지만 주3일 재택이 있어 근무 환경이 좋습니다. 야근도 없고 회식강요도 없고 좋은회사는 맞지만 일하는데 즐겁지가 않습니다. 전 기획에 대해서는 아무런 지식이 없었습니다. 그렇다 보니 회사를 다니며, 기획에 대해서 인터넷 강의도 보고.. 구글링도 찾아보며 어느새 IA, 스토리보드도 작성할 수 있게 되었습니다. 현재 업무로 프로젝트 하나 진행 중이라 앱과 어드민 기획은 완료되어 이미 개발이 완료되었고 서비스 출시를 앞두고 이제 이벤트나 개인정보 처리 방침 등을 준비하고 있습니다. 근데 하면 할수록 자꾸 개발은 해보고 싶은데 엄두가 안 나더군요.. 블록체인 개발에 호기심이 있긴 한데.. 진입장벽이 어떠한지 궁금합니다. 블록체인에 대해서는 아무런 지식이 없는 상황입니다. 새롭게 공부하고 준비해야 합니다. 아니면 호기심으로 끝내고 앱 개발로 이직을 준비하는 게 맞을지요.. 앱개발로 간다면 안드로이드 개발로 준비하고자 합니다. 조언 부탁드립니다. 감사합니다."
50,연봉,● 이직 고민! 밸런스게임(투표),"서른초반에 2년차 중소 SI 개발자이고, 프런트 위주로 프로젝트 4개를 뛰었습니다. 그나마 프런트 업무는 조금씩 친숙해지는데 아직 백엔드 경험이 없어서 그런지 스스로 자신감은 부족한 상태입니다. 그러는 와중에 지인들로부터 이직 제안이 겹쳐서 세가지 중에 하나를 투표 받아볼까 합니다! (기업A) 중견 SI 회사, 연봉동결(중고신입) (기업B) 중소 로우코드 플랫폼 회사, 연봉15%인상 (기업C) 중소 스타트업 회사, 연봉10%인상"
51,연봉,스타트업 대푭니다. 개발자분 연봉협상 / 채용 고민됩니다,"안녕하세요. 저는 초기 스타트업 운영중인 사람이고, 앱서비스 하고 있습니다. 공동 창업자 개발자 한놈이랑 사업 시작 했는데요. 이녀석도 시작할때 개발 경험이 학부따리 웹 프런트 / 백 1년정도밖에없어, 앱 공부하면서 만든 케이스입니다 (RN + firebase 로 개발중) 앱에 사람이 많이 몰려서 서버에 렉이 계속 걸리는데, 이 친구 혼자서 못잡아내고 있고, 시니어급을 한분 고용 하려고 합니다. 자금 상황이 녹록치가 않아서 파트타임 혹은 자문자 포지션으로 구인하려는데요. Q1. 시니어급 파트 (혹은 자문) + 제친구 풀타임 이 조합으로 , 대규모 아키텍처 개선 전까지 버틸수 있을까요. 혹은 시니어분을 풀타임으로 뽑아야할까요 Q2. 시니어급이라고 써놓긴 했는데 몇년차(3년차? 혹은 CTO급?) 뽑아야 할지 모르겠습니다. 물론 문제에 따라 다르겠지만, 이런 트래픽 문제릉 해결 하려면 몇년차 백엔드 / 클라유드 개발자 분이 필요할까요 Q3. Q2에서 말씀 드린 분 풀타임기준으로 연봉이 어떨지 궁금합니다. 그리고 파트로 갈시에 그냥 연봉에서 시간 대비로 깎으면 될지도요. Q4. 지분을 주고 데려온다면 얼마정도 드려야할지 고민됩니다. 보통 얼마선에서 협상 되는지요"
52,연봉,4개월 차 이직 질문,"안녕하세요 중견기업에서 4개월차 vue 개발자로 일하고있습니다. 입사 초기 회사 적응이 어려워 다른 회사에 지원하고 면접도 보았는데 이제 회사에 적응되어 편해질쯤 스타트업(시리즈b)으로부터 최합 통보 받았습니다. 현 직장의 장점은 업무 강도가 낮은점과 좋은 네임밸류이고 단점은 연봉이 3천 초반이고 1시간 거리입니다 이직할 직장의 장점은 연봉+400 , 식대 지원. 출근거리 25분,자율출퇴근 입니다. 그러나 풀스택(리액트 노드)으로 일할 가능성이 큽니다 누구는 연봉차이 얼마 아니라고 하고 누구는 크다고 해서 헷갈려 질문드립니다."
53,연봉,백엔드 경력 조언 얻고자 올립니다.,"안녕하세요 개발자로 일 한지는 만 3년 되는데 이직 경력이 너무 많고 고민 되어서 한번 올려 봅니다. 경력으로 넣어야 하나 중고신입으로 넣어야 하나 고민입니다. 20.02 ~ 21.06 (중소기업-it) 1년 5개월 영상처리랑 kafka 써서 데이터 엔지니어링 업무좀 담당했는데 이 업무 하는데 사수도 없고, JAVA백엔드로 업무 전환 하고 싶어서 이직했습니다. 21.07 ~ 22.09 (중견 제조업) 1년3개월 연봉은 이전보다 많이 올라서 연봉은 만족 했으나 qt랑 스프링 사용했는데 이직하게 된 이유는 기술적인 걱정이랑 프로젝트를 나가도 기존에 있던 코드를 복붙 하다시피 만들고 그리고 연차가 점점 시간 갈 수록 cs업무가 나한테와서 개발 하는 시간이 점점 없어져서 이러면 안될 것 같아 이직 했습니다.. 722.09 ~ 23.03 (스타트업) 7개월 마지막으로는 기술이랑 JPA , 스프링 부트 쓰면서 기술이랑 연봉 둘 다 만족했는데.. 임금체불로 좀 버티다가 이건 아닌거 같아서 퇴사하고 지금 이직 준비중 상황이래서 또 퇴사하고 이직준비 하게 되었는데.. 백엔드 2-3년차 경력으로 넣어도 되는지가 궁금합니다 경력기술서 작성하고 서류제출 하는데 쉽지가 않아 중고 신입으로 가야 하나 고민이네요 추가적으로 이직 준비는 포토폴리오(커머스)개인 + 코테 준비하면서 하고 있긴 한데 추가적으로 말씀해주시면 감사하겠습니다"
