,subject,title,content
129,신입,신입 백엔드 개발자 풀스택 회사,안녕하세요 선배님들 현재 취업 준비생으로 회사 선택(?)과 관련된 질문을 드리고 싶습니다. 신입 개발자 연봉이 4000만원인 스타트업 회사입니다. 복지도 좋은 편에 속하구요 여기서 문제는 야근이 많으며 저는 백엔드를 깊게 하고 싶은데 입사하면 풀스택을 해야 하는 상황입니다. 커리어리의 비슷한 질문들도 읽어봤는데 사수가 있는 상황에서 경험하는 것도 괜찮다는 댓글들이 많았습니다. 연봉이 높기 때문에 야근과 풀스택을 감안하고 들어가는 것에 대해서 선배님들은 어떻게 생각하시는지 의견을 여쭙고 싶습니다. 읽어주셔서 감사합니다!!
130,신입,두 회사의 채용 과정 일정이 겹칠 때 어떻게 하면 좋을까요?,"안녕하세요. 저는 신입 프론트엔드 개발자 취준생입니다. 현재 상황을 말씀드리면 두 회사의 채용 진행 과정에 있습니다. A회사는 작은 규모의 스타트업이고, 최합 결과가 나온 상황입니다. B회사는 대기업이고 현재 서합 후 과제 전형 진행 대기 중입니다. 가능하다면 B회사를 더 선호하는 상황입니다. 하지만, B회사가 7일간 과제 전형 이후에 1차 2차 면접 과정도 있어서 채용까지 시간이 꽤 소요될 것으로 예상됩니다. 그리고 3년차 이상 상시공고였기 때문에 기준을 더 높게 보실지에 대한 두려움도 있어서 합격에 100%자신 있다 하는 정도가 아닙니다.. 이런 상황이 처음이라서 어떻게 대처를 할 수 있을지 조언을 얻고 싶습니다.. A회사를 포기하고 B회사 준비를 해야하는지, 위 상황에서 A회사를 포기했다가 B회사에 불합이 되는 상황이 제일 고려됩니다.. A회사와 조율이 가능하다면 어떤 식으로 조율을 하면 좋을지, 등등 현실적인 조언을 구하고자 질문 올립니다 감사합니다"
131,신입,백엔드 엔지니어와 데이터 엔지니어,"안녕하세요. 현재 데이터사이언스 전공 중인 4학년 학생입니다. 대학원에는 뜻이 없어 바로 취업을 하고 싶어서 직무를 찾아보는 중 데이터 엔지니어에 관심을 두게 되었습니다. 그런데, 데이터 엔지니어는 신입을 거의 뽑지 않아 백엔드에서 넘어가는 경우가 많다고 하더라구요! 4학년이지만 경영학과를 재학하다가 데이터학과로 편입을 했기 때문에 학교 수업 듣느라 지식이 많이 부족해서 백엔드를 하나 데이터엔지니어를 공부하나 어쨌든 공부할 것은 많다고 생각합니다. 방향을 확실하게 정해야 관련된 공부를 할 수 있을 것 같은데 어렵네요.. 자격증은 정보처리기사와 컴활1급 보유하고 있습니다. 1. 백엔드 엔지니어에서 경력을 쌓고 데이터 엔지니어로 직무 변경하는 것에 대한 의견 2. 데이터 엔지니어 신입으로 도전하는 것에 대한 의견 3. 백엔드를 하던 데이터를 하던 부트캠프 등의 과정을 밟아볼 생각인데, 학교와 병행은 힘들 것 같아 졸업 후에 할 생각입니다. 졸업 전에 따놓으면 좋을 자격증 있을까요?"
132,신입,백엔드 공부 계획 조언 부탁드립니다.,"안녕하세요, 27살 비전공 대학생입니다. 백엔드 공부 계획 조언 부탁드립니다! 지난 학기에 html, css, js를 스터디로 조금씩 배우다가 종강하자마자 1월에 JAVA 입문 교재 한권(Do it 교재)을 공부했습니다. 지금은 알고리즘 문제로 계속 JAVA 복습하면서 스프링부트 공부 (길벗- 자율학습 스프링부트3 교재) 공부하고 있습니다. ( https://www.yes24.com/Product/Goods/119952151 ) 곧 스프링 교재 끝나면 복습하면서 깃허브 교재를 공부할 생각입니다. 아직 게시판 하나 만들 수 있는 이론을 배운 정도이지만, 무작정 프로젝트부터 진행하면서 공부하고 싶어서 현재 자바, 스프링 프로젝트 스터디 하나 들어가 있고 아직 시작은 안했습니다. 2월에는 이렇게 시중 교재, 스터디 위주로 공부하려고 하는데, 3월~6월에 대학 수업 병행하면서 어떻게 공부해야할지 감이 잘안잡힙니다... 막학기지만 전공 5과목입니다... 포트폴리오에 넣을 만한 하나의 큰 프로젝트를 진행하면서 공부하고 싶은데 괜찮은 강의가 있는지, 아니면 얼른 취직을 하기 위해 돈이 들더라도 짧은 시간 안에 컴팩트하게 배우려면 부트캠프를 신청하는게 나은지 궁금합니다. 다음 3가지가 제가 생각한 공부 계획인데, 조언 부탁드립니다! 1) #학기 중 : 학회(하고 있는 컴퓨터학회 있음) 스터디 + 프로젝트 참여 #졸업 후 : 학회 프로젝트 포트폴리오로 바로 취준 / 포트폴리오 미흡하면 ssafy(1년) 비전공 지원(안되면 부트캠프(5개월) 지원) 2) #학기 중 : 정처기나 sqld 등 자격증 준비 + 동아리 말고 인터넷 강의로 포트폴리오 준비 -프로젝트 위주 강의(ex. 패스트 캠퍼스 - 10개 프로젝트로 시작하는 백엔드 웹발: 신입 개발자 취업 집중반 https://fastcampus.co.kr/dev_online_javaspring ) #졸업 후 : 인강 프로젝트 포트폴리오로 바로 취준 / 포트폴리오 미흡하면 ssafy(1년) 비전공 지원(안되면 부트캠프(5개월) 지원) 2) #학기 중 : 부트캠프(5개월) 병행해서 졸업 후 바로 취업 연계 받기 (시간표 때문에 대면 부트캠프는 안 될 가능성이 높음) 제가 교재 하나 정해서 공부하는 건 잘하는 편인데, 어떤 프로젝트를 해야 하는지, 나중에 더 좋은 기업으로 이직을 하기 위해서는 처음에 기업 지원해야 좋은지 등 취업 관련 정보가 전무하고 자소서와 면접 준비에도 도움이 필요하다고 생각해서 그런지 부트캠프에 의존하려는 경향이 있는 것 같습니다.. 저는 졸업하면 바로 포트폴리오 하나 달랑 들고 취준 찍먹이라도 해보고 싶은데 아직 공부도 많이 못한 상황에서 욕심일까요? 긴 글 읽어주셔서 감사하고, 추천하시는 계획, 조언이나 쓴 소리 많이 부탁드립니다."
133,신입,개발이 하고싶은 신입입니다,안녕하세요 한달차 신입입니다. 모집에도 백엔드 개발자로 되있어서 들어왔는데 업무 교육을 받다보니 개발이랑은 거리가 멀더라고요 유지보수인데 제대로된 인수인계 자료나 개발명세서 같은게 없어서 아무것도 할 수있는게 없습니다. 아니그냥 전달받은 자료가 없습니다 요구도했고요 아직 업무 전체를 파악한건 아니지만 사실상 운영입니다 사수도 없구요 연봉도 짜고 근데 사람은 좋은거같아요 그런데 전 개발이 하고싶습니다 고민은 더 늦기전에 다시 취업을 해야할지 아니면 버티다 개발팀가거나 이직을 해야할지 잘 모르겠습니다 솔직히 취업이 쉽다면 바로 떠났을텐데 여기도 겨우겨우 6개월 준비해서 들어온거라 쉽게 결정을 못내리겠네요 선배님들의 의견을 들어보고싶습니다
134,신입,풀스택?4년차 전향을 해야할지 아니면 백엔드로 그대로 가야할지 고민입니다,"안녕하세요 저는 이제 3년2개월이 된 풀스택 개발자입니다. spring도 하고, vue.js도 해서 풀스택이라고 적었습니다ㅜ 첫 개발회사에서 2년정도 근무하고 새로운 기술을 접하고 싶어서, 이직을 했다가 갑자기 저한테 웹하드를 개발하라고 하기도했고, 성인사이트 기획도 하면서 회사의 전반적인 사업 방향이 저와 너무나도 다르다고 생각하여 이직을 했습니다. 그리고 나서 지금 현 회사에 와서는 vue.js나 JPA 배워서 프로젝트 진행했었습니다. 그러고 일이 없어요... 간단한 기능 수정같은건 있는데 그 외에 없어요... 그래서 이직을 하려고했더니 아시잖아요 요즘 취업이 너무 추운거... 그래서 이직도 안되고 일도 없고 회사에서 공부만 하자니 백엔드 자체가 너무 싫어졌습니다. 그런 와중에 아는 지인이 프로젝트 진행하는데 좀 도와달라고해서 flutter를 접했습니다. 배우고 나니까 너무 재밌기도하고 이 프로젝트 끝난 다음에 앱개발로 전향한다면 도움이 되지않을까 싶더라구요 제가 애플을 좋아하기도해서 노트북,시계,핸드폰 다 애플이거든요. 그래서 iOS를 해야겠다! 싶었습니다. 근데 이쪽분야도 신입은 영 쉽지않더라구요... 결론은 기다리면서 java공부 더 해서 백엔드 갈지 아니면 iOS 부트캠프나 국비로 공부를 한 다음에 신입으로 전향을 할지 고민입니다. 참고로 제가 만29살인 여자이기도 해서 미래에 아기도 낳고 하면 백엔드보단 앱개발이 나을거같기도하고, 지금 회사에서 너무 스트레스를 많이 받아서 좀 쉬고싶기도 하구요(공부는 열심히 하겠지만요) 제 고민 어떻게 생각하시나요?"
135,신입,운영 업무를 맡게 된 신입인데 개발자로서 재능이 없는 건가 싶습니다,경기가 안 좋은 지금 신입으로 들어오게 되어서 감사하게 생각하고 있습니다. 그런데 고민이 많아서 다른 개발자분들의 의견을 듣고 싶어요. 저는 지금 입사한 지 4개월째입니다.. 포지션이 정해지고 제대로 된 업무를 시작한 건 두 달 정도 되었습니다. 일이 대부분 문의가 들어오면 어떻게 해서든 빠른 시간 안에 (대체로 하루 안에) 해결해서 답변을 준다 이런 식인데요. 뭐가 문제인지 빠르게 감을 잡아야 하고 거기에 맞게 증거를 찾아야 하는데 그게 어렵고 중간에 자꾸 뇌정지가 옵니다. 그리고 대충 방향은 맞게 잡는 경우에도 제가 모르는 영역이 너무 많아서 깊게 파고드는 데도 한계가 느껴집니다. 괴로워하다가 요즘은 대충 방향은 맞는 것 같은데 싶으면 그냥 제가 하고 나중에 혼나고 10분 안에 방향조차 각이 안 보이면 여기 저기 도움을 요청하고 있는데요. 이것도 자괴감이 들기는 마찬가지입니다. 평소에는 굉장히 여유롭습니다. 그래서 더 자괴감 드는 포인트기도 한데요.. 그러다가 갑자기 문의가 들어오고 몰아치면 너무 괴롭습니다. 개발자로서 문제 해결 능력이 없는 것인지 자괴감이 들고 자존감이 떨어지는 것을 느낍니다. 자존감이 떨어지니까 더 일이 안 되는 그런 악순환의 굴레가.. 지금 상황에 도움이 될 만한 조언을 받을 수 있으면 너무 감사할 것 같습니다.
136,신입,신입 임금 지불 지연 퇴사 고민,안녕하세요. 약 6개월 미만 재직 중인 신입입니다. 이번 달 급여가 약 3주뒤에 지급된다는 소식을 들어서요. 원래 월급날은 금주가 맞습니다... 이번 한 번 그런게 아니라 저번 4월에도 이미 임금이 3주정도 지연되고 지급된 적이 있어서 현재 퇴직을 하고 다시 구직을 해야하나 고민중입니다. 1년 버티고 이직할 생각이었는데 두번이나 밀리니 다음에도 안 밀린다는 보장이 없어졌습니다 1년 버티고 이직을 해야 하는지 아니면 당장 그만두고 이직을 준비하는게 맞는건지 고민입니다..!
137,신입,신입 백엔드 개발자 이력서 관련 질문,"백엔드 개발자로 근무하길 희망하는 취업준비생입니다! 이력서 작성에 왕도는 없겠지만, 선배님들이 어떻게 작성했는지 혹은 채용자 입장에서 괜찮은 이력서를 찾는 기준이 무엇인지를 많이 찾아보다보니까 오히려 머리가 복잡해지는 것 같아서 최대한 제 얘기를 담은 이력서를 작성하려고 노력중입니다. 다만, 제가 작성하는 방법이 채용자가 원하는 방법이 아닐 수 있기에 몇가지 질문과 가능하시다면 피드백 해주실 수 있는 선배님들이 계실까 해서 글 남겨봅니다. Q1. 이력서 내 프로젝트에서 기여 혹은 개선사항을 작성할 때 사용한 기술을 상세히 적으며 풀어나가는 것이 좋을까요 혹은 어떤 점을 어떻게 개선했는지 포괄적으로 작성하는게 좋을까요? ex) 사용자 인증 정보를 RedisTemplate의 opsForValue 메소드를 통해 캐싱하여 DB 호출 횟수 4회 -> 1회로 최적화 vs Redis를 활용한 사용자 인증 정보 캐싱으로 DB 호출 횟수 4회 -> 1회로 최적화 (적절한 예시일지 모르겠지만 생각나는대로 적어봤습니다,,ㅎ) Q2. 직무와 연관되지 않았지만 활용될만한 기술스택은 작성하는 것이 좋을까요 아니면 제외해도 괜찮을까요? ex)Scrapy, Selenium등의 크롤링 툴, 프론트엔드 기술 Q3. 이력서 외에 자기소개서 내용에서 기술적인 얘기를 많이 담는 것이 좋을지 항목에 맞는 에피소드로 자신을 드러내는 것이 좋을지 궁금합니다! (자기소개서를 읽는 채용자는 기술에 대해 자세히 모를 수 있다는 얘기도 들어봐서 고민되는 부분입니다. 1번 질문의 의도와 비슷한 내용일 것 같네요.) 이외에도 혹시 개인적으로 피드백 해주실 수 있는 분이 계시다면, 이력서 공유 해드리도록 하겠습니다! 요즘 힘든 시간을 보내고 있는데 도움 주실 수 있으시다면 정말 감사할 것 같습니다. 감사합니다!"
138,신입,신입 개발자 이력서 피드백 해주실 선배님 계실까요..? 8개월 간 입사지원을 했지만 계속해서 서류 불합격 통보를 받고 있습니다..,"안녕하세요. 신입 프론트엔드 개발자로 취업하기 위해 현재까지 약 8개월 동안 구직 활동을 하고 있는 이공계열 졸업한 취업준비생입니다. 현재까지 대기업, 중견기업, 중소기업 등 약 90곳에 공채와 수시 채용을 지원했는데, 기술면접 한 번, 서류 합격은 2번입니다. 코딩을 접했던 공학계열이지만 프론트엔드가 아니었기에 졸업 후 프론트엔드 교육과정을 수료했고, 더불어 개인/팀 프로젝트를 진행하면서 기술적인 부분에서 역량을 키우고자 지난 8개월간, 많이 부족하지만 노력하며 보완해 왔습니다. 동기에게도 이력서에 대한 피드백 받고, 많은 곳에 공개된 이력서 작성 팁에 따라 계속해서 이력서를 개선하고 있지만 계속된 서류 탈락에 '제대로 하고 있는게 맞을까?'라는 생각과 동시에 '앞으로 어떻게 진행해 나가야할지' 하루하루 불안감이 들고있습니다. 그래서 용기를 내어 여기 계시는 선배님들께 피드백을 요청드리고자 합니다. 만약 이력서를 보시고자 하는 선배님이 계시다면 이메일로 pdf 파일을 보내드리겠습니다. 피드백을 못 주시더라도 저의 긴 고민글을 시간 내어 읽어 주셔서 감사합니다. 좋은 저녁 보내세요 :)"
139,신입,네 달차 퇴사 고민 중입니다,"한 중소기업에 Spring과 React 풀스택 개발자로 입사하게 되어서 4달 째 다니고 있습니다. 중소 신입 치고 연봉이 꽤 높다는 점과 풀스택 경험을 쌓을 수 있다는 점이 매력적이라 입사를 결정하게 되었는데, 막상 다녀보니 회사의 개발 문화가 매우 좋지 않은 편이고... 다른 팀원 분들은 옛날 기술 스택을 쓰시는 분들이라 거의 혼자 공부하고 혼자 프로젝트를 하고 있습니다... 그래도 Spring을 그래도 재밌게 공부하면서 했는데 회사에서 spring을 이제 쓰지 않고 이전 스택으로 돌아가게 될 것 같아 퇴사를 고민하고 있습니다. 리액트는 계속 쓰게 될 것은 같은데 높으신 분이 리액트를 쓰는 걸 탐탁치 않아 하는 것 같습니다.. 이 부분도 그렇고 이 곳에 오래 다니다가 안 좋은 습관만 생기고 물경력이 될까 생각이 들어 퇴사하고 다시 공부하면서 취업 준비를 할까 고민중입니다.. 조언 부탁드립니다"
140,신입,신입 백엔드 개발자 이력서 질문 및 피드백 요청드립니다!,"백엔드 개발자로 근무하길 희망하는 취업준비생입니다! 이력서 작성에 왕도는 없겠지만, 선배님들이 어떻게 작성했는지 혹은 채용자 입장에서 괜찮은 이력서를 찾는 기준이 무엇인지를 많이 찾아보다보니까 오히려 머리가 복잡해지는 것 같아서 최대한 제 얘기를 담은 이력서를 작성하려고 노력중입니다. 다만, 제가 작성하는 방법이 채용자가 원하는 방법이 아닐 수 있기에 몇가지 질문과 가능하시다면 피드백 해주실 수 있는 선배님들이 계실까 해서 글 남겨봅니다. Q1. 이력서 내 프로젝트에서 기여 혹은 개선사항을 작성할 때 사용한 기술을 상세히 적으며 풀어나가는 것이 좋을까요 혹은 어떤 점을 어떻게 개선했는지 포괄적으로 작성하는게 좋을까요? ex) 사용자 인증 정보를 RedisTemplate의 opsForValue 메소드를 통해 캐싱하여 DB 호출 횟수 4회 -> 1회로 최적화 vs Redis를 활용한 사용자 인증 정보 캐싱으로 DB 호출 횟수 4회 -> 1회로 최적화 (적절한 예시일지 모르겠지만 생각나는대로 적어봤습니다,,ㅎ) Q2. 직무와 연관되지 않았지만 활용될만한 기술스택은 작성하는 것이 좋을까요 아니면 제외해도 괜찮을까요? ex)Scrapy, Selenium등의 크롤링 툴, 프론트엔드 기술 Q3. 이력서 외에 자기소개서 내용에서 기술적인 얘기를 많이 담는 것이 좋을지 항목에 맞는 에피소드로 자신을 드러내는 것이 좋을지 궁금합니다! (자기소개서를 읽는 채용자는 기술에 대해 자세히 모를 수 있다는 얘기도 들어봐서 고민되는 부분입니다. 1번 질문의 의도와 비슷한 내용일 것 같네요.) 이외에도 혹시 개인적으로 피드백 해주실 수 있는 분이 계시다면, 이력서 공유 해드리도록 하겠습니다! 요즘 힘든 시간을 보내고 있는데 도움 주실 수 있으시다면 정말 감사할 것 같습니다. https://drive.google.com/file/d/1LFqNNNQ3skF26xInwbYzxjZOGIlzE0lQ/view?usp=drive_link 링크 첨부를 했는데 반영이 안돼서 다시 질문 드립니다..! 감사합니다!"
141,신입,"시스템프로그래밍, 네트워크 엔지니어 신입 현직자입니다.","웹개발에 몰두하다가 올해 초에 얼떨결에 시스템프로그래밍, 네트워크엔지니어링 하는 업무로 취업이 되어서 직장생활중인 신입 개발자입니다. 해당 관련된 지식이 거의 없었어서 처음부터 지금까지 배워오며 어찌어찌 잘 다니고 있지만, 생각해보면 지금까지 쌓은 경력이랄것도 없는 것 같아 물경력이 될 것 같아서 조언을 구하고자 질문 드립니다. 현재까지 했던, 하고 있는 업무로는 리눅스 시스템을 활용한 쉘 스트립트를 작성하여 프로그램 자동화, 프레임워크(파이썬)를 이용한 테스트 자동화, C코드로 된 네트워크 관리 프로그램 분석 및 회사에서 원하는대로 코드 수정, gitea서버 구축하여 회사 코드 관리, 포트포워딩과 같은 네트워크 관리 등등 있습니다. 걱정인 점은 현재 몇 달 째 코드만 보고, 테스트만 하자니 제가 개발자인지, 단순 테스터인지 점차 물경력이 되어가고 있는것 같다는 점입니다. 따로 공부를 하고 프로젝트를 할까 하는데 관련해서 어떤 프로젝트를 하면 좋은지, 어떤 공부를 하면 좋을지 조언을 구해보고 싶습니다. 생각해본 것으로는 리눅스 시스템 관리 프로그램 제작이라든지, 로그 분석 프로그램 제작, 혹은 도커와 같은 클라우드 기술을 배워볼까 했습니다."
142,신입,중견급 경력 이직 질문,"3년정도 스타트업에서 백엔드로 근무한 20대 초반입니다. 전에 근무하며 전문대를 병행했고 지금은 4년제를 편입해서 다니고 있는 상황입니다. 내년 취업계를 내고 중견급 회사에 경력 이직을 하려고 하는데 궁금한 부분이 있어 글을 작성해봅니다. 1. (자격증) 정보처리기사, sqld 취득이 신입이 아닌 경력 이직에 도움이 되는지 궁금합니다. 2. (면접) 경력 이직 면접에서 주로 경력기술서를 보는지 개인 포폴을 보는지 궁금합니다. 3. (면접) 경력 이직 면접에서 어느 수준의 CS 지식, 사용 중인 프레임웍 이해도를 바라는지 궁금합니다. 이직 경험이 없어 준비에 확신이 없는 상태입니다.. 답변해주시면 감사하겠습니다!"
143,신입,Flutter 9개월차 신입 이직?,"지금 회사에는 그냥 정말 우연히 들어오게 되었습니다.. 정말 작은 스타트업회사입니다 정말 이제 시작하는 스타트업이요.. 학교 다닐 때 리액트 찔끔 장고 찔끔 이런식으로 맛보기만 해보면서 시간이 흘러버린 상태로 여기까지 오게 되었는데요.. 이 회사 그리 오래다니지 못할 것 같습니다.. 그래서 이직을 하려고 찾아보는데 제가 너무 부족해서 어디 이력서를 내기도 부끄러울정도 입니다. cs지식도 없고, 코딩테스트 문제를 풀어본적도, 성공적인 프로젝트를 한 적도 없습니다. 이런 상황에서 바로 이직은 불가능하다는 생각이 들었고, 싸피같은 부트캠프에 도전해볼까합니다. 이게 괜찮은 선택일지도, 부트캠프에 합격을 할지도, 프론트를 할지 백엔드를 할지도 모르겠습니다. 퇴사를 하고 혼자 플러터+nodejs로 프로젝트+cs공부+백준 고민이 되기도 하는데요.. 너무 두서없이 작성한 것 같은데 1년차 신입이 부트캠프에 도전하는게 좋을지 혼자 공부 후 재취업이 고민입니다."
144,신입,신입 백엔드 개발자인데 진로에 대해 고민이 있습니다.,"안녕하세요. 저는 신입 비전공자 Java 백엔드 개발자입니다. 요 근래 계속 취업준비를 하다가 운좋게 한곳에 붙게되었습니다. 제가 최종적으로 하고싶은 업무는 자체 서비스를 가진 회사의 Java 와 Spring 생태계의 백엔드 개발자 입니다. 하지만 현재 붙은 회사는 Java 를 사용한 자체 솔루션 회사입니다. 그렇다보니 혹여나 지금 회사에서 3~5 년정도 경력을 쌓고 이직을 하려고 할 경우 서비스 기업을 갈때 물경력으로 인정되지는 않을까 고민이 됩니다. 물론 개인에 따라 퇴근후 공부한다든지의 노력으로 충분히 이직도 할 수는 있겠지만, 경력만 봤을때 혹시 솔루션 회사에서 서비스 기업으로 이직할때 경력이 걸림돌이 되지는 않을까요?"
145,신입,첫 직장의 중요성 및 연봉,"안녕하세요, 24년 2월에 컴공 졸업했습니다. AI 엔지니어로 대기업에서 인턴을 한 경험을 살리기 위해 인공지능 분야로 취준을 하다 데이터 엔지니어링에 관심이 생겨 부트캠프를 듣고 있습니다 . 부트캠프를 들으면서 현재도 여러 회사에 지원 중인 상황입니다. 면접도 여러군데 봤고 합격한 곳도 여러 군데 있었지만, 그 당시에 제가 하고 싶은 AI나 데이터 관련 직무가 아니라 거절을 했습니다. 하지만, 요즘 여러가지 생각이 듭니다. 전공생인데 취업 안하고 부트캠프 끝나면 11,12 월인데 이래도 되나? 부트캠프 들어서 원하는 데이터 엔지니어로써 중견, 대기업에 바로 들어갈 수 있을까? 전공생인데 부트캠프 듣는 것에서 오는 현타, 그리고 취업 시장이 안좋은 만큼 경력을 6개월~1년 쌓아서 중고신입으로 지원하는 것이 더 낫나? 등등 데이터에 관심이 있어 부트캠프를 듣고 있지만, c++에 흥미가 있고 제어에도 관심이 있다보니 제어 관련 중소에서 제안한 포지션 면접을 봤습니다. 위에서 말한 여러 생각들에 의해 그냥 중소에 들어갈까 고민이 됩니다. 근데 막상 합격한 중소에 들어가자니 연봉이 낮아 문제입니다. 개발자는 첫 직장, 연봉이 중요하다 들었는데 중소에 연봉이 식비 포함 3천 중반입니다. 합격했지만 거절했던 회사들은 연봉이 한 곳이 3천 후반 나머지가 4천 중 후반이였는데, 이러면 관심있는 직무만으로 이 회사에 들어가는 것에 현타? 비슷하게 옵니다. 데이터 엔지니어링에 관심이 있어 합격했던 회사들을 포기한 만큼 부트캠프에서 열심히 준비하고 취업하는 것이 좋을까요? 아니면 지금이라도 경력을 쌓으며 중고 신입을 준비하는 것이 좋을까요? 물론 사람마다 생각하는 방식이 달라 정해진 답변이 없다는 것을 알고 있습니다. 하지만, 결정하는데 조금이라도 도움이 된다고 생각합니다... 선배님들의 의견 부탁드립니다."
