,subject,title,content
72,신입,신입 개발자 첫연봉 고민입니다!,"안녕하세요 전문대학교 컴퓨터공학과 나와서 전공심화를 진행중인 학생입니다! 현재 이 문제로 고민이 많아 짧지 않은 글이지만 꼭 읽어봐주시고 답변해주시면 감사하겠습니다! 교수님 추천으로 이번 방학 인턴 근무를 시작하게 되는데 말이 인턴이지 취업의 연장선으로 소개 시켜주시는 것 입니다. 흔히 조기취업 이라 불리죠 저는 전공심화 졸업예정자 즉, 학사 학위를 갖고 취업을 하는것 이고 소개 시켜주신다는 회사는 학사 학위 기준 앱개발자로 소개 시켜주신다고 하셨고 채용분야는 si사업부에 연봉 3000~3100 으로 시작하는 것을 확인했고 찾아보니 비전공자들도 부트캠프나 학원 등 3000시작하는 경우가 많다 하더라구요.. 비전공자를 비하하려는건 아니지만 저는 전공자이고 전공심화를 통해 1년을 더 공부하여 총4년을 공부함에도 불구하고 비슷한 연봉으로 시작하면 아쉬울 것 같아서요.. 아무래도 개발자는 첫 연봉이 중요하다 들어서 고민이 많이 생깁니다😢 검색을 했을때 저와 비슷한 경우의 고민도 없어서 이 연봉이 높은지 낮은지 기준점을 잘 몰라서 여쭤봅니다! 개발자 첫 연봉 3000! 어떻게 생각하시나요?! 글 쓰는 솜씨가 부족해 제가 하고자 하는 말이 잘 전달이 되지 않았을 수도 있습니다만 질문 있으시면 편하게 물어봐 주시고 좋게 읽어주시면 감사하겠습니다☺️ 좋은 하루 되세요!"
73,신입,신입 개발자를 뽑을 때 중요하게 보는 것은 무엇인가요?,안녕하세요. 저는 현재 개발자 취업을 준비하고 있는 평범한 취준생 입니다. 신입 개발자를 뽑을 때 중요하게 보는 것은 무엇일지 궁금해서 실제 현직자 분들의 생각이 궁금해서 현직자 Q&A로 질문 드려 봅니다! 다들 신입 개발자를 뽑는다면 무엇을 중요하게 보시나요?
74,신입,신입 개발자 취준 고민이 있습니다,"안녕하세요 신입 개발자로 취업을 하고싶은 준비생입니다. 부트캠프 수료한 지가 곧 있으면 1년이 다 되어가서 얼른 취업을 해야하지만 서류에서 광탈을 하는 상황입니다. 혼자서 생각하기에는 좀 고민되는게 있어서 경험이 많으신 분들에게 질문을 드리고 싶어서 글을 작성하게 되었습니다. 기존 포트폴리오는 자바스크립트,리액트 nodejs을 사용한 프론트, 백엔드를 둘다 다룬 프로젝트로 팀플 1개개인 프로젝트가 1개가 있고 구직기간 중 학습한 것을 바탕으로 만든 플러터 앱 프로젝트로 총3개가 있습니다. 취업을 위해 기존 프로젝트를 보완하거나 기존 스택을 이용하고 좀더 발전된 코드로 새로운 프로젝트를 추가하는 노력을 하는게 나을까요? (예를 들어서 상태관리 폴더 구조 관심사 분리 데이터베이스 설계 등을 기존 프로젝트보다 레벨업해서 새로 프로젝트 만들기) 아니면 취업을 위해 다시 한번 6개월 정도의 부트캠프를 다니는 것은 좋은 선택이 아닌걸까요? 찾아본 부트캠프로는 자바 풀스택 부트캠프 (지금까지 자바스크립트 기반으로 공부를 했기 때문에 자바까지 공부하게되면 이도저도 아닌 것 같이 보일까 걱정이긴하지만, 수료 후 취업 할 수 있는 기업수가 많아질 수 있어 좋겠다고 생각했고) 혹은 플러터 부트캠프가 있습니다. (기존 포트폴리오에 플러터 프로젝트가 하나 있어서 이와 연계해서 좀더 딥다이브하기 위해 플러터 부트캠프를 다니려고 했습니다"
75,신입,신입 웹 개발자가 취업하기위해서 무엇을 준비해야하나요,안녕하세요 웹개발자로 취업을 희망하는 27살(남) 입니다 지방국립대 정보통신공학과로 졸업하였고 4학년 2학기때 늦은 입대로 관련지식은 거의 사라진상태에 어찌저찌 정보처리기사 자격증은 취득하였습니다 졸업 후 국비교육을 통해 빅데이터기반웹 양성과정을 수료하고 급전이 필요했던 개인사정으로 당시 지인추천으로 전공과 관련없는 계약직으로 배관설치 현장사무직으로 1년간 일을 하다 계약이 종료되고 또 다시 백지 상태가 되어 웹개발자로 취업을 희망하고있습니다 개발자가 되기위해선 개발블로그나 깃허브관리가 필수라 하기에 시작한지 이제 한달정도가 다되어가네요 예전에 국비를 통해 배웠던 jsp게시판만들기나 spring게시판만들기를 위주로 다시 복습하면서 개발블로그와 깃허브에 올렸습니다 하지만 요즘 it쪽 취업시장이 좋지않다고 하더군요... 학점은 3.0으로 솔직히 학창시절에 조금 놀았습니다 과거 학창시절에 졸업프로젝트로 라즈베리파이를 이용한 ai 얼굴인식 딥러닝 프로젝트 말고는 적을 프로젝트가 아무것도 없더군요 회사는 학원처럼 배우는곳이 아니기에 1인분은 하는 신입 웹 개발자를 구한다고 알고있습니다. 웹서핑을 통해 정보를 구하려고 하면 죄다 코딩학원광고?글 같은것뿐이고 딱히 도움되는 글은 없었던것 같습니다 정보가 부족하다보니 어떤것을 해야하는지 참 막막합니다.... 제가 생각하기엔 프로젝트나 수상경험이 없는것이라고 생각하는데 어떤 프로젝트를 추천하시는지 또 부족한점이 있다면 말씀해주시면 감사하겠습니다
76,신입,진짜 물경력이 되어버렸습니다.최근 1년간 성과를 내세울 게 없습니다,"저는 회사에 입사한지 5년차인 학사학위 비전ai 응용개발자입니다. 회사가 늘 과제 위주로 업무가 진행되며 보고서를 채우기 위한 결과 작성만 하거나 과제 지원서에 쓸 내용만 채우다 경력이 지지부진한 상태에 빠졌고, 저는 건강이 요 몇년간 좋지 않아 회사에서 주어진 일만 하고 아무것도 하지 못했습니다. 최근에서야 좀 건강이 정상 궤도에 가까워지고 있는데, 그 사이 세상은 여러가지로 많은 변화가 있었습니다. CNN에서 LLM으로, 한 태스크를 수행하는 모델에서 멀티모달로.. 저는 그 사이 어떤 지식도 채우지 못하고 오히려 증발하기만 했죠. 채용시장은 어려워지고.. 회사는 살아남기 위해 로봇 산업에 끼기를 추구하려 해서 개발자에서 점점 멀어지는 것 같아 두렵습니다. 베이스를 채우려고 이제 정신차리고 선형대수학과 확률론을 살펴봐도 어렵기만 합니다. 웹 관련으로는 한 번도 개발이나 배포를 해 본적도 없고, 기술스택도 사실상 순수 파이썬에 가깝습니다.. 누구를 탓할수도 없고 탓해봤자 아무 일도 일어나지 않는다는 걸 알기에 신세한탄을 하며 뭘 어떻게 해야할 지 모르겠습니다. 이직은 하고 싶고 여태 해온 일들이 다른 회사에서 보기엔 성과로 비춰지지 않을 것 같고.. 앞으로 회사에서 진행될 일들도 이력서에 적을만한 내용이 없는 일들 투성이입니다. 위축만 되어 있습니다. 이젠 제가 하고 싶은게 뭔지도 모르게 되어버렸습니다. 지금이라도 웹을 따로 공부해서 연봉이 800이 적어지더라도 신입 웹개발자로 들어가는 게 나을까요?"
77,신입,기획 신입 연봉 어느정도인가요?,중고신입으로 큰 규모의 스타트업이나 대기업 신입에 도전하는 중입니다. 그러다가 대기업 그룹사 내 한 회사의 최종 합격을 기다리고 있는데요. 최종 면접에서 연봉과 관련한 얘기들을 잠깐 했었는데 희망 연봉을 물어보시더라구요 정보가 잘 없어서 기존에 받던 연봉의+1000을 붙여서 얘기하긴 했는데 어느 정도로 제안 해야 할지 궁금해요.. 대부분 맞춰 주나요?
78,신입,신입 첫 직장 중요성,"안녕하세요, 올해 2월에 졸업한 컴공생입니다. AI 분야로 취준을 하고 있었고 요즘은 데이터 엔지니어링을 통해 데이터 경험을 쌓고 데이터 사이언스로 넘어가고 싶다는 생각을 했습니다. 그러다보니 중소, 중견에서 면접 제안 또는 서류 통과 됐을 때 면접 경험 쌓기 위해 면접을 진행했습니다. 합격해도 위의 분야와 달라 거절을 했습니다.. 하지만, 요즘 취업 시장도 점점 안좋아지고 원하는 분야로는 대기업 합격에 실패하다보니 멘탈이 점점 흔들리고 있는 상황입니다. 이런 상황에 분야가 다른 중소 면접에서 합격했다고 연락이 왔습니다. 그냥 일단 회사에 들어가고 신입 지원을 하는 것이 좋을까요? 아니면 이대로 계속 지원을 하는 것이 좋을까요? 합격한 중소는 분야도 다르고, 리눅스 사용하며 회사에 대해 검색했을 때 신기하게 깃을 사용 안한다고 합니다. 깃 사용 안하는 부분에서 그냥 안들어가는 것이 좋을까요? 요즘 진로에 대한 고민이 많아 생각이 복잡하다보니 글을 잘 작성하지 못해 죄송합니다. 이렇게 분야가 다릉 중소에 들어갈거면 차라리 분야가 달라도 합격했던 중견에 들어가는 것이 나았을테고... 힘듭니다.."
79,신입,신입개발자인데 회사,"입사한지 9일된 신입 응애개발자인데 회사 들어와보니까 제가 혼자 했던 포트폴리오용 개인프로젝트보다 훨씬 양이 방대하더군요.. 중소기업이라 그런지 개발자가 몇 없습니다. 웹 개발자는 이번에 들어온 저 혼자이고 c# 개발자(IoT) 두명 있습니다. MES 사업 프로젝트 들어갈 때 한명이서 웹 개발을 다 해야 한다더군요ㅠㅠ (하다가 안되는 일 발생하면 아는 거래처의 개발자한테 물어보는 식으로 처리한다고는 함,,,,,) 퇴사하기 전 사람 프로젝트 봤는데 테이블 85개(혼자 다 짬)에 MES 웹 개발을 엄청 잘하셨더군요..(제 기준) 아직 신입이라 모든게 다 어색하고 이해하기가 힘든데 어떡하죠..🥲 저 잘할 수 있겠죠..?"
80,신입,IT 연합 동아리 활동에 대한 고민이 있습니다.,"저는 개발자이고 신입 취업을 준비한지 2년이 넘은 상황입니다. 인맥은 없고 취업 준비 기간은 길어지고 나이는 계속 들고 서류 지원하다가 겨우 통과해서 본 면접에서는 결국에 떨어져서 좌절하고 취업 준비에 지치다보니, 네트워킹을 간절히 바라는 생각에서 IT 연합 동아리에서 활동하는 것을 생각해봤습니다. 현직자들을 만나고 여러 활동을 바탕으로 네트워킹을 하면서 친해지고 면접에 대한 팁을 얻는 것을 기대해보는 것입니다. 현재 저는 포트폴리오에서 팀 프로젝트 2개, 개인 프로젝트는 3개 이상이 있습니다. 그래서 프로젝트를 이 이상 하는게 불필요하다는 생각을 했습니다. 지금 필요한 것은 저를 어떻게 면접에서 잘 어필할 수 있을지에 대한 것이라고 생각했습니다. 물론 IT 연합 동아리에서 활동하게 된다면 팀 프로젝트가 주가 되어야 한다는 것을 알기 때문에 팀원들에게 피해가 가지 않도록 프로젝트를 소홀히 하지는 않을 것입니다. 단지 동아리에서 서로 피드백을 주고받으면서 성장하는 것을 기대하는데, 특히 면접을 잘 보기 위한 팁을 얻으면 좋겠다는 바람이 있습니다. 프로젝트 + 네트워킹을 하는 동아리를 보면 한 기수 활동 기간이 4개월 ~ 10개월인데, 활동 기간이 길고 네트워킹이 많은 동아리일수록 꼭 활동해보고 싶어지네요. 동아리 활동이 면접 실력을 늘리는 데 도움이 되었는지 동아리 활동을 해보신 분들께 질문 드리고 싶습니다. 케바케일 거라는 것을 알지만, 활동해보신 분들 한 분 한 분의 진솔한 얘기를 들어보고 싶습니다."
81,신입,신입개발자 적성문제,입사한지 한달 조금 넘은 신입입니다 일하는 곳의 개발팀은 작은 개발팀이지만 회사가 시리즈 b를 향하고 있어서 해야할 ㅇ일이 많아요 여태는 자잘한 업무들을 주로 했는데 다음달부턴 아마 코드 갈아엎는 수준으로 굵직굵직한 업무들을 혼자 하게 될거 같아요 매일매일 회사 출근이 두렵고 데일리 스크럼마다 온몸에 땀이 흐르고 제 능력을 초과하는 업무를 받을때마다 가슴이 답답하고 매일 배아파서 장염에 죽먹고 다니고 퇴근을 해도 어차피 업무 기한이 있으니 집에서도 해야하니까 기쁘지도 않고 연차 쓰고 싶어도 업무기한이 있으니 그시간에도 코딩해야할게 뻔해서 걍 안쓰고 있어요 주말도 어차피 업무 공부+기본기 공부 해야하니까 딱히 주말이 기다려지지도 않고 매주 일요일 밤이면 오늘 세상이 멸망했으면 좋겠다는 생각이 듭니다 오늘은 출근길에 9급공무원 준비기간 머 이런거 검색하며 왔네요 제가 적성이 안맞아서 그런건지 아니면 그냥 다 그런건데 그냥 하는건지 아니면 제가 엄살쟁이에 정신상태가 썩어빠진건지 모르겠어요
82,신입,신입에게 책임을 묻는 회사,"안녕하세요. 서버 개발하는 신입 5개월차 입니다. 제가 입시한지 1개월만에 백엔드 개발자 다 퇴사하고, 저는 최소 1년은 있어야 이직할 수 있다는 생각에 남아있습니다 그러다보니 간단한 api부터 결제로직까지 다루고 있습니다. 결제로직은 퇴사하셨던 분이 작업한 부분에서 건드린적이 없는데, 최근에 문제가 생겨 문제찾아가며 거래내역 비교하며 겨우 대응했습니다. 다음날 회의에서 이런 문제가 벌어지면 당신이 (제가)책임져야한다. 라는 말을 들으니 (코드리뷰 매일 하고 팀원들 approve 받아야 merge합니다) 제가 어떡해 받아들여야할지 모르겠습니다 코드 건드리는게 무섭고, 다음에 발생하면 진짜 내가 책임져야하나 싶고….. 지금은 빨리 이직하고 싶은 생각만 있네요.ㅠㅠㅠ 조언주시면 감시하겠습니다"
83,신입,신입 프론트엔드 개발자에게 블로그는 너무 뻔한 포폴 주제인가요?,"안녕하세요 궁금한 것이 있어서 질문을 올려봅니다. 신입 프론트엔드 개발자로 취업하기 위해 공부중인 대학생입니다. 다름이 아니라 여러 블로그 플랫폼(티스토리,벨로그 등..)을 쓰다 저만의 블로그를 만들고 싶어 혼자서 뚝딱거려서 만든 블로그를 개발했는데요.!.! 하나부터 열까지 다 제가 직접 만든거다보니,,,애착이 가고 더 발전시키고 싶고,,그렇더라구요.! 근데 이제 프론트 신입이 블로그를 이력서에 녹이는 게 별로라는 의견도 많아서,, 여러분들은 어떻게 생각하시는지..궁금합니다!"
84,신입,코딩을 하지 않는 회사에 개발자로 일하고 있습니다.,"부트캠프 비전공자 신입 개발자입니다. 현재 수습기간으로 회사를 다니고 있습니다. 저는 우선 백엔드, 프론트엔드를 가리지 않습니다. 또한 기술도 가리지 않습니다. 다만 IT 업계에서 레거시를 개선해온 데에는 이유가 있다고 생각하고 있는 편이며, 특히 AOP 등의 개념에 공감을 하고 있습니다. 자동화 할 수 있는 것은 자동화 하고 개발자는 코드의 고도화 또는 성능 개선에 힘써야 한다고 생각하며, 동시에 ""개발자라면 스스로를 코딩하는 사람으로 정의하지 않아야 한다""는 말에도 깊은 공감을 가지고 있습니다. 저희 회사는 15인 미만의 인원으로 운영되고 있습니다. 이 중 절반 이상이 임원으로 구성되어 있으며, 중간 관리자 직책은 없습니다. 다양한 서비스를 동시에 운영하고 있는데, 각 서비스의 언어와 기술 스택이 모두 다르고, 내부에 각 서비스의 기술 스택을 정확하게 알고 있는 사람이 없습니다. 저는 JPA를 배웠는데 해당 기술을 쓰는 서비스는 없습니다. 모두 SI에 개발을 의뢰했다가 내부 개발자의 필요성을 느낀 후 내부로 끌고 오는 중입니다. 서비스 중에는 레거시한 시스템으로 구성된 것도 있습니다. 프론트와 백엔드의 영역이 나뉘지 않고, 형상관리나 버전관리가 없으며, 옛날 방식의 CMS를 그대로 쓰는 것도 있습니다. 문제는 내부에 개발을 경험했다 하시는 임원 분들이 개발에 손을 놓은지 너무 오래되셨는지 ""프론트엔드=퍼블리셔, 백엔드=기능개발""로 생각하고 계신다는 것입니다. 서비스 중 하나는 형상관리와 버전관리 전략을 신입 개발자들끼리 도입했으며, 그럼에도 불구하고 CI/CD, 기초적인 개발 환경 가이드 등(기술 스택이나 버전, env예시) 해결해야 할 부분이 많고, 그 누구도 이것을 교육하거나 키워드를 주는 것 조차 해줄 수 있는 사람이 없습니다. 오로지 비전공자 신입 몇 명 뿐입니다. 그렇기에 프론트엔드와 백엔드를 나눠서 채용을 했음에도 불구하고, 개발 측면에서 두 포지션을 구분하지 않고 잡히는 대로 일을 주고 있으며, ""개발은 단순하게 동작만 되면 된다. 레거시한 기술을 바꾸고 싶거나 고도화 시키고 싶으면 나를 설득시켜라""는 말을 하기도 합니다. 프론트엔드에게 UX/UI 등의 작업을 맡기며(내부에 디자이너가 있습니다.) 또한 개발자는 기획을 이해하고 있어야 한다는 이유로 기획을 함께 해야 한다고 사업화 아이디어 강요하고, SI식의 산출물을 요구합니다. 그러나 산출물에 대한 가이드는 없고 키워드만 던져주며 서칭을 통해 어떻게든 만들어가면 원하는 방향이 아니라며 이 시간 동안 이걸 한거냐는 지적을 합니다. 가이드를 요구하면 ""틀을 주면 거기에 갇힌다는 이유""로 직접적인 가이드를 주지 않습니다. 회사에선 신입에게 이런 경험을 제공하는 회사는 없으며 그렇기에 고마워 해야 한다는 말을 합니다. 프론트엔드는 퍼블리셔와 구분점이 없기에 밥그릇 뺏기기 싫다면 기획과 UX/UI를 이해해야 하고, DB도 볼 수 있어야 한다고 말합니다. 기획을 모르는 개발자는 성공할 수 없으며 인정하지 않는다고도 말합니다. 물론 이런 말이 전부 틀렸다고 생각하지는 않습니다. 그러나 저는 걱정이 됩니다. 하나의 언어도 제대로 구사하지 못하는 제가 최소 3개 이상의 다른 언어와 기술 스택으로 이루어진 여러 서비스를 동시에 다루는 것이 맞는건지, 환경 설정을 하기 위한 기본적인 정보(프레임워크 버전)도 알려주지 못하는 회사에서 혼자서 광범위한 정보를 찾으며 개발을 하려는게 자의식 과잉은 아닌지, 한 번도 사용해본적 없는 프레임워크를 다루기에 앞서 업무를 하기 위한 최소한의 공부도 ""회사는 학교가 아니기에"" 업무시간 외에 하는 것이 일반적인 개발 회사의 방향이 맞는지 아직은 모르겠습니다. chatGPT가 나왔기에, IDE가 나왔기에 요즘의 개발은 너무 쉬워졌다고. 그렇기에 개발자는 기획을 해야 한다는 말이나, 개발은 계속해서 외주 업체에 맡길거니까 너희의 역할은 외주 개발사를 컨트롤 하고 개발 기획을 정의하는 것이라는 말을 들을 때마다 저는 회사가 저에게 요구하는 역할이 개발자인지 PM인지 헷갈리곤 합니다. 비전공자인 제가 코딩을 시작한 이유는 코딩이 '객관적'이라고 생각하기 때문입니다. 컴퓨터는 거짓말을 하지 않기 때문에, 저는 코딩에 정답은 없을지라도 답은 명확하게 있다는 말에 공감합니다. 그런데 회사가 저에게 요구하는 일은 어떤 의미에선 너무 주관적인 영역으로 느껴집니다. 피드백을 받고 개선해도, 다른 사람에겐 개선하기 전 상황이 더 낫다는 말을 듣거나, 아예 개선 방향을 다르게 말하기도 합니다. 어떻게 하든 결국 빈틈은 보이고, 꼬투리는 잡힙니다. 단어 하나를 집요하게 물고 늘어지며, ""이 단어는 보통 이런 의미로 쓴다."", ""너는 지금 단어를 잘못 썼다."", ""이 단어 함부로 쓰지마라"" 등의 말을 하고 그 다음번엔 사용하지 말라하던 그 단어를 언급하며 ""이때는 이 단어를 써야 하는 것 아니냐.""는 말을 하곤 합니다. 사실 저는 개발을 배우기 전에 디자인과 기획, 컨텐츠 생산 등에 관심을 가지고 있었고 관련 공부나 일을 하기도 했습니다. 해당 경험에서 주관적인 업무에 회의감을 느껴 개발을 시작했습니다. 처음엔 회사의 방향이 마음에 들었습니다. 제가 해왔던 공부가 쓸모 없는게 아니었다는 위로를 해주는 것 같기도 했습니다. '서비스를 이해하는 개발자', '기획자와 소통하는 개발자'라는 타이틀을 꿈꾸기도 했습니다. 하지만 저는 주객전도를 원하지는 않습니다. 그래도 저는 개발자로서 스스로를 코딩하는 사람으로 정의하지 않는다고 해도 스스로 코딩을 못하는 사람이 되고 싶지는 않습니다. 저는 코딩하는 일이 즐겁고, 목표를 이루었을 때 느끼는 성취감을 계속해서 느끼고 싶습니다. 제게 이 회사가 너무 과분한 걸까요? 제 역량에는 회사의 요구가 그렇게 느껴집니다. 이대로는 개발자로 성장하지 못할 것 같고, 심지어는 개발이나 기획이 싫어질 것 같기도 합니다. 인격적으로 좋아 보여서 입사의 이유가 되었던 임원분도 더 이상 좋은 분으로 느껴지지 않습니다. 그분의 말도 이제는 가스라이팅으로 여겨집니다. 제게 이 회사가 너무 과분한 걸까요? 저는 내일부터 업무시간 외에 야근을 하지 않으려 합니다. 1시간, 가끔은 2시간씩 일찍 가던 회사에서 더는 업무를 일찍 시작하지는 않으려 합니다. 대신에 그때 개인 공부를 하고자 합니다. 회사에서 배울 수 없고, 회사에서 사용할 수도 없는 것들에 대한 공부를 하고자 합니다. 비슷한 상황을 겪어보신 분이 계실까요? 방향을 어떻게 잡으셨는지 궁금합니다."
85,신입,신입 PM 취업 전략이 궁금합니다!,"신입 PM을 안뽑는다고 하지만.. 그래도 그 와중에 신입으로 채용되시는 분들도 있는데 혹시 어떤 루트로 많이들 취업하시는지 궁금합니다! PM이라는 목표를 가지게 된 것은 1달 정도 되었고, 부트캠프를 수강중인데 가능하다면 수료 전에 취뽀해버리고 싶어요...! 꼭 PM으로 바로 취업이 되지 않더라도 다른 루트로 어떻게들 많이 가시나요?"
86,신입,3년차 프론트엔드 포트폴리오,"2022년 4월에 커리어를 시작한 프론트엔드 개발자입니다 개발경력은 아직 만으로 2년이 조금 안 되었구요 (이 경우에 3년차라고 말하는게 맞는건가요..?) 신입 이후에 제 이력서와 포트폴리오를 업데이트하지 않아서 아주아주 늦은 신년계획으로 해보려고 하는데요 만약 이직한다면, 같은 프론트엔드 직무로 이직하려고 하는데요 경력직들은 포트폴리오를 굳이 하지 않아도 된다는 의견이 있어서 질문해봅니다 신입때는 포트폴리오를 꼭 준비하라고 하던데, 경력직들은 포트폴리오 굳이 하지 않나요..? 경력기술서만 준비하면 될까요?"
87,신입,부트캠프 수료까지 3주.. 현업 선배님들의 취업 조언이 필요합니다,"현재 부트캠프 프론트엔드 과정을 듣는 코린이입니다 개발을 시작하기 전 영상제작 / 디자인 업계에서 3년정도 일을 했었어서 자연스럽게 프론트엔드를 선택하게 되었고 현재 부트캠프 마지막 프로젝트를 마무리 하는 과정에 있습니다. . 이제 취업이 점점 현실로 다가오면서 걱정이 많이 생겨서 몇 가지 궁금했던 내용들을 질문으로 남겨 봅니다..! 현업 선배님들의 현실 꿀팁 부탁드립니다! 1. 신입 프론트엔드 개발자로 취업할 때, 부트캠프 출신이라는 단점(?)을 극복할 수 있는 노하우가 있을까요? 2. 현재 React, TypeScript, Zustand 를 사용한 프로젝트를 하고 있는데 기술스택이 현재 시장에 적합한가요? 3. 프로젝트 기획(S.A 작성, MVP 설정) + 개발 + AWS 배포 + 2~3주간 유저테스트 까지 FE 3명, BE 3명 디자이너 1명이서 진행중인데 이러한 프로젝트가 강점으로 작용하나요? 4. 현업 선배님들이 신입을 채용할 때 < 이거 있으면 눈길이 간다! > 하는 이력서 항목이나 스킬이 있을까요? ** 많이 부족하지만.. Github 링크도 첨부해봅니다 https://github.com/Dustyspac"
