,subject,title,content
73,프론트엔드,SI 프론트엔드 개발자 커리어 고민,"안녕하세요. 중소si에서 일하고 있는 20대 중반 프론트엔드 개발자고, 리액트 사용하고 있습니다. 저는 올해로 6년차가 되었고 성장이 정체되고 있다는 생각과 좋지않은 처우 때문에 서비스 기업으로 이직을 생각하고 있습니다. 우선 저희 회사에 대해 말씀드리자면 프론트엔드 시니어는 계시지않고 오로지 혼자서 성장 해야하는 구조입니다. 기술스택은 리액트를 사용중이니 괜찮고, si 특성상 단순 반복성 업무가 많습니다. 두서가 길었는데요, 저는 단발성 프로젝트를 주로 했고 간단한 기능 수정, 요구사항 추가에 따른 추가 개발 및 개선과 대시보드, 모니터링 화면 개발을 주로 했습니다. 반복된 업무로 인해 업무적으로 어려움을 겪는 것도 없고 간단한 업무 위주다보니 그 중요하다는 문제 파악, 해결을 해본 경험 또한 없습니다. 있어봐야 대시보드, 모니터링 화면 로딩 속도 단축과 성능 최적화가 있겠네요. 저연차때 트러블 슈팅을 해본 경험이 있을 수도 있지만 아무것도 기억나지않습니다. 메모하는 습관을 들이지 못한 저의 잘못이죠. 그래서 지금 이력서엔 프로젝트별로 적어놓은 단순 업무 내용, 대시보드 개발, 모니터링 화면 개발, 공통컴포넌트 및 모듈 개발, 소규모 프로젝트 리드 경험 내용.. 그리구 진행하고있는 토이프로젝트가 있습니다. 정말 별 볼 일 없는 이력서라고 생각합니다. 5년이 넘는 세월동안 대체 어떤 것을 해온건지 그저 한탄스럽기만 합니다. 저는 서비스 기업으로 이직을 희망하고 있는데 그 흔한 트러블슈팅 경험도 없습니다. 이 상황에서 제가 준비할 수 있는 게 뭐가 있을까요? 사이드프로젝트를 진행하면서 생기는 문제에 대해 트러블슈팅을 해보고 이력서에 추가해야할까요? 지금은 현재 일하는 분야와 다른 기업으로 이직해서 경험을 더 쌓으려고 생각하고 있는데요, b2g 솔루션 기업에 지원한 상태이고 최종결과만을 기다리고 있는 상태입니다만, 이 기업은 약간 si, 솔루션 반반입니다. 만약 최종합격한다면 경험을 더 쌓을 생각으로 다니려고 하는데요, 좋은 생각일까요? 코테를 준비하라는 말들을 많이 찾아볼 수 있던데, 붙어도 면접에서 말할 게 없어서 불리할 것 같은데 어떻게 해야할까요? 생각할 수록 머리가 복잡해져서 방향을 못잡겠습니다. 방향을 어떻게 잡아야할지 도와주시면 감사하겠습니다. 긴 글 읽어주셔서 감사합니다."
74,프론트엔드,프론트엔드 개발 -> 퍼블리싱 직무로의 이직,"안녕하세요! 저는 현재 네임드있는 에이전시에서 프론트엔드 직무로 근무한지 얼마 안된 직장인입니다. 퍼블리싱 직무 -> 프론트엔드 개발 직무로 이직하는 사례는 많이 봤지만 그 반대의 경우는 거의 못본 것 같아서 글을 조심스레 올려봅니다.. 사실 취직활동을 할 때 퍼블리싱 직무를 목표삼아 준비를 하다가 어쩌다보니 프론트엔드 개발자가 되어버린 케이스입니다. 그래서 아직 리액트,뷰,타입스크립트,next 등.. 프레임워크를 활용하는 것이 약한 상태이고요. 운영 및 구축 프로젝트를 진행하면서 ui 구현은 정말 재밌게 하고 있지만 데이터 연동의 작업이 너무 버겁기도 하고, 무언가 기능 개발을 한다는 것이 재미보단 스트레스로 다가오더라구요.. 물론 프론트엔드 개발자로 취직하여 실무에서 정말 많이 배웠지만.. 더 나은 개발자가 되지는 못할 것 같습니다. 그래서 조금만 더 경력을 쌓아서 퍼블리싱 직군으로 이직을 할지, 그래도 악으로 깡으로 공부하며 더 버텨야할지 고민입니다..! 긴 글 읽어주셔서 감사합니다!"
75,프론트엔드,프론트엔드로 커리어를 결정했는데 고민이 있습니다. 조언부탁드립니다.,"안녕하세요. 문과 배경을 가진 신입 개발자입니다. 대학에서 문과를 전공하던 중, 진로에 대한 확신이 서지 않아 6개월 동안 Spring을 중점으로 한 국비 교육을 이수한 후, 100명이 근무하는 IT 회사의 R&D 부서에 입사하게 되었습니다. 이제 한달 조금 넘었네요. 입사 후 첫 주된 업무로는 React Native를 맡게 되었는데, 처음에는 React와 React Native에 대한 경험이 없어 조금 걱정스러웠습니다. 그럼에도 불구하고 실제로 프로젝트를 진행하면서 프론트엔드의 매력을 느꼈습니다. 원래 백엔드를 지망했던 저로서는 예상치 못한 반전이었습니다. 시간이 조금 지나서 프론트엔드로 커리어 방향을 결정했습니다. 현재 회사에서는 기존 React Native 프로젝트의 유지보수 및 다음 프로젝트가 Spring 기반으로 진행될 예정이라고 들었습니다. 이에 따라, 제가 프론트엔드 업무를 지속적으로 볼 수 있을지에 대한 불안감이 생겼습니다. 저의 목표는 2년 내에 대기업으로 이직하는 것입니다. 그렇기 때문에 지금이라도 프론트엔드에 대한 전문성을 높이고 싶습니다. 현재 React와 React Native에 대한 기본적인 지식은 어느 정도 갖추었지만, ES6와 같은 JavaScript의 깊은 이해도는 아직 부족합니다. 이제 어떤 공부를 중점적으로 먼저 해야 할지 고민 중입니다. React에 대한 깊은 이해를 더 해야 할까요? 아니면 ES6를 중점적으로 공부하여 코딩 테스트 준비도 함께 할까요? 조언 부탁드립니다"
76,프론트엔드,프론트와 백엔드에 기로에 서있는 취준생입니다. 질문있습니다,"안녕하세요. 저는 컴퓨터소프트웨어과 졸업생이고, 현재 내일배움캠프 리액트 4기 과정을 거치고 나서 회사 70군데에 지원을 하였습니다. 그중에서 3군데 면접이 와서 보고 왔는데 아쉽게 떨어졌습니다. 오늘 저는 취업 채용공고를 보다가 리액트와 추가적으로 프론트엔드와 백엔드를 원하는 회사 공고를 보고 마음이 와다았습니다. ( 참고로 저는 리액트 전에 PHP를 접했습니다. ) 제가 이길을 프론트로 가야하나 프론트 + 백엔드로 걸어가야할지 기로가 안섭니다. 그래서, 저에게 조언을 해주시면 감사하겠습니다."
77,프론트엔드,프론트엔드 취업에 대해 몇가지 질문있습니다.,안녕하세요 프론트엔드 취업을 준비중인 비전공자입니다. 취업관련 2가지 질문이 있습니다. 1. 작년 국비학원에서 백엔드팀과 협업 프로젝트를 했는데 당시 백엔드에서 스웨거를 이용하여 데이터를 받았는데 수료후에 스웨거 자체에서 오류가 있어 현재 배포한 프로젝트 주소로 들어가면 오류가 발생합니다. netlify로 다시 배포를 해서 나오긴하지만 이미지같은 데이터는 나오지 않는데 무슨 방법이 없을까요? 2. 국비학원 수료후 혼자 계속 공부한지 약 1년이 다되가지만 개발자분야로 취업이 힘들고 또 개인사정까지 생겨 정말 어쩔수없이 개발자분야가 아닌 단순업무 분야로 일을 다니면서 퇴근 후에 계속 프론트엔드 공부를 하고 있는데 인강을 보면서 할땐 코드가 해석이 되고 쉽다고 생각을 했는데 막상 혼자 코드를 작성을 할려고 하면 코드작성이 힘들더라구요. 혼자 코드를 작성한다고 해도 인강에서 봤던 코드를 외워서 적는 느낌도 드는데 혼자 코드를 작성할 수 있고 응용까지 가능한 공부방법이 있을까요? 실력이 많이 늘 수 있는 공부방법 조언부탁드립니다.
78,프론트엔드,백엔드 개발자 취업 시 포트폴리오 구성할 때 프론트엔드 질문입니다.,"백엔드 개발자로 취업을 희망하고 있는 사람입니다! 국비 교육을 들을 때 팀프로젝트 경험이 하나 있는데 아직 실력이 부족하다 생각하여 포트폴리오에 넣을 프로젝트를 한 개 정도만 더 해볼 생각입니다. 문제는 포트폴리오를 만들 때 프론트엔드의 비중을 얼마나 해야될지 감이 잘 안 옵니다! 국비교육 프로젝트를 할 때는 팀원 모두가 프론트엔드 + 백엔드를 같이 했습니다. 물론 백엔드 과정이었기 때문에 백엔드에 좀 더 초점을 뒀고 프론트엔드는 HTML, CSS, JS 로 아주 기초적인 것만 했습니다. 새롭게 포트폴리오를 하려고 하니 이 부분이 참 고민이 되더라구요. 화면을 안 만들고 백엔드 쪽에 집중해서 기능 구현(문제 해결 과정 포함) 및 테스트 코드에 집중을 하는 것이 맞을지, 아니면 화면을 react나 vue를 사용해서 까지는 아니어도 만들긴 해야되는 것인지 결정을 내리는 것이 어렵네요. 다들 이 부분에 대해서 어떻게 생각하시는지 의견 나눔해주시면 감사하겠습니다!"
79,프론트엔드,프론트엔드 배포가 의미하는 게 뭔가요?,"안녕하세요. 저는 프론트엔드 취준생이고 포폴을 위한 프로젝트를 진행하고 있습니다. 도메인을 구입해서 팀원이 AWS로 배포하였는데, 여기서 백엔드 팀원분이 프론트엔드를 따로 배포할 거냐고 하셔서 얼떨결에 해보겠다고 하고 Vercel로 배포한 상태입니다. 저는 배포라는 게 사용자가 이용할 수 있는 하나의 사이트만 하면 되는 줄 알았는데, 서버와 프론트 모두 따로 배포하는 건가요? 이유는 뭔가요? 현재는 작업을 localhost에서 하고 있는데 이제 작업 시 배포한 사이트를 활용 하거나 포폴을 첨부할 때 이력서에 기재하기 위해 하는 걸까요..? 답변 주시면 감사하겠습니다."
80,프론트엔드,프론트엔드 개발을 하다가 백엔드로 전향(?)하는 경우도 있나요?,"안녕하세요, 저는 현재 프론트 개발을 한지 1년이 조금 넘은 주니어 개발자입니다. 리액트를 꾸준히 공부하고 회사에서도 사용해왔는데요, 요즘 계속 백엔드에 더 눈이 가더라구요. 백엔드는 아주 작은 토이 프로젝트 하나 정도만 해본 경험이 있는데, 그때 백엔드가 더 재밌다는 걸 느꼈습니다. 하지만 일단 회사에서 프론트 개발자로 일하고 있으니 계속 하고는 있는데.. 제가 프론트를 남들보다 훨씬 뛰어나게 하는 것도 아니고, 흥미도 백엔드에 조금 더 있어서 고민입니다. 백엔드를 공부하면 풀스택이라고는 하지만 제가 풀스택이라고 할 만큼 프론트에 대한 전문성이 깊지는 않아서 또 고민이에요. 프론트를 더 공부하다가 백엔드까지 섭렵하여 풀스택 개발자를 하는 게 좋을까요? 아니면 지금이라도 백엔드로 전향하는 게 나을까요? 혹시 관련된 경험이 있으신 분 계실까요?"
81,프론트엔드,프론트엔드 취업 준비와 애프터이팩트,"안녕하세요. 이제 막 프로그래밍 언어를 배우고 프론트엔드로의 취업을 희망하는 느지막한 학생입니다. 이번 방학에 포트폴리오 준비 겸 취업준비를 위해 평소 제가 만들고 싶었던 웹페이지를 만들어보려고 합니다. 그러기 위해서는 제가 꼭 필요한 웹페이지 효과를 생각해봤고 검색을 해보았는데, Falling and stacking effect라고 하여 위에서 떨어지면서 아래부터 쌓이는 효과입니다. https://www.youtube.com/watch?v=wsMhvtSOzYY 파이썬 독학하고 C언어는 학원수강으로 빠르게 해치운 뒤 JS와 리액트로 웹페이지를 만드려고 했는데 이 효과는 애프터 이팩트를 통해 만들어내더라구요. 막상 토이프로젝트를 통해 웹페이지를 개발하려고 하니 애프터 이펙트가 필요한 것 같은데 실무적으로 프론트엔드 일을 하기 위해서는 애프터이펙트를 다룰 줄 알아야 하는건가요? 토이프로젝트로 포트폴리오 만들때 애프터이펙트 활용하면 좋은지 아니면 조금 과한 것인지 궁금합니다!"
82,프론트엔드,국비 수료 후 6개월 근무 후에 우테코or싸피,"안녕하세요. 제 소개를 하자면, 국비수료과정(html/css,js,react,node.js)을 올해 1월 말에 수료 후에, 2월말에 프론트엔드로 취업했지만 회사 사정이 어려워져 다시 9월중순 백수가 됐습니다.. 프론트로 들어갔지만 회사 내에서 배운 건 그저 코드를 볼 줄 아는 사람의 seo최적화와 간단한 퍼블리싱, 워드프레스를 통해서 웹사이트 제작하는 것이였습니다. 그리고 개발자님께 node.js로 만들어진 자동화프로그램에 대한 유지보수와 주문/문의 발생 시 텔레그램 알림 가게하는 것 정도 배웠습니다. 근데 문제는 제가 프론트엔드로 다시 지원하자니 리액트는 아직 국비수료에서 멈춰있고, 백엔드로 지원하자니 아직 노제에 대한 부족함이 너무크고... 그래서 일단 리액트+노제로 게시판페이지 만들기 프로젝트를 혼자 하고 있었습니다. 그러는 와중에 우테코 일정이 떠서, 작년부터 프리코스까지는 지원한 모두가 참여가능이라고 해서 도전해보려고 합니다. 근데 제가 여태 다뤄온 게 js인데 우테코 백엔드는 자바를 쓰더라구요. 그래서 급하게 인프런 강의와 책으로 공부하고 있는데 또 이렇게 하다보니 중단되어 있는 프로젝트도 맘에 걸리고.. 현재 프로젝트는 리액트+노제+몽고디비 로 게시판crud만 해놓은 상태입니다. 아직 검색과 회원crud등 할 게 많은데.. 프론트 지원을 위해 현재 상태에서 화면구현먼저 하고 지원하면서 프리코스 참여 or 코딩테스트와 자바공부하면서 프리코스에 올인 이 나을지 계속 고민돼서 이렇게 글을 쓰게 되었습니다. 그리고 이 이후에 우테코가 안된다하더라도 백엔드로 전향하고 싶다면 싸피나 42서울도 고려하고 있는데 그럴거면 지금 자바와 스프링을 꽉잡는 게 나을까요...? 벌써 스물 후반이라 고민이 많이 되네요.."
83,프론트엔드,부트캠프 수료까지 3주.. 현업 선배님들의 취업 조언이 필요합니다,"현재 부트캠프 프론트엔드 과정을 듣는 코린이입니다 개발을 시작하기 전 영상제작 / 디자인 업계에서 3년정도 일을 했었어서 자연스럽게 프론트엔드를 선택하게 되었고 현재 부트캠프 마지막 프로젝트를 마무리 하는 과정에 있습니다. . 이제 취업이 점점 현실로 다가오면서 걱정이 많이 생겨서 몇 가지 궁금했던 내용들을 질문으로 남겨 봅니다..! 현업 선배님들의 현실 꿀팁 부탁드립니다! 1. 신입 프론트엔드 개발자로 취업할 때, 부트캠프 출신이라는 단점(?)을 극복할 수 있는 노하우가 있을까요? 2. 현재 React, TypeScript, Zustand 를 사용한 프로젝트를 하고 있는데 기술스택이 현재 시장에 적합한가요? 3. 프로젝트 기획(S.A 작성, MVP 설정) + 개발 + AWS 배포 + 2~3주간 유저테스트 까지 FE 3명, BE 3명 디자이너 1명이서 진행중인데 이러한 프로젝트가 강점으로 작용하나요? 4. 현업 선배님들이 신입을 채용할 때 < 이거 있으면 눈길이 간다! > 하는 이력서 항목이나 스킬이 있을까요? ** 많이 부족하지만.. Github 링크도 첨부해봅니다 https://github.com/Dustyspac"
84,프론트엔드,프론트 엔지니어인데 어떤 백엔드 언어를 하는게 커리어 측면에서 도움이 될까요?,"안녕하세요 React TypeScript를 주력으로 개발하는 프론트엔드 엔지니어이며, 프론트엔드에 강점을 둔 풀스택 엔지니어가 되는 것이 목표에요. 현재 개인 프로젝트를 진행하면서 백엔드 개발이 필요한 상황이에요. 그래서 백엔드 개발 언어로 Java를 공부해볼지 혹은 Node를 사용할지 고민하고 있어요. 고민을 하다 보니, 풀스택 엔지니어로서 커리어에 도움이 될 만한 기술 스택을 배우고 싶은 생각이 들어요. 그래서 개발 속도가 느리더라도, 한국에서 사용률이 높은 자바 스프링을 사용해볼까... 혹은 상대적으로 사용률이 적지만, 익숙한 자바스크립트 타입스크립트를 사용할까 고민 중입니다. 백엔드에 대한 개발 지식이 무지해서 어떤 선택이 더 효율적이고 현명할지 모르겠네요 ㅜㅜ"
85,프론트엔드,중소기업에서 대기업 취업까지,"안녕하세요! 저는 이제 1년차 주니어 프론트엔드 개발자입니다. 비전공자 부트캠프 출신이고 꿈은 크게가지고 싶어서 언젠가 가고싶은.. 네카라쿠배당토.. 혹은 대기업 이직을 꿈꾸고 있습니다. 그래서 지금부터 차근차근 로드맵을 짜서 필요한 역량등을 갖추고 준비하고자 합니다. 그치만 어디서부터 어떻게 준비를 해야하는지.. 제가 생각하는 우선순위가 맞는지 조언을 구할 곳이 없어 여쭤보고 싶습니다. 현재 저희 회사에선 프론트 사수, 동료가 1명도 없어 너무 작은 우물안에서 혼자 헤엄치고 있는 기분이네요.. 더 작은규모나 체계가 잡히지 않은 회사로 이직하고싶진 않고.. 더 나은 회사를 가고자하니 욕심이 생겨서요 1. 다른 중소기업 스타트업 이직하며 경력쌓으면서 대기업에 경력직으로 지원이 유리한지 vs 빨리 스킬업해서 중고신입으로 들어가는게 더 유리한지 2. 프론트엔드 신입으로 지원할때 포트폴리오를 열심히 만들었었는데 제가 위에서 언급한 네카라쿠배 혹은 대기업은 일단 무조건 코딩테스트가 1순위 인가요? 프론트엔드는 자바스크립트로만 준비해도 되는지 혹은 구현과제를 더 중요시 하는지도 궁금합니다. 포트폴리오는 중소기업에서만 보고 대기업들은 안본다고 하던데.. 우선순위가 뭔지 잘 모르겠습니다.. 이런저런 고민으로 온라인에서 찾아보던중 네카라쿠배 출신 멘토가 진행하는 이직을 위한 교육 프로그램 등을 보았습니다. 혼자서 준비하게되면 몇년 걸릴거를 멘토가 있음으로써 단축시킬 수 있다는 문구를 보고 또 혹해서 고민중입니다.. 선배님들의 작은 조언 부탁드립니다."
86,프론트엔드,프론트엔드 개발자 대기업 SI 이직 고민,"안녕하세요, 현재 B2B 스타트업에서 일하고 있는 2년차 프론트엔드 개발자입니다. 올 하반기를 목표로 이직을 생각하고 있는데 대기업 업무 환경에 대한 안정성, 연봉 및 복지 등으로 대기업 SI에 중고 신입 내지 경력직으로 지원해보려고 합니다. 상반기 공고를 살펴보니, 공채든 경력직이든 백엔드 직무에 대한 공고가 많더라구요ㅠ.. 풀이 많이 없지만 프론트엔드 경력을 살려 이직을 도전할지, 백엔드 직무를 준비해서 도전해야할지 고민이 됩니다! 만약 백엔드로 도전하게 된다면 대기업 IT직무는 어떤것을 준비하는 것이 좋을까요?"
87,프론트엔드,프론트엔드 취준생... 눈 앞이 캄캄합니다.,"이제 대학교 4학년이고, 취업과 인턴을 준비하고 있습니다. 저는 프론트엔드 쪽에 취업하기를 희망하고, iOS나 안드로이드 쪽 둘 다 찍먹을 해봐서 둘 다 어느 정도 플젝 경험은 있습니다. 최근에는 iOS 위주로 개발을 하고 있고요. 암울한 건 신입 채용 공고를 보면 프론트 쪽은 보통 웹이나 하이브리드 쪽으로 개발하는 공고가 대부분이더라고요. 사실 프론트 쪽 개발 공고도 바닥이긴 합니다. 저는 iOS를 위주로 개발하는 회사를 가고 싶은데, 그렇게 많아 보이지도 않습니다. 그래서 취준을 위해서 웹 쪽으로 넘어갈 지 아니면 그냥 iOS나 안드로이드 쪽에 있어야 하는지 고민입니다. 혹은 둘 다 찍먹 수준으로 준비하되, 프론트 쪽 풀스택으로 준비할 지... 향후 1년을 내다봤을 때 어디 쪽이 취업이 조금 더 괜찮은 수준일까요? 아래 투표를 해주시면 감사하겠습니다."
88,프론트엔드,프론트엔드 개발자가 될려면 어떤 기술을 사용해야하나요?,프론트엔드 개발자가 되고 싶은 꿈을 꾸는 학생입니다. 요즘 개발자 채용시장이 많이 안좋다고 해서 걱정이 많긴 하지만 그래도 학과 자체가 이런 쪽이다 보니 선택지가 없어서 전공을 살려서 취업을 할려고 합니다. 그나마 학교 공부를 할 때 화면에 보여지는 부분이 재미가 있어서 프론트쪽으로 생각을 하고 있는데 혼자 공부를 하고 있는게 React를 공부중입니다. 그런데 지금 저가 유데미에서 인강을 들어가면서 공부를 하고 있는데 지금 듣고 있는 강의가 프론트 엔드 개발자가 될려면 들어야 되는 강의가 맞나? 이런 의구심이 들고 수업을 다 듣고 나면 다음에는 어떤 강의를 들어야 하나 방향성을 잘 못잡겠습니다. 그래서 프론트엔드 개발자가 될려면 어떤 기술들을 공부하고 어떤 식으로 준비를 하는게 좋은지 궁금합니다. 그리고 프론트엔드 개발자도 코딩을 할 때 알고리즘을 많이 사용하는지도 궁금합니다.
89,프론트엔드,프론트엔드 개발자의 동기부여는 어떻게 할 수 있을까요?,"2년차 프론트엔드 개발자입니다. 현재 이커머스 서비스를 개발하고 있습니다. 일을 하다보니 정말 제 일이 가치가 있는 일인지 잘모르겠다는 생각이 듭니다. 서비스로 임팩트를 창출하는 건 기획자가 ,사용자의 편의성은 UX/UI디자이너가, 성능 향상은 백엔드 개발자가 주도적으로 이끌어 나가는 것 같은데 그 사이에서 프론트엔드 개발자로서 주도적 역할은 무엇인지 모르겠습니다. 프론트 개발자도 성능향상에 기여할 수 있지만, 솔직하게 저는 이제는 인터넷 속도가 너무나 빠르고 프레임워크에서 성능향상을 충분히 잘 해주고 있어서 성능에 불편함을 별로 느끼지 못해서 동기부여가 잘 되지 않습니다. 기획과 디자인을 받아서 수동적인 일만 하는 것 같네요. 물론 그 과정에서 적극적으로 의견을 내지만요. 선배 프론트엔드 개발자 분들은 어떻게 스스로 동기부여를 하고 계신지, 이런 고민의 과정을 지나서 어떤 답을 내리셨는지 궁금합니다."
90,프론트엔드,제가 프론트엔드가 맞는건지 모르겠어요.,"제가 현재 프론트엔드로 다른 친구들과 백엔드 배포를 나눠서 학교에서 캡스톤을 하고 있는데요.. 근데 제가 아직 api를 연결을 제대로 하는 법도 모르고 어떻게 어디서 공부를 해야하는지 모르겠고 백엔드를 하면 백엔드도 재미있는데 이때까지 8개월동안 나는 프론트엔드로 뭐를 했는지도 모르겠고 이대로 하는게 맞나 싶어서 어떻게 해야 할까요..? 지금은 할 수 있는거는 axios로 데이터 불러오는것과 어느정도 시간만 주면 회원가입, 로그인 정도는 만들 수는 있는데 토큰을 어떻게 저장을 해야 하는지 모르겠어요..."
91,프론트엔드,프론트엔드 공부 방법에 대해 조언 부탁드립니다.,"안녕하세요 저는 프론트 희망하는 컴공과 2학년 학생입니다 프론트엔드 공부를 html,css도 잘 모르는채로 react를 공부하여 프로젝트를 진행하였으며 현재는 react-native 로 프로젝트를 진행 중입니다. 기초가 부족한채 프로젝트를 하다보니 chat gpt에 의존을 하게 되었고, 현재도 프로젝트를 진행중 이긴 하나 gpt의 의존도가 강한편입니다.. 그래서 프로젝트가 끝나고 제대로 공부를 하려고 하는데 너무 막막합니다. 제가 궁금한 점입니다 1. Html, js, 타입스크립트 등 처음부터 기본기를 다지고 리액트 공부를 할지 아니면 리액트만 공부해도 괜찮을지 2. 컴포넌트 구성은 어떻게 하는 것이 효율적인지 3. Gpt 의존도를 낮출 방법..(마인드 셋팅등..) 4. 이론을 배워도 실전에서 잘 써먹지 못하는데 해결 방법 5. 그 외의 공부 방법 조언 조언 부탁드립니다..!"
