,subject,title,content
123,연봉,공부하던것과 다른 직무 채용연계 인턴 지원하기 vs 하던 공부 마저하기,"안녕하십니까 백엔드 개발자가 되고자 자바, 스프링 공부하며 부트캠프를 알아보고 있는 취준생입니다. 프로젝트 경험을 쌓기 위해 부트캠프를 이것저것 지원하고 알아보고 있는 와중 현재 졸업예정인 캠퍼스앱에 추천채용 공고가 떠서 확인해보니 리눅스, 클라우드, 스크립트, 모니터링 툴 등의 경험이 있는 사람을 우대하는 시스템 관리자(sa) 경력/신입을 채용하는 공고였습니다. 아예 다뤄본 적도 없는 것들이고 지원한다 해도 붙을거란 기대도 안하고 붙더라도 정규직 전환까지도 기대하긴 어렵겠지만 높은 연봉과 추천채용에 혹 해서 지원이라도 해볼까 하는 마음이 있습니다. 이 경우 제가 하던 공부와는 다른 직무의 3 4개월 인턴 경험이 제가 준비하던 커리어로 돌아가게 될 경우, 단순 돈만 받고 끝나버린 일회성 경험으로 끝나지 않을까 해서 망설여집니다. 앞으로도 공부를 하며 준비하던 직무와 거리가 있는 직무의 공고를 보고 지원하여 시간을 투자해볼만한 가치가 있는지, 아니면 하던 것에 집중을 하는게 더 좋을지 선배님들의 생각은 어떠신지 궁금합니다."
124,연봉,AI부트캠프를 수료하고 신입으로 입사했는데 고민입니다,"이전에 다니던 직장을 관두고 AI부트캠프 6개월을 수료하고 지난 9월 기존 직종에서 AI를 활용하는 회사에 연봉을 좀 깎는 대신 비교적 쉽게 입사하여 컴퓨터 비전쪽으로 일하고 있습니다. 그런데 문제는 방향성을 잃었다는 겁니다. 사수도 없고, 전임자의 코드만 떡하니 남겨있는 상황에 이 코드가 좋은지 나쁜지도 모른 채 일단 사업을 마무리했고, 이번에 성능 개선을 해야한다는데 전임자가 좋다는 사전학습 모델은 이것저것 다 건드려놔서 더 이상 어떻게 해야할지도 모르겠습니다. 개발 문화는 커녕, 물어볼 사람도 없고 내가 짜는 코드가 좋은지 나쁜지도 몰라서 chatGPT에 의지하여 코딩 중입니다. 기본적으로 회사가 자연계열이라 그런건지 위에서는 대학 교수랑 토론할 줄 알아야 하는데 그거로 되겠냐? 개선 방안을 무조건 논문 근거로 찾아오라면서 난리고 CNN 위주로 논문 찾아가면 이게 우리꺼에 맞는거냐 어떻게 적용하는거냐? 이러는데 github에 나와있는거도 극소수라서 거의 다 직접 만들고 있는데 성능은 거기서 거기입니다. 그래서 지금 이게 맞는건가 싶어서 현타 온 상태인데, 어떻게 하면 좋을까요?"
125,연봉,프론트엔드 백엔드 고민,안녕하세요 현재 3학년 재학중인 한 컴공생입니다. 진로는 웹개발자가 꿈인데요 처음에는 당연히 프론트를 할생각으로 부트캠프도 프론트로 지원하고 했습니다. 그런데 주변에 다들 백엔드 한다 하고 인터넷 같은 글에서도 백엔드의 연봉도 더 높고 구하는 사람도 더 많다고 하더라구요. 그런데 저는 사실 꾸미는것도 좋아하고 보이는걸 좋아해서 프론트를 잡고 시작했는데 아무래도 컴퓨터공학 피가 흘러서 인지 복잡한것도 좋아하고 백엔드가 더 매력적으로 보이더라구요ㅜ 아직 3학년이라 둘다 해볼수 있다곤 하지만 하나만 제대로 하기도 힘들다는 의견에 동의해서 너무 고민이 됩니다ㅜㅜ 요약하자면 프론트로 길을 잡고 가고 있는데 1. 주변에서 다 백엔드를 하려해서 좀 흔들린다 2. 인터넷에서 검색해봐도 백엔드가 더 좋고 전망도 더 좋고 돈도 더 많이 준다한다 이것도 굉장히 중요하게 생각한다 3. 나는 디자인도 좀 관심있고 눈에 보이는게 좀더 재밌지 않을까!싶어서 프론트해야지 라고 시작했다 그래서 더 확고하게 길을 잡지 못하겠다 입니다.. 풀스택도 좋다고 하시는데 일단 저는 하나라도 제대로 해보고 싶기에.. 조언 간략하게 부탁드립니다ㅜ
126,연봉,제가 개발자를 해도 되는걸까요?,"저는 개발자가 가진 '높은 연봉을 바랄 수 있는 가능성'에 혹해서 뛰어든 비전공자입니다. 국비교육 6개월 받았습니다. 수료증 받은지 2년 다 되어 가고요, 그동안 어영부영 알바만 전전하다 최근 들어 교재와 인강을 통해 자바부터 다시 공부 중입니다. 무엇이 되고싶은지도 일찌감치 정했놓았습니다. 백엔드로 시작해서 서버관리/DBA 직종으로 가겠다는 아주 느슨하고 대책 없는 계획이지만.. 나름 2년 전 국비 교육 받기 전 부터 생각했던 사안입니다. 그러나 저에겐 비전이 없습니다. 개발자가 아니면 안된다는 절박함도 부족하고, 개발을 즐기지도 않는 것 같습니다. 하고 싶은 프로젝트도 당연히 없고요.. 개발자라면 퇴근 후에도 주말에도 코딩 삼매경이어야 한다는 글을 어디선가 본 기억이 납니다. 하지만 저는 그럴 자신이 없습니다. 여러분은 무슨 생각으로 개발자가 되셨나요? 어떤 개발자가 되고싶으신가요? 어떤 노력을 하고계시나요? 저 같은 성격도 개발자로서 자리잡을 수 있나요? 이 쯤에서 손 떼는게 맞을까요? 나이는 아직 20대 중반입니다."
127,연봉,"이직, 퇴직 사유 어떻게 말하는게 좋을까요",연초에 약속했던 연봉협상 10% 부결되었고 다른 복지들도 다 무산되었습니다. 추가로 대표와 가치관의 차이나 대표의 언행 때문에 여러번 말을 나누면서 서로 불편해진 상황에서 퇴사하게 되었는데 이런 저런 부분에서 회사와의 신뢰가 깨졌다 라고 말해도 무관할까요?
128,연봉,독학으로 취업이 가능할까요?,안녕하세요 24살 전역을 한달 정도 남긴 사람 입니다. 이제 전역을 앞두고 있다보니 현실로 돌아간단 생각에 불안한 감정이 생기며 이젠 취업에 대해 많은 생각이 들더라구요 저는 고등학교 졸업 후 대학진학에 실패해서 군대에 빨리 갔다 온 후에 예전부터 꿈 꾸었던 게임프로그래머를 향해 도전해 볼 생각이었습니다. 하지만 군대에서 건강상의 문제가 발생하여 이런저런 문제를 해결하다 보니 2년이란 공백이 생기고 이제서야 전역을 앞두게 되었습니다. 그렇게 게임프로그래머가 되는 여러 방법들에 대해 알아보았지만 대체로 대학에 다니라고들 권하시더군요. 하지만 다시 수능공부를 해 대학에 간다는 것에 대해선 자신이 없었습니다. 그래서 다른 길을 알아 본 것이 학점은행제 였습니다. 그러나 이 또한 많은분들의 의견들이 갈리더라구요 그 중에서 취업 후에 방통대나 학은제를 이용하시는 분들이 있다는 것을 알게되었습니다. 그래서 저는 독학으로 2~3년 공부 후 국비지원으로 취업에 도전한 후에 나중에 되서야 제가 학력 부분에서 후회가 남는다면 채우는 것이 낫지않을까 라는 생각이 들었습니다. 하지만 이런 전제도 취업이 되어야지 의미가 있다 생각하여 제목과 같이 질문을 남깁니다. 저는 연봉이 낮더라도 취업이 된다면 상관없습니다. 저는 대학에서 전공공부를 한것도 경력이 있는 것도 아니니 당연히 낮아야지요 저는 악덕기업 만 아니면 다행이라 생각합니다. '어느 회사든 경력이 쌓이면 더 좋은 대우를 받을 수 있지 않을까?' 라는 것이 저의 생각입니다. 말이 두서가 없었습니다. 글도 잘 못 쓰면서 당장 앞날이 걱정이라 이렇게 질문남깁니다. 고졸이지만 독학으로 공부 후 국비지원 학원을 통해 취업 할 수 있을까요?
129,연봉,모르는게 너무 많습니다.,"안녕하세요. 프론트엔드로 1년정도 근무하고 있습니다. 주로 회사에서 하는일은 피그마 오면 화면 만들고 api 연동해서 crud 정도 합니다. 그나마 새롭게 해본건 라이브러리(차트,오디오...) 사용 해보고 , node 프록시 설정이나 해본게 다네요. 회사에서 프론트개발자가 저 혼자라서 개인 git 말고 협업을 위한 git은 쓰지도 않습니다. 성능최적화, 테스트코드? 이런 건 뭔지도 모릅니다.. 그냥 구현돼서 동작하면 아무도 뭐라고 안 합니다. 저는 고민이 있습니다. 더 높은 연봉을 받고 이직을 하고 싶은데 아무리 생각해도 회사에서 이 이상 돈을 주고 저를 고용할 이유가 없다고 생각합니다. (뭐 협업을 잘 할것같지도 않고,뭔가 기술적으로 인정받을만한 것을 만드는 것도 아니고, 하루가 다르게 성장하는 gpt 까지 있는 마당에 나를?) 그래서 나만의 경쟁력을 키워야 겠다는 생각이 드는데 막상 뭘 해야할지 잘 모르겠습니다. 조언 좀 부탁드립니다."
130,연봉,디자이너 출신 개발자입니다.. 디자인과 개발을 동시에 하시는분 계신가요?,현재 1년차 프론트엔드 개발자입니다. 3년 정도의 디자이너 경력을 가지고 있습니다. 이직을 시도중인데 그중 한곳에서 최종 합격을 했는데 디자인을 같이 할수 있냐는 질문을 받았습니다. 디자인 프로세스가 마음에 들지 않았고 그래서 개발자로 커리어 전환을 하게되었습니다. 개발자를 준비하면서 당연하게 디자인이 필요하여 저는 매 프로젝트마다 제가 디자인을 하면서 조금은 자유롭게 디자인을 하다보니 그만두기전에 디자이너의 싫었던 부분들이 사라지긴 했습니다. 근데 개발과 디자인을 같이 하게된다면 커리어적으로 개발의 전문성을 잃지는 않을까 라는 생각을 하게되었습니다. 혹시나 저처럼 병행을 하시는분이 있으시거나 선배님들의 의견이 궁금합니다.. 참고로 연봉을 앞자리를 바꿀수있다보니 조금은 끌리는것 같기도 합니다..
131,연봉,마케터 이직고민,한 조직에 오랜기간 있다보니 성장이 정체되어있고 다양한 비즈니스에서 경험을 쌓아보고 싶은데 막상 연봉에 눈을 낮추기가 어렵네요ㅜㅜ 연봉을 낮추면서라도 이직에 도전한다 vs 천천히 갈곳을 찾아보고 high standard를 유지한다 둘중 어떤 방향을 추천하시나요?
132,연봉,SI 회사 다니시는분들! 초급 웹개발자 연봉!,SI회사 다니시는 개발자님들! 초급 웹 개발자 연봉 어느정도 받으세요?? 1년차는 어느정도들이신지 인터넷 개발관련 사이트보면 3200정도 되던데 그건 대기업 기준인가 싶기도하고 ㅠㅠ (참고로 저는 아직 정처기없고 학점은행제 진행중이라..)
133,연봉,신입 개발자 선배님들의 조언을 구해보고 싶습니다.,"<요약> 현재 회사의 연봉과 워라밸은 만족스러운데 제가 쌓고자 하는 커리어와 방향과 기술이 다르다면 계속 다니며 1년 채우고 이직 하는게 좋을지, 지금 바로 이직을 다시 하는게 좋을지 고민입니다. 서비스 회사에 경력 1년 개발자가 지원함에 있어 이전 회사의 경력상 업무 경험 뿐 아니라 본인이 개인적으로 노력한 부분을 인정해주는지도 궁금합니다. —아래는 전문입니다.— 안녕하세요 비전공에서 국비지원으로 개발을 시작해서 근무중인 신입 개발자 입니다. 첫 회사는 솔루션 회사였는데 지원했던 백엔드가 아닌 프론트 업무 + 주에 70시간이 넘는 강도 높은 야근과 주말출근으로 퇴사를 했습니다. 현재 재직 중인 회사에서 스프링 부트로 백엔드를 시켜준다고 하여 바로 이직을 했고 세 달째 근무 중입니다. 하지만 현재 회사에서는 입사 전에 했던 말과 다르게 10년도 더 된 코드로 돌아가는 시스템의 운영 업무를 배정 받았습니다. 면접 때 얘기했던건 신사업이고 아직은 신사업에 큰 진전이 없으니 회사에서 운영 중인 시스템 운영 업무를 먼저 익히라고 하더라구요. 아키텍쳐도 코드 스타일도 낯선데, 도움을 주는 사수도 없는 상황입니다. 워라밸과 연봉은 만족스러워서 퇴근 후 스프링 부트와 jpa 등을 지속적으로 공부 중인데, 회사에서 쌓은 커리어가 방향이 달라도 개인적으로 공부하고 수행한 프로젝트가 있다면 이부분을 인정받을 수 있는지 궁금합니다."
134,연봉,계약직의 재계약 궁금한게 있습니다!,안녕하세요. 제조회사에서 디자인을 담당하는 일을 하고 있습니다! 3개월계약하고 1년3개월을 계약해서 총 1년 6개월을 계약한 계약직입니다 곧 이개월뒤면 계약이끝나는 상황인데 아직 재계약을 하겟다 정규직전환으로 바꾸겟다 라는 말은 없어요! 만약 삼개월의 재계약을 한다면 제가 연봉협상을 제시해도 되는 걸까요? 일은 점점 많은 일을 하게되었는데 연봉은 변동없이 진행하자는 식으로 팀장님께서 말씀하시더라구요
135,연봉,신입개발자 취업 고민입니다. sm vs 솔루션,안녕하세요 정보통신공학과 전문대졸업하고 자바국비수료후 취업준비중입니다. 회사 두곳 붙었는데 어디로 입사하는것이 좋을까요? 첫번째회사는 집에서 40분거리이고 공공기관 금융기관 sm 쪽입니다. 격주로 주 4일근무 이고 야근은 거의 없고 연봉은 3천 입니다. 회사 규모는 60명 정도입니다. 두번째 회사는 집에서 55분거리이고 클라우드 플랫폼 솔루션 업무이고 연봉 3천에 회사규모는 150 명정도 입니다. 우선 내년에 1년 야간반으로 학사 딸려고 생각중입니다. 그리고 1년다니고 si로 갈려고 하는데 어디 회사로 가는것이 좋을까요?? 선배님들 조언좀 부탁드립니다.
136,연봉,아직 미흡한 특성화고등학교생입니다 공부 방향성에 대해 여쭙고 싶습니다,"안녕하세요 저는 서울디지텍고등학교에 다니고 있는 고등학교 1학년 학생입니다 혼자 공부하다가 여쭙고 싶은게 많아 말씀드립니다 지금 제가 따로 공부하고 있는건 백엔드 쪽으로는 자바를 주력으로 파이썬, c++등을 어깨너머로 배우고 있고 프론드엔드는 html css 자바스크립트등 당장은 기본적인 것만 학교에서 배우는것을 바탕으로 공부하고 있습니다. 자바가 가장 재밌기도 하고 기본적으로 객체지향에 매력을 느껴서 자바만 열심히 하고 있는데.. 진학보단 병역 특례를 받고 당장 빨리 취업해서 돈을 많이 버는게 목적이다 보니 현재 제가 공부하고 있는 방향성이 맞는지 너무 헷갈립니다 웹,앱을 비롯하여 빅데이터 인공지능등등 전 제 적성보단 열심히했을때 연봉이라는 추후 결과가치가 높은 쪽으로 공부 방향을 잡고 싶습니다 분야에 상관없이 페이가 쎄고 미래가 유망한 언어 및 공부 방향성을 추천해주세요 자바를 일단 계속 열심히 해야할까요? 프론트엔드나 백엔드중에 어떤 쪽이 연봉이 더 센가요? 답변 부탁드리고 긴글 읽어주셔 감사합니다"
137,연봉,자바 vs .net,"언어 선택에 고민을 하고있는 대학교 3학년 학생입니다. 전문가과정을 들으려고하는데 .net을하면 제가 거주중인 대전에서 높은초봉을 받으며 일을 할 수있고, 자바를 하면 서울로가 보다 낮은 연봉으로 일을할 기회가 생깁니다. 이 말만 들으면 당연히 .net을 선택하는게 맞는데 주변에서 '.net은 시장 규모가 좀 작아 이직이 어려울 수 있다 ' 라는말과 '자바가 비전이좋다'라는 말을 들어 무엇을 공부해야할지 모르겠습니다. .net과 java를 고민중인 저에게 무엇을 공부하는게 미래에 더 좋을지 좋은말씀 부탁드립니다."
138,연봉,웹퍼블리셔로 시작했다가 프론트엔드 개발자 이직 괜찮을까요,"프론트엔드로 취업준비를 꾸준히 하고있는 비전공 국비 지원자입니다. 국비 수료 이후 몇개월동안 따로 리액트 공부도 더하고 포폴 보완+이력서도 많이 넣었었는데 생각보다 연락오는곳들이 정말 없네요... it노조에 올라왔던곳 연락와서 당황스러운 기억도 있구요... 이번에 면접 본 곳이 프론트앤드 개발모집으로 공고를 내놓고 막상 면접을 보러가니 프론트앤드 개발팀의 웹 퍼블리셔 직군이라고 설명을 해줬습니다. Html,css,바닐라자바스크립트 사용할것같고 연봉은 최저시급입니다 제일장점은 거리가 가깝다는거네요.ㅎㅎ.. 국비 수료후 공백기도 어느정도 있고 취업시장도 그렇게 좋지않은데 일단 퍼블리셔로 시작했다가 이직준비를 하면서 프론트엔드 개발자로 넘어갈 수 있을지 고민이 됩니다. 야근은 없는곳이라 정처기같은거 추가로 준비해볼 생각이구요.. 추후 이직시 기업입장에선 퍼블경험이 있는 프론트엔드 개발지원자에 대해 어떻게 생각할지가 궁금합니다...퍼블리셔로 일하게 된다면 최대 일년-일년반정도 생각하고 있습니다 제가 30대라서 3-4년을 채우고 지원하기에는 무리가 있을것 같아서요. 어쨋든 경험을 해본다는거 자체에 의미를 두고 일해보는게 나을지 고민이 많이 됩니다. 답변 부탁드립니다~!"
139,연봉,퇴사하고 싶습니다 타의적워커홀릭 저는 코더인가요 과연 이직을 할 수 있을까요,"si로 웹개발을 하고있습니다 현재 경력은 곧 3년을 채웁니다. 월요일부터 금요일까지 오전 9시에 출근해서 빠르면 오후9시 늦으면 11시에 퇴근합니다 빡빡한 일정때문에 주말에도 출근해서 저녁까지 일을 하고 퇴근합니다 이런 일정이 개발자면 당연한건가라는 생각도 들지만 현 직장이 포괄임금제라 야근수당도 나오지않고 연봉도 낮습니다 돈도 돈이지만 점점 제자신을 돌볼 시간이 없어지고 있습니다 휴식시간도 그렇고 친구들을 만나기도 어려워지고 하고싶은 공부도 할 수가 없습니다 입사 초반에는 자격증공부도 하고 언어공부도 취미로 했지만 현재는 여유시간이 없어 자기계발을 하기 어려워졌습니다 회사에서는 선임들이 줄줄이 퇴사해서 경력에 맞지 않는 업무량을 해결하고 있습니다 이직을 하자니 기술적으로 부족할까봐 걱정이 됩니다 예를 들어 쿼리는 작성할 수 있으나 마이그레이션이라든지 데이터포팅이라든지 큰 업무는 처리하지못합니다 화면을 그리고 기능을 달 수는 있지만 개발환경을 구성하고 서버를 구성하는 기반적인 업무는 잘모르겠습니다 기껏해야 자바, 자바스크립트, sql 정도 할 수 있는데 채용공고를 보면 클라우드라든지 사용해보지않은 언어들이 천지삐까리라 지원조차 못할것같은 마음에 이 글을 써봅니다 간단한 조언도 좋습니다 방향을 잃었어요 도와주시면 감사하겠습니다"
140,연봉,스프링과 aws 안 쓰는 솔루션 회사에 취직하게 되었습니다,안녕하세요 얼마 전 스프링과 aws 안 쓰는 솔루션 회사에 취직하게 되었습니다. 자바 개발자를 뽑길래 당연히 스프링은 쓰는 줄 알았는데 안 쓴다고 하더라구요. Aws도 대기업과 프로젝트를 많이 하다보니 자체적으로 사용하는 거 같습니다(자세히는 모르지만 온프레미스 아닐까요?) 저는 서비스 회사를 최종 목표로 하고 있는데요. 다녀보니 여기는 대기업과 프로젝트도 많이하고 솔루션 자체가 굉장히 커서 배울 것도 많고 중소기업치고 복지와 연봉도 나쁘지 않아 열심히 다니고 싶은데 그 시간 만큼 스프링과 aws를 사용하지 않으니까 추후 이직할 때 경력에 비해 기술적인 실력 부족으로 굉장한 불이익이 될까 고민입니다 그래서 사이드 프로젝트도 생각하고 있는데 현업에서 하는 거랑은 또 확실히 다르니까 그 차이를 사이드 프로젝트로 잘 메울 수 있을 까 생각도 들고 또 제 나름대로 남들과 다른 경쟁력을 갖추려고 하지만 과연 괜찮을 지 고민입니다 스프링과 aws 안 쓰는 솔루션 회사 다녀도 괜찮을까요? 많은 현업 선배님들의 의견을 구합니다ㅠㅜ
141,연봉,비전공자 사이버대/특수대학원/부트캠프...,"안녕하세요 현재 커리어 전환을 목표로하고 있는 비전공자입니다. 개발관련하여 지식은 1도 없으나, 앱 창업 경험이 있어 대략적인 생태계만 알고 있는 정도입니다. 다만, 개발언어를 공부해본적이 없어서 사실상 노베이스라고 하는 것이 맞습니다. 현재 나이는 34세인데, 아이의 학업을 위해 40살정도에 미국으로 건너가게될 것 같아요. 미국에서 할 수 있는 일을 찾다가 평소에 관심이 많았던 개발쪽으로 커리어를 전환하기로 결심하였습니다. 지금까지의 경력은 기업 인사팀에서 약 7년정도 일한 것이 전부여서 사실상 커리어 전환에 도움이 될 것 같진 않고요 이런 상황에서 웹개발(프론드엔드)로 진로를 정하고 공부를 해보고자 합니다. 제 상황을 간략하게 말씀드리자면, 미국으로 가기 전에 가능하면 한국에서 커리어를 전환해서 최소한이라도 경력을 만들고 싶지만 처자식이 있다보니 연봉이 너무 적은 기업으로의 이직은 어렵습니다. 또한, 아이가 아직 어리기도 하고 생계 때문에라도 현 직장을 그만두고 공부에 올인하기도 어려운 상황입니다. 즉, 소득이 끊길수는 없는 상황이란 것이죠. 따라서 직장과 공부를 병행해야 하는 상황입니다. 현 직장을 그만둘 수는 없고, 이직을 할 실력은 없으나 어느정도 안정적인 IT회사로의 이직을 목표로하고 있고 최소 5년 후에는 미국으로 건너가서 석사 또는 취업을 하고자합니다. (쓰고나니 욕심이 많고 복잡하네요) 다만, 아직 5~6년이란 시간이 있어서 공부를 할 수 있는 시간은 좀 있는 것 같습니다. 아무튼 제가 알아본 바로는 특수(야간)대학원 / 사이버대학교 / 부트캠프 정도를 통해서 커리어 전환이 가능할 것 같은데요 특수(야간)대학원 : 비용도 비용인데 공부를 따라갈 수 있을까 무서움 사이버대학교 : 고려대사이버대/한양대사이버대 컴공학과 (3학년 편입) > 취업 부트캠프 : 대부분이 전업이더라구요.. 파트타임은 제로베이스 부트캠프정도인것 같습니다... 우선 제로베이스(온라인수업)을 수료하고 유명 부트캠프(우테코,소마,네부캠 등)을 들어가서 공부해서 취업하기 정도로 생각을 해보았습니다. 물론 독학도 있지만 일단은 독학 공부를 성공해본적이 없고 ㅎㅎㅎ 체계적인 커리큘럼상에서 공부를 하고싶은 마음이 있습니다. 제 상황에서 저는 어떤 선택을 하면 좋을지 지혜를 빌려주십쇼"
